root@lamp-s-1vcpu-1gb-tor1-01:~# clear
root@lamp-s-1vcpu-1gb-tor1-01:~# tcpdump -i eth0
tcpdump: verbose output suppressed, use -v or -vv for full protocol decode
listening on eth0, link-type EN10MB (Ethernet), capture size 262144 bytes
20:09:10.821479 IP lamp-s-1vcpu-1gb-tor1-01.ssh > CPEf81d0fa9f3e3-CMf81d0fa9f3e0.cpe.net.cable.rogers.com.51494: Flags [P.], seq 3274708468:3274708576, ack 76490519, win 1452, length 108
20:09:10.821578 IP lamp-s-1vcpu-1gb-tor1-01.ssh > CPEf81d0fa9f3e3-CMf81d0fa9f3e0.cpe.net.cable.rogers.com.51494: Flags [P.], seq 108:144, ack 1, win 1452, length 36
20:09:10.821670 IP lamp-s-1vcpu-1gb-tor1-01.ssh > CPEf81d0fa9f3e3-CMf81d0fa9f3e0.cpe.net.cable.rogers.com.51494: Flags [P.], seq 144:252, ack 1, win 1452, length 108
20:09:10.821743 IP lamp-s-1vcpu-1gb-tor1-01.ssh > CPEf81d0fa9f3e3-CMf81d0fa9f3e0.cpe.net.cable.rogers.com.51494: Flags [P.], seq 252:288, ack 1, win 1452, length 36
20:09:10.823475 IP lamp-s-1vcpu-1gb-tor1-01.ssh > CPEf81d0fa9f3e3-CMf81d0fa9f3e0.cpe.net.cable.rogers.com.51494: Flags [P.], seq 288:508, ack 1, win 1452, length 220
20:09:10.823570 IP lamp-s-1vcpu-1gb-tor1-01.ssh > CPEf81d0fa9f3e3-CMf81d0fa9f3e0.cpe.net.cable.rogers.com.51494: Flags [P.], seq 508:544, ack 1, win 1452, length 36
20:09:10.823676 IP lamp-s-1vcpu-1gb-tor1-01.ssh > CPEf81d0fa9f3e3-CMf81d0fa9f3e0.cpe.net.cable.rogers.com.51494: Flags [P.], seq 544:748, ack 1, win 1452, length 204
20:09:10.823762 IP lamp-s-1vcpu-1gb-tor1-01.ssh > CPEf81d0fa9f3e3-CMf81d0fa9f3e0.cpe.net.cable.rogers.com.51494: Flags [P.], seq 748:784, ack 1, win 1452, length 36
20:09:10.823882 IP lamp-s-1vcpu-1gb-tor1-01.ssh > CPEf81d0fa9f3e3-CMf81d0fa9f3e0.cpe.net.cable.rogers.com.51494: Flags [P.], seq 784:988, ack 1, win 1452, length 204
20:09:10.875204 IP CPEf81d0fa9f3e3-CMf81d0fa9f3e0.cpe.net.cable.rogers.com.51494 > lamp-s-1vcpu-1gb-tor1-01.ssh: Flags [.], ack 252, win 508, length 0
20:09:10.875283 IP lamp-s-1vcpu-1gb-tor1-01.ssh > CPEf81d0fa9f3e3-CMf81d0fa9f3e0.cpe.net.cable.rogers.com.51494: Flags [P.], seq 988:2464, ack 1, win 1452, length 1476
20:09:10.875316 IP CPEf81d0fa9f3e3-CMf81d0fa9f3e0.cpe.net.cable.rogers.com.51494 > lamp-s-1vcpu-1gb-tor1-01.ssh: Flags [.], ack 988, win 513, length 0
20:09:10.875538 IP lamp-s-1vcpu-1gb-tor1-01.ssh > CPEf81d0fa9f3e3-CMf81d0fa9f3e0.cpe.net.cable.rogers.com.51494: Flags [P.], seq 2464:2652, ack 1, win 1452, length 188
20:09:10.875629 IP lamp-s-1vcpu-1gb-tor1-01.ssh > CPEf81d0fa9f3e3-CMf81d0fa9f3e0.cpe.net.cable.rogers.com.51494: Flags [P.], seq 2652:2688, ack 1, win 1452, length 36
20:09:10.875735 IP lamp-s-1vcpu-1gb-tor1-01.ssh > CPEf81d0fa9f3e3-CMf81d0fa9f3e0.cpe.net.cable.rogers.com.51494: Flags [P.], seq 2688:2892, ack 1, win 1452, length 204
20:09:10.875818 IP lamp-s-1vcpu-1gb-tor1-01.ssh > CPEf81d0fa9f3e3-CMf81d0fa9f3e0.cpe.net.cable.rogers.com.51494: Flags [P.], seq 2892:2928, ack 1, win 1452, length 36
20:09:10.875946 IP lamp-s-1vcpu-1gb-tor1-01.ssh > CPEf81d0fa9f3e3-CMf81d0fa9f3e0.cpe.net.cable.rogers.com.51494: Flags [P.], seq 2928:3116, ack 1, win 1452, length 188
20:09:10.876048 IP lamp-s-1vcpu-1gb-tor1-01.ssh > CPEf81d0fa9f3e3-CMf81d0fa9f3e0.cpe.net.cable.rogers.com.51494: Flags [P.], seq 3116:3152, ack 1, win 1452, length 36
20:09:10.876155 IP lamp-s-1vcpu-1gb-tor1-01.ssh > CPEf81d0fa9f3e3-CMf81d0fa9f3e0.cpe.net.cable.rogers.com.51494: Flags [P.], seq 3152:3356, ack 1, win 1452, length 204
20:09:10.876322 IP lamp-s-1vcpu-1gb-tor1-01.ssh > CPEf81d0fa9f3e3-CMf81d0fa9f3e0.cpe.net.cable.rogers.com.51494: Flags [P.], seq 3392:3596, ack 1, win 1452, length 204
20:09:10.876490 IP lamp-s-1vcpu-1gb-tor1-01.ssh > CPEf81d0fa9f3e3-CMf81d0fa9f3e0.cpe.net.cable.rogers.com.51494: Flags [P.], seq 3632:3836, ack 1, win 1452, length 204
20:09:10.876701 IP lamp-s-1vcpu-1gb-tor1-01.ssh > CPEf81d0fa9f3e3-CMf81d0fa9f3e0.cpe.net.cable.rogers.com.51494: Flags [P.], seq 3872:4076, ack 1, win 1452, length 204
20:09:10.876911 IP lamp-s-1vcpu-1gb-tor1-01.ssh > CPEf81d0fa9f3e3-CMf81d0fa9f3e0.cpe.net.cable.rogers.com.51494: Flags [P.], seq 4112:4316, ack 1, win 1452, length 204
20:09:10.877063 IP lamp-s-1vcpu-1gb-tor1-01.ssh > CPEf81d0fa9f3e3-CMf81d0fa9f3e0.cpe.net.cable.rogers.com.51494: Flags [P.], seq 4352:4556, ack 1, win 1452, length 204
20:09:10.906435 IP CPEf81d0fa9f3e3-CMf81d0fa9f3e0.cpe.net.cable.rogers.com.51494 > lamp-s-1vcpu-1gb-tor1-01.ssh: Flags [.], ack 4316, win 513, length 0
20:09:10.906507 IP lamp-s-1vcpu-1gb-tor1-01.ssh > CPEf81d0fa9f3e3-CMf81d0fa9f3e0.cpe.net.cable.rogers.com.51494: Flags [P.], seq 4592:6032, ack 1, win 1452, length 1440
20:09:10.906530 IP CPEf81d0fa9f3e3-CMf81d0fa9f3e0.cpe.net.cable.rogers.com.51494 > lamp-s-1vcpu-1gb-tor1-01.ssh: Flags [.], ack 4556, win 512, length 0
20:09:10.906723 IP lamp-s-1vcpu-1gb-tor1-01.ssh > CPEf81d0fa9f3e3-CMf81d0fa9f3e0.cpe.net.cable.rogers.com.51494: Flags [P.], seq 6032:6220, ack 1, win 1452, length 188
20:09:10.906829 IP lamp-s-1vcpu-1gb-tor1-01.ssh > CPEf81d0fa9f3e3-CMf81d0fa9f3e0.cpe.net.cable.rogers.com.51494: Flags [P.], seq 6220:6256, ack 1, win 1452, length 36
20:09:10.906952 IP lamp-s-1vcpu-1gb-tor1-01.ssh > CPEf81d0fa9f3e3-CMf81d0fa9f3e0.cpe.net.cable.rogers.com.51494: Flags [P.], seq 6256:6460, ack 1, win 1452, length 204
20:09:10.907042 IP lamp-s-1vcpu-1gb-tor1-01.ssh > CPEf81d0fa9f3e3-CMf81d0fa9f3e0.cpe.net.cable.rogers.com.51494: Flags [P.], seq 6460:6496, ack 1, win 1452, length 36
20:09:10.907147 IP lamp-s-1vcpu-1gb-tor1-01.ssh > CPEf81d0fa9f3e3-CMf81d0fa9f3e0.cpe.net.cable.rogers.com.51494: Flags [P.], seq 6496:6684, ack 1, win 1452, length 188
20:09:10.907219 IP lamp-s-1vcpu-1gb-tor1-01.ssh > CPEf81d0fa9f3e3-CMf81d0fa9f3e0.cpe.net.cable.rogers.com.51494: Flags [P.], seq 6684:6720, ack 1, win 1452, length 36
20:09:10.907325 IP lamp-s-1vcpu-1gb-tor1-01.ssh > CPEf81d0fa9f3e3-CMf81d0fa9f3e0.cpe.net.cable.rogers.com.51494: Flags [P.], seq 6720:6924, ack 1, win 1452, length 204
20:09:10.907506 IP lamp-s-1vcpu-1gb-tor1-01.ssh > CPEf81d0fa9f3e3-CMf81d0fa9f3e0.cpe.net.cable.rogers.com.51494: Flags [P.], seq 6960:7164, ack 1, win 1452, length 204
20:09:10.907703 IP lamp-s-1vcpu-1gb-tor1-01.ssh > CPEf81d0fa9f3e3-CMf81d0fa9f3e0.cpe.net.cable.rogers.com.51494: Flags [P.], seq 7200:7404, ack 1, win 1452, length 204
20:09:10.907935 IP lamp-s-1vcpu-1gb-tor1-01.ssh > CPEf81d0fa9f3e3-CMf81d0fa9f3e0.cpe.net.cable.rogers.com.51494: Flags [P.], seq 7440:7644, ack 1, win 1452, length 204
20:09:10.908149 IP lamp-s-1vcpu-1gb-tor1-01.ssh > CPEf81d0fa9f3e3-CMf81d0fa9f3e0.cpe.net.cable.rogers.com.51494: Flags [P.], seq 7680:7884, ack 1, win 1452, length 204
20:09:10.908410 IP lamp-s-1vcpu-1gb-tor1-01.ssh > CPEf81d0fa9f3e3-CMf81d0fa9f3e0.cpe.net.cable.rogers.com.51494: Flags [P.], seq 7920:8124, ack 1, win 1452, length 204
20:09:10.908730 IP lamp-s-1vcpu-1gb-tor1-01.ssh > CPEf81d0fa9f3e3-CMf81d0fa9f3e0.cpe.net.cable.rogers.com.51494: Flags [P.], seq 8160:8364, ack 1, win 1452, length 204
20:09:10.908941 IP lamp-s-1vcpu-1gb-tor1-01.ssh > CPEf81d0fa9f3e3-CMf81d0fa9f3e0.cpe.net.cable.rogers.com.51494: Flags [P.], seq 8364:8568, ack 1, win 1452, length 204
20:09:10.909153 IP lamp-s-1vcpu-1gb-tor1-01.ssh > CPEf81d0fa9f3e3-CMf81d0fa9f3e0.cpe.net.cable.rogers.com.51494: Flags [P.], seq 8568:9452, ack 1, win 1452, length 884
20:09:10.909297 IP lamp-s-1vcpu-1gb-tor1-01.ssh > CPEf81d0fa9f3e3-CMf81d0fa9f3e0.cpe.net.cable.rogers.com.51494: Flags [P.], seq 9452:9832, ack 1, win 1452, length 380
20:09:10.909408 IP lamp-s-1vcpu-1gb-tor1-01.ssh > CPEf81d0fa9f3e3-CMf81d0fa9f3e0.cpe.net.cable.rogers.com.51494: Flags [P.], seq 9832:10036, ack 1, win 1452, length 204
20:09:10.909517 IP lamp-s-1vcpu-1gb-tor1-01.ssh > CPEf81d0fa9f3e3-CMf81d0fa9f3e0.cpe.net.cable.rogers.com.51494: Flags [P.], seq 10036:10240, ack 1, win 1452, length 204
20:09:10.909629 IP lamp-s-1vcpu-1gb-tor1-01.ssh > CPEf81d0fa9f3e3-CMf81d0fa9f3e0.cpe.net.cable.rogers.com.51494: Flags [P.], seq 10240:10452, ack 1, win 1452, length 212
20:09:10.909736 IP lamp-s-1vcpu-1gb-tor1-01.ssh > CPEf81d0fa9f3e3-CMf81d0fa9f3e0.cpe.net.cable.rogers.com.51494: Flags [P.], seq 10452:10664, ack 1, win 1452, length 212
20:09:10.910092 IP lamp-s-1vcpu-1gb-tor1-01.ssh > CPEf81d0fa9f3e3-CMf81d0fa9f3e0.cpe.net.cable.rogers.com.51494: Flags [P.], seq 10664:10876, ack 1, win 1452, length 212
20:09:10.910214 IP lamp-s-1vcpu-1gb-tor1-01.ssh > CPEf81d0fa9f3e3-CMf81d0fa9f3e0.cpe.net.cable.rogers.com.51494: Flags [P.], seq 10876:11088, ack 1, win 1452, length 212
20:09:10.910323 IP lamp-s-1vcpu-1gb-tor1-01.ssh > CPEf81d0fa9f3e3-CMf81d0fa9f3e0.cpe.net.cable.rogers.com.51494: Flags [P.], seq 11088:11300, ack 1, win 1452, length 212
20:09:10.910431 IP lamp-s-1vcpu-1gb-tor1-01.ssh > CPEf81d0fa9f3e3-CMf81d0fa9f3e0.cpe.net.cable.rogers.com.51494: Flags [P.], seq 11300:11512, ack 1, win 1452, length 212
20:09:10.910539 IP lamp-s-1vcpu-1gb-tor1-01.ssh > CPEf81d0fa9f3e3-CMf81d0fa9f3e0.cpe.net.cable.rogers.com.51494: Flags [P.], seq 11512:11724, ack 1, win 1452, length 212
20:09:10.910647 IP lamp-s-1vcpu-1gb-tor1-01.ssh > CPEf81d0fa9f3e3-CMf81d0fa9f3e0.cpe.net.cable.rogers.com.51494: Flags [P.], seq 11724:11936, ack 1, win 1452, length 212
20:09:10.910755 IP lamp-s-1vcpu-1gb-tor1-01.ssh > CPEf81d0fa9f3e3-CMf81d0fa9f3e0.cpe.net.cable.rogers.com.51494: Flags [P.], seq 11936:12148, ack 1, win 1452, length 212
20:09:10.910920 IP lamp-s-1vcpu-1gb-tor1-01.ssh > CPEf81d0fa9f3e3-CMf81d0fa9f3e0.cpe.net.cable.rogers.com.51494: Flags [P.], seq 12148:12360, ack 1, win 1452, length 212
20:09:10.911066 IP lamp-s-1vcpu-1gb-tor1-01.ssh > CPEf81d0fa9f3e3-CMf81d0fa9f3e0.cpe.net.cable.rogers.com.51494: Flags [P.], seq 12360:12572, ack 1, win 1452, length 212
20:09:10.911200 IP lamp-s-1vcpu-1gb-tor1-01.ssh > CPEf81d0fa9f3e3-CMf81d0fa9f3e0.cpe.net.cable.rogers.com.51494: Flags [P.], seq 12572:12784, ack 1, win 1452, length 212
20:09:10.911312 IP lamp-s-1vcpu-1gb-tor1-01.ssh > CPEf81d0fa9f3e3-CMf81d0fa9f3e0.cpe.net.cable.rogers.com.51494: Flags [P.], seq 12784:12996, ack 1, win 1452, length 212
20:09:10.914144 IP CPEf81d0fa9f3e3-CMf81d0fa9f3e0.cpe.net.cable.rogers.com.51494 > lamp-s-1vcpu-1gb-tor1-01.ssh: Flags [.], ack 4592, win 512, length 0
20:09:10.914189 IP lamp-s-1vcpu-1gb-tor1-01.ssh > CPEf81d0fa9f3e3-CMf81d0fa9f3e0.cpe.net.cable.rogers.com.51494: Flags [P.], seq 12996:13208, ack 1, win 1452, length 212
20:09:10.914402 IP lamp-s-1vcpu-1gb-tor1-01.ssh > CPEf81d0fa9f3e3-CMf81d0fa9f3e0.cpe.net.cable.rogers.com.51494: Flags [P.], seq 13208:13572, ack 1, win 1452, length 364
20:09:10.923014 IP CPEf81d0fa9f3e3-CMf81d0fa9f3e0.cpe.net.cable.rogers.com.51494 > lamp-s-1vcpu-1gb-tor1-01.ssh: Flags [.], ack 6460, win 513, length 0
20:09:10.923068 IP lamp-s-1vcpu-1gb-tor1-01.ssh > CPEf81d0fa9f3e3-CMf81d0fa9f3e0.cpe.net.cable.rogers.com.51494: Flags [P.], seq 13572:13784, ack 1, win 1452, length 212
20:09:10.923103 IP CPEf81d0fa9f3e3-CMf81d0fa9f3e0.cpe.net.cable.rogers.com.51494 > lamp-s-1vcpu-1gb-tor1-01.ssh: Flags [.], ack 6684, win 512, length 0
20:09:10.923118 IP CPEf81d0fa9f3e3-CMf81d0fa9f3e0.cpe.net.cable.rogers.com.51494 > lamp-s-1vcpu-1gb-tor1-01.ssh: Flags [.], ack 7164, win 510, length 0
20:09:10.923130 IP CPEf81d0fa9f3e3-CMf81d0fa9f3e0.cpe.net.cable.rogers.com.51494 > lamp-s-1vcpu-1gb-tor1-01.ssh: Flags [.], ack 7884, win 507, length 0
20:09:10.923413 IP lamp-s-1vcpu-1gb-tor1-01.ssh > CPEf81d0fa9f3e3-CMf81d0fa9f3e0.cpe.net.cable.rogers.com.51494: Flags [P.], seq 13784:14604, ack 1, win 1452, length 820
20:09:10.923542 IP lamp-s-1vcpu-1gb-tor1-01.ssh > CPEf81d0fa9f3e3-CMf81d0fa9f3e0.cpe.net.cable.rogers.com.51494: Flags [P.], seq 14604:14816, ack 1, win 1452, length 212
20:09:10.923659 IP lamp-s-1vcpu-1gb-tor1-01.ssh > CPEf81d0fa9f3e3-CMf81d0fa9f3e0.cpe.net.cable.rogers.com.51494: Flags [P.], seq 14816:15028, ack 1, win 1452, length 212
20:09:10.923769 IP lamp-s-1vcpu-1gb-tor1-01.ssh > CPEf81d0fa9f3e3-CMf81d0fa9f3e0.cpe.net.cable.rogers.com.51494: Flags [P.], seq 15028:15240, ack 1, win 1452, length 212
20:09:10.923877 IP lamp-s-1vcpu-1gb-tor1-01.ssh > CPEf81d0fa9f3e3-CMf81d0fa9f3e0.cpe.net.cable.rogers.com.51494: Flags [P.], seq 15240:15452, ack 1, win 1452, length 212
20:09:10.923983 IP lamp-s-1vcpu-1gb-tor1-01.ssh > CPEf81d0fa9f3e3-CMf81d0fa9f3e0.cpe.net.cable.rogers.com.51494: Flags [P.], seq 15452:15664, ack 1, win 1452, length 212
20:09:10.924089 IP lamp-s-1vcpu-1gb-tor1-01.ssh > CPEf81d0fa9f3e3-CMf81d0fa9f3e0.cpe.net.cable.rogers.com.51494: Flags [P.], seq 15664:15876, ack 1, win 1452, length 212
20:09:10.924196 IP lamp-s-1vcpu-1gb-tor1-01.ssh > CPEf81d0fa9f3e3-CMf81d0fa9f3e0.cpe.net.cable.rogers.com.51494: Flags [P.], seq 15876:16088, ack 1, win 1452, length 212
20:09:10.924318 IP lamp-s-1vcpu-1gb-tor1-01.ssh > CPEf81d0fa9f3e3-CMf81d0fa9f3e0.cpe.net.cable.rogers.com.51494: Flags [P.], seq 16088:16300, ack 1, win 1452, length 212
20:09:10.924426 IP lamp-s-1vcpu-1gb-tor1-01.ssh > CPEf81d0fa9f3e3-CMf81d0fa9f3e0.cpe.net.cable.rogers.com.51494: Flags [P.], seq 16300:16512, ack 1, win 1452, length 212
20:09:10.924529 IP lamp-s-1vcpu-1gb-tor1-01.ssh > CPEf81d0fa9f3e3-CMf81d0fa9f3e0.cpe.net.cable.rogers.com.51494: Flags [P.], seq 16512:16724, ack 1, win 1452, length 212
20:09:10.924690 IP lamp-s-1vcpu-1gb-tor1-01.ssh > CPEf81d0fa9f3e3-CMf81d0fa9f3e0.cpe.net.cable.rogers.com.51494: Flags [P.], seq 16724:16936, ack 1, win 1452, length 212
20:09:10.924843 IP lamp-s-1vcpu-1gb-tor1-01.ssh > CPEf81d0fa9f3e3-CMf81d0fa9f3e0.cpe.net.cable.rogers.com.51494: Flags [P.], seq 16936:17148, ack 1, win 1452, length 212
20:09:10.924955 IP lamp-s-1vcpu-1gb-tor1-01.ssh > CPEf81d0fa9f3e3-CMf81d0fa9f3e0.cpe.net.cable.rogers.com.51494: Flags [P.], seq 17148:17360, ack 1, win 1452, length 212
20:09:10.925098 IP lamp-s-1vcpu-1gb-tor1-01.ssh > CPEf81d0fa9f3e3-CMf81d0fa9f3e0.cpe.net.cable.rogers.com.51494: Flags [P.], seq 17360:17572, ack 1, win 1452, length 212
20:09:10.925236 IP lamp-s-1vcpu-1gb-tor1-01.ssh > CPEf81d0fa9f3e3-CMf81d0fa9f3e0.cpe.net.cable.rogers.com.51494: Flags [P.], seq 17572:17784, ack 1, win 1452, length 212
20:09:10.925346 IP lamp-s-1vcpu-1gb-tor1-01.ssh > CPEf81d0fa9f3e3-CMf81d0fa9f3e0.cpe.net.cable.rogers.com.51494: Flags [P.], seq 17784:17996, ack 1, win 1452, length 212
20:09:10.925452 IP lamp-s-1vcpu-1gb-tor1-01.ssh > CPEf81d0fa9f3e3-CMf81d0fa9f3e0.cpe.net.cable.rogers.com.51494: Flags [P.], seq 17996:18208, ack 1, win 1452, length 212
20:09:10.925556 IP lamp-s-1vcpu-1gb-tor1-01.ssh > CPEf81d0fa9f3e3-CMf81d0fa9f3e0.cpe.net.cable.rogers.com.51494: Flags [P.], seq 18208:18420, ack 1, win 1452, length 212
20:09:10.925660 IP lamp-s-1vcpu-1gb-tor1-01.ssh > CPEf81d0fa9f3e3-CMf81d0fa9f3e0.cpe.net.cable.rogers.com.51494: Flags [P.], seq 18420:18632, ack 1, win 1452, length 212
20:09:10.925765 IP lamp-s-1vcpu-1gb-tor1-01.ssh > CPEf81d0fa9f3e3-CMf81d0fa9f3e0.cpe.net.cable.rogers.com.51494: Flags [P.], seq 18632:18844, ack 1, win 1452, length 212
20:09:10.925869 IP lamp-s-1vcpu-1gb-tor1-01.ssh > CPEf81d0fa9f3e3-CMf81d0fa9f3e0.cpe.net.cable.rogers.com.51494: Flags [P.], seq 18844:19056, ack 1, win 1452, length 212
20:09:10.925972 IP lamp-s-1vcpu-1gb-tor1-01.ssh > CPEf81d0fa9f3e3-CMf81d0fa9f3e0.cpe.net.cable.rogers.com.51494: Flags [P.], seq 19056:19268, ack 1, win 1452, length 212
20:09:10.926075 IP lamp-s-1vcpu-1gb-tor1-01.ssh > CPEf81d0fa9f3e3-CMf81d0fa9f3e0.cpe.net.cable.rogers.com.51494: Flags [P.], seq 19268:19480, ack 1, win 1452, length 212
20:09:10.926178 IP lamp-s-1vcpu-1gb-tor1-01.ssh > CPEf81d0fa9f3e3-CMf81d0fa9f3e0.cpe.net.cable.rogers.com.51494: Flags [P.], seq 19480:19692, ack 1, win 1452, length 212
20:09:10.926305 IP lamp-s-1vcpu-1gb-tor1-01.ssh > CPEf81d0fa9f3e3-CMf81d0fa9f3e0.cpe.net.cable.rogers.com.51494: Flags [P.], seq 19692:19904, ack 1, win 1452, length 212
20:09:10.926408 IP lamp-s-1vcpu-1gb-tor1-01.ssh > CPEf81d0fa9f3e3-CMf81d0fa9f3e0.cpe.net.cable.rogers.com.51494: Flags [P.], seq 19904:20116, ack 1, win 1452, length 212
20:09:10.926512 IP lamp-s-1vcpu-1gb-tor1-01.ssh > CPEf81d0fa9f3e3-CMf81d0fa9f3e0.cpe.net.cable.rogers.com.51494: Flags [P.], seq 20116:20328, ack 1, win 1452, length 212
20:09:10.926615 IP lamp-s-1vcpu-1gb-tor1-01.ssh > CPEf81d0fa9f3e3-CMf81d0fa9f3e0.cpe.net.cable.rogers.com.51494: Flags [P.], seq 20328:20540, ack 1, win 1452, length 212
20:09:10.926717 IP lamp-s-1vcpu-1gb-tor1-01.ssh > CPEf81d0fa9f3e3-CMf81d0fa9f3e0.cpe.net.cable.rogers.com.51494: Flags [P.], seq 20540:20752, ack 1, win 1452, length 212
20:09:10.926837 IP lamp-s-1vcpu-1gb-tor1-01.ssh > CPEf81d0fa9f3e3-CMf81d0fa9f3e0.cpe.net.cable.rogers.com.51494: Flags [P.], seq 20752:20964, ack 1, win 1452, length 212
20:09:10.928308 IP CPEf81d0fa9f3e3-CMf81d0fa9f3e0.cpe.net.cable.rogers.com.51494 > lamp-s-1vcpu-1gb-tor1-01.ssh: Flags [.], ack 8124, win 513, length 0
20:09:10.928343 IP lamp-s-1vcpu-1gb-tor1-01.ssh > CPEf81d0fa9f3e3-CMf81d0fa9f3e0.cpe.net.cable.rogers.com.51494: Flags [P.], seq 20964:21176, ack 1, win 1452, length 212
20:09:10.928365 IP CPEf81d0fa9f3e3-CMf81d0fa9f3e0.cpe.net.cable.rogers.com.51494 > lamp-s-1vcpu-1gb-tor1-01.ssh: Flags [.], ack 8568, win 511, length 0
20:09:10.928375 IP CPEf81d0fa9f3e3-CMf81d0fa9f3e0.cpe.net.cable.rogers.com.51494 > lamp-s-1vcpu-1gb-tor1-01.ssh: Flags [.], ack 11088, win 513, length 0
20:09:10.928385 IP CPEf81d0fa9f3e3-CMf81d0fa9f3e0.cpe.net.cable.rogers.com.51494 > lamp-s-1vcpu-1gb-tor1-01.ssh: Flags [.], ack 12784, win 513, length 0
20:09:10.928394 IP CPEf81d0fa9f3e3-CMf81d0fa9f3e0.cpe.net.cable.rogers.com.51494 > lamp-s-1vcpu-1gb-tor1-01.ssh: Flags [.], ack 12996, win 512, length 0
20:09:10.928400 IP CPEf81d0fa9f3e3-CMf81d0fa9f3e0.cpe.net.cable.rogers.com.51494 > lamp-s-1vcpu-1gb-tor1-01.ssh: Flags [.], ack 13572, win 510, length 0
20:09:10.928709 IP lamp-s-1vcpu-1gb-tor1-01.ssh > CPEf81d0fa9f3e3-CMf81d0fa9f3e0.cpe.net.cable.rogers.com.51494: Flags [P.], seq 21176:22308, ack 1, win 1452, length 1132
20:09:10.928865 IP lamp-s-1vcpu-1gb-tor1-01.ssh > CPEf81d0fa9f3e3-CMf81d0fa9f3e0.cpe.net.cable.rogers.com.51494: Flags [P.], seq 22308:22520, ack 1, win 1452, length 212
20:09:10.928983 IP lamp-s-1vcpu-1gb-tor1-01.ssh > CPEf81d0fa9f3e3-CMf81d0fa9f3e0.cpe.net.cable.rogers.com.51494: Flags [P.], seq 22520:22732, ack 1, win 1452, length 212
20:09:10.929087 IP lamp-s-1vcpu-1gb-tor1-01.ssh > CPEf81d0fa9f3e3-CMf81d0fa9f3e0.cpe.net.cable.rogers.com.51494: Flags [P.], seq 22732:22944, ack 1, win 1452, length 212
20:09:10.929190 IP lamp-s-1vcpu-1gb-tor1-01.ssh > CPEf81d0fa9f3e3-CMf81d0fa9f3e0.cpe.net.cable.rogers.com.51494: Flags [P.], seq 22944:23156, ack 1, win 1452, length 212
20:09:10.929306 IP lamp-s-1vcpu-1gb-tor1-01.ssh > CPEf81d0fa9f3e3-CMf81d0fa9f3e0.cpe.net.cable.rogers.com.51494: Flags [P.], seq 23156:23368, ack 1, win 1452, length 212
20:09:10.929423 IP lamp-s-1vcpu-1gb-tor1-01.ssh > CPEf81d0fa9f3e3-CMf81d0fa9f3e0.cpe.net.cable.rogers.com.51494: Flags [P.], seq 23368:23580, ack 1, win 1452, length 212
20:09:10.929536 IP lamp-s-1vcpu-1gb-tor1-01.ssh > CPEf81d0fa9f3e3-CMf81d0fa9f3e0.cpe.net.cable.rogers.com.51494: Flags [P.], seq 23580:23792, ack 1, win 1452, length 212
20:09:10.929643 IP lamp-s-1vcpu-1gb-tor1-01.ssh > CPEf81d0fa9f3e3-CMf81d0fa9f3e0.cpe.net.cable.rogers.com.51494: Flags [P.], seq 23792:24004, ack 1, win 1452, length 212
20:09:10.929753 IP lamp-s-1vcpu-1gb-tor1-01.ssh > CPEf81d0fa9f3e3-CMf81d0fa9f3e0.cpe.net.cable.rogers.com.51494: Flags [P.], seq 24004:24216, ack 1, win 1452, length 212
20:09:10.929857 IP lamp-s-1vcpu-1gb-tor1-01.ssh > CPEf81d0fa9f3e3-CMf81d0fa9f3e0.cpe.net.cable.rogers.com.51494: Flags [P.], seq 24216:24428, ack 1, win 1452, length 212
20:09:10.929967 IP lamp-s-1vcpu-1gb-tor1-01.ssh > CPEf81d0fa9f3e3-CMf81d0fa9f3e0.cpe.net.cable.rogers.com.51494: Flags [P.], seq 24428:24640, ack 1, win 1452, length 212
20:09:10.930073 IP lamp-s-1vcpu-1gb-tor1-01.ssh > CPEf81d0fa9f3e3-CMf81d0fa9f3e0.cpe.net.cable.rogers.com.51494: Flags [P.], seq 24640:24852, ack 1, win 1452, length 212
20:09:10.930181 IP lamp-s-1vcpu-1gb-tor1-01.ssh > CPEf81d0fa9f3e3-CMf81d0fa9f3e0.cpe.net.cable.rogers.com.51494: Flags [P.], seq 24852:25064, ack 1, win 1452, length 212
20:09:10.930286 IP lamp-s-1vcpu-1gb-tor1-01.ssh > CPEf81d0fa9f3e3-CMf81d0fa9f3e0.cpe.net.cable.rogers.com.51494: Flags [P.], seq 25064:25276, ack 1, win 1452, length 212
20:09:10.930401 IP lamp-s-1vcpu-1gb-tor1-01.ssh > CPEf81d0fa9f3e3-CMf81d0fa9f3e0.cpe.net.cable.rogers.com.51494: Flags [P.], seq 25276:25488, ack 1, win 1452, length 212
20:09:10.930507 IP lamp-s-1vcpu-1gb-tor1-01.ssh > CPEf81d0fa9f3e3-CMf81d0fa9f3e0.cpe.net.cable.rogers.com.51494: Flags [P.], seq 25488:25700, ack 1, win 1452, length 212
20:09:10.930617 IP lamp-s-1vcpu-1gb-tor1-01.ssh > CPEf81d0fa9f3e3-CMf81d0fa9f3e0.cpe.net.cable.rogers.com.51494: Flags [P.], seq 25700:25912, ack 1, win 1452, length 212
20:09:10.930722 IP lamp-s-1vcpu-1gb-tor1-01.ssh > CPEf81d0fa9f3e3-CMf81d0fa9f3e0.cpe.net.cable.rogers.com.51494: Flags [P.], seq 25912:26124, ack 1, win 1452, length 212
20:09:10.930870 IP lamp-s-1vcpu-1gb-tor1-01.ssh > CPEf81d0fa9f3e3-CMf81d0fa9f3e0.cpe.net.cable.rogers.com.51494: Flags [P.], seq 26124:26336, ack 1, win 1452, length 212
20:09:10.931027 IP lamp-s-1vcpu-1gb-tor1-01.ssh > CPEf81d0fa9f3e3-CMf81d0fa9f3e0.cpe.net.cable.rogers.com.51494: Flags [P.], seq 26336:26548, ack 1, win 1452, length 212
20:09:10.931146 IP lamp-s-1vcpu-1gb-tor1-01.ssh > CPEf81d0fa9f3e3-CMf81d0fa9f3e0.cpe.net.cable.rogers.com.51494: Flags [P.], seq 26548:26760, ack 1, win 1452, length 212
20:09:10.931253 IP lamp-s-1vcpu-1gb-tor1-01.ssh > CPEf81d0fa9f3e3-CMf81d0fa9f3e0.cpe.net.cable.rogers.com.51494: Flags [P.], seq 26760:26972, ack 1, win 1452, length 212
20:09:10.931363 IP lamp-s-1vcpu-1gb-tor1-01.ssh > CPEf81d0fa9f3e3-CMf81d0fa9f3e0.cpe.net.cable.rogers.com.51494: Flags [P.], seq 26972:27184, ack 1, win 1452, length 212
20:09:10.931469 IP lamp-s-1vcpu-1gb-tor1-01.ssh > CPEf81d0fa9f3e3-CMf81d0fa9f3e0.cpe.net.cable.rogers.com.51494: Flags [P.], seq 27184:27396, ack 1, win 1452, length 212
20:09:10.931579 IP lamp-s-1vcpu-1gb-tor1-01.ssh > CPEf81d0fa9f3e3-CMf81d0fa9f3e0.cpe.net.cable.rogers.com.51494: Flags [P.], seq 27396:27608, ack 1, win 1452, length 212
20:09:10.931685 IP lamp-s-1vcpu-1gb-tor1-01.ssh > CPEf81d0fa9f3e3-CMf81d0fa9f3e0.cpe.net.cable.rogers.com.51494: Flags [P.], seq 27608:27820, ack 1, win 1452, length 212
20:09:10.931796 IP lamp-s-1vcpu-1gb-tor1-01.ssh > CPEf81d0fa9f3e3-CMf81d0fa9f3e0.cpe.net.cable.rogers.com.51494: Flags [P.], seq 27820:28032, ack 1, win 1452, length 212
20:09:10.931925 IP lamp-s-1vcpu-1gb-tor1-01.ssh > CPEf81d0fa9f3e3-CMf81d0fa9f3e0.cpe.net.cable.rogers.com.51494: Flags [P.], seq 28032:28244, ack 1, win 1452, length 212
20:09:10.932076 IP lamp-s-1vcpu-1gb-tor1-01.ssh > CPEf81d0fa9f3e3-CMf81d0fa9f3e0.cpe.net.cable.rogers.com.51494: Flags [P.], seq 28244:28456, ack 1, win 1452, length 212
20:09:10.932188 IP lamp-s-1vcpu-1gb-tor1-01.ssh > CPEf81d0fa9f3e3-CMf81d0fa9f3e0.cpe.net.cable.rogers.com.51494: Flags [P.], seq 28456:28668, ack 1, win 1452, length 212
20:09:10.932301 IP lamp-s-1vcpu-1gb-tor1-01.ssh > CPEf81d0fa9f3e3-CMf81d0fa9f3e0.cpe.net.cable.rogers.com.51494: Flags [P.], seq 28668:28880, ack 1, win 1452, length 212
20:09:10.932425 IP lamp-s-1vcpu-1gb-tor1-01.ssh > CPEf81d0fa9f3e3-CMf81d0fa9f3e0.cpe.net.cable.rogers.com.51494: Flags [P.], seq 28880:29092, ack 1, win 1452, length 212
20:09:10.932537 IP lamp-s-1vcpu-1gb-tor1-01.ssh > CPEf81d0fa9f3e3-CMf81d0fa9f3e0.cpe.net.cable.rogers.com.51494: Flags [P.], seq 29092:29304, ack 1, win 1452, length 212
20:09:10.932674 IP lamp-s-1vcpu-1gb-tor1-01.ssh > CPEf81d0fa9f3e3-CMf81d0fa9f3e0.cpe.net.cable.rogers.com.51494: Flags [P.], seq 29304:29516, ack 1, win 1452, length 212
20:09:10.932836 IP lamp-s-1vcpu-1gb-tor1-01.ssh > CPEf81d0fa9f3e3-CMf81d0fa9f3e0.cpe.net.cable.rogers.com.51494: Flags [P.], seq 29516:29728, ack 1, win 1452, length 212
20:09:10.932994 IP lamp-s-1vcpu-1gb-tor1-01.ssh > CPEf81d0fa9f3e3-CMf81d0fa9f3e0.cpe.net.cable.rogers.com.51494: Flags [P.], seq 29728:29940, ack 1, win 1452, length 212
20:09:10.933114 IP lamp-s-1vcpu-1gb-tor1-01.ssh > CPEf81d0fa9f3e3-CMf81d0fa9f3e0.cpe.net.cable.rogers.com.51494: Flags [P.], seq 29940:30152, ack 1, win 1452, length 212
20:09:10.933221 IP lamp-s-1vcpu-1gb-tor1-01.ssh > CPEf81d0fa9f3e3-CMf81d0fa9f3e0.cpe.net.cable.rogers.com.51494: Flags [P.], seq 30152:30364, ack 1, win 1452, length 212
20:09:10.933332 IP lamp-s-1vcpu-1gb-tor1-01.ssh > CPEf81d0fa9f3e3-CMf81d0fa9f3e0.cpe.net.cable.rogers.com.51494: Flags [P.], seq 30364:30576, ack 1, win 1452, length 212
20:09:10.933438 IP lamp-s-1vcpu-1gb-tor1-01.ssh > CPEf81d0fa9f3e3-CMf81d0fa9f3e0.cpe.net.cable.rogers.com.51494: Flags [P.], seq 30576:30788, ack 1, win 1452, length 212
20:09:10.933551 IP lamp-s-1vcpu-1gb-tor1-01.ssh > CPEf81d0fa9f3e3-CMf81d0fa9f3e0.cpe.net.cable.rogers.com.51494: Flags [P.], seq 30788:31000, ack 1, win 1452, length 212
20:09:10.933657 IP lamp-s-1vcpu-1gb-tor1-01.ssh > CPEf81d0fa9f3e3-CMf81d0fa9f3e0.cpe.net.cable.rogers.com.51494: Flags [P.], seq 31000:31212, ack 1, win 1452, length 212
20:09:10.933768 IP lamp-s-1vcpu-1gb-tor1-01.ssh > CPEf81d0fa9f3e3-CMf81d0fa9f3e0.cpe.net.cable.rogers.com.51494: Flags [P.], seq 31212:31424, ack 1, win 1452, length 212
20:09:10.933874 IP lamp-s-1vcpu-1gb-tor1-01.ssh > CPEf81d0fa9f3e3-CMf81d0fa9f3e0.cpe.net.cable.rogers.com.51494: Flags [P.], seq 31424:31636, ack 1, win 1452, length 212
20:09:10.934034 IP lamp-s-1vcpu-1gb-tor1-01.ssh > CPEf81d0fa9f3e3-CMf81d0fa9f3e0.cpe.net.cable.rogers.com.51494: Flags [P.], seq 31636:31848, ack 1, win 1452, length 212
20:09:10.934163 IP lamp-s-1vcpu-1gb-tor1-01.ssh > CPEf81d0fa9f3e3-CMf81d0fa9f3e0.cpe.net.cable.rogers.com.51494: Flags [P.], seq 31848:32060, ack 1, win 1452, length 212
20:09:10.954384 IP CPEf81d0fa9f3e3-CMf81d0fa9f3e0.cpe.net.cable.rogers.com.51494 > lamp-s-1vcpu-1gb-tor1-01.ssh: Flags [.], ack 15028, win 513, length 0
20:09:10.954462 IP lamp-s-1vcpu-1gb-tor1-01.ssh > CPEf81d0fa9f3e3-CMf81d0fa9f3e0.cpe.net.cable.rogers.com.51494: Flags [P.], seq 32060:32272, ack 1, win 1452, length 212
20:09:10.954502 IP CPEf81d0fa9f3e3-CMf81d0fa9f3e0.cpe.net.cable.rogers.com.51494 > lamp-s-1vcpu-1gb-tor1-01.ssh: Flags [.], ack 17360, win 513, length 0
20:09:10.954527 IP CPEf81d0fa9f3e3-CMf81d0fa9f3e0.cpe.net.cable.rogers.com.51494 > lamp-s-1vcpu-1gb-tor1-01.ssh: Flags [.], ack 18208, win 509, length 0
20:09:10.954542 IP CPEf81d0fa9f3e3-CMf81d0fa9f3e0.cpe.net.cable.rogers.com.51494 > lamp-s-1vcpu-1gb-tor1-01.ssh: Flags [.], ack 19268, win 513, length 0
20:09:10.954562 IP CPEf81d0fa9f3e3-CMf81d0fa9f3e0.cpe.net.cable.rogers.com.51494 > lamp-s-1vcpu-1gb-tor1-01.ssh: Flags [.], ack 20116, win 509, length 0
20:09:10.954576 IP CPEf81d0fa9f3e3-CMf81d0fa9f3e0.cpe.net.cable.rogers.com.51494 > lamp-s-1vcpu-1gb-tor1-01.ssh: Flags [.], ack 20964, win 513, length 0
20:09:10.955025 IP lamp-s-1vcpu-1gb-tor1-01.ssh > CPEf81d0fa9f3e3-CMf81d0fa9f3e0.cpe.net.cable.rogers.com.51494: Flags [P.], seq 32272:33404, ack 1, win 1452, length 1132
20:09:10.955193 IP lamp-s-1vcpu-1gb-tor1-01.ssh > CPEf81d0fa9f3e3-CMf81d0fa9f3e0.cpe.net.cable.rogers.com.51494: Flags [P.], seq 33404:33616, ack 1, win 1452, length 212
20:09:10.955310 IP lamp-s-1vcpu-1gb-tor1-01.ssh > CPEf81d0fa9f3e3-CMf81d0fa9f3e0.cpe.net.cable.rogers.com.51494: Flags [P.], seq 33616:33828, ack 1, win 1452, length 212
20:09:10.955415 IP lamp-s-1vcpu-1gb-tor1-01.ssh > CPEf81d0fa9f3e3-CMf81d0fa9f3e0.cpe.net.cable.rogers.com.51494: Flags [P.], seq 33828:34040, ack 1, win 1452, length 212
20:09:10.955518 IP lamp-s-1vcpu-1gb-tor1-01.ssh > CPEf81d0fa9f3e3-CMf81d0fa9f3e0.cpe.net.cable.rogers.com.51494: Flags [P.], seq 34040:34252, ack 1, win 1452, length 212
20:09:10.955623 IP lamp-s-1vcpu-1gb-tor1-01.ssh > CPEf81d0fa9f3e3-CMf81d0fa9f3e0.cpe.net.cable.rogers.com.51494: Flags [P.], seq 34252:34464, ack 1, win 1452, length 212
20:09:10.955724 IP lamp-s-1vcpu-1gb-tor1-01.ssh > CPEf81d0fa9f3e3-CMf81d0fa9f3e0.cpe.net.cable.rogers.com.51494: Flags [P.], seq 34464:34676, ack 1, win 1452, length 212
20:09:10.955826 IP lamp-s-1vcpu-1gb-tor1-01.ssh > CPEf81d0fa9f3e3-CMf81d0fa9f3e0.cpe.net.cable.rogers.com.51494: Flags [P.], seq 34676:34888, ack 1, win 1452, length 212
20:09:10.955927 IP lamp-s-1vcpu-1gb-tor1-01.ssh > CPEf81d0fa9f3e3-CMf81d0fa9f3e0.cpe.net.cable.rogers.com.51494: Flags [P.], seq 34888:35100, ack 1, win 1452, length 212
20:09:10.956030 IP lamp-s-1vcpu-1gb-tor1-01.ssh > CPEf81d0fa9f3e3-CMf81d0fa9f3e0.cpe.net.cable.rogers.com.51494: Flags [P.], seq 35100:35312, ack 1, win 1452, length 212
20:09:10.956134 IP lamp-s-1vcpu-1gb-tor1-01.ssh > CPEf81d0fa9f3e3-CMf81d0fa9f3e0.cpe.net.cable.rogers.com.51494: Flags [P.], seq 35312:35524, ack 1, win 1452, length 212
20:09:10.956238 IP lamp-s-1vcpu-1gb-tor1-01.ssh > CPEf81d0fa9f3e3-CMf81d0fa9f3e0.cpe.net.cable.rogers.com.51494: Flags [P.], seq 35524:35736, ack 1, win 1452, length 212
20:09:10.956348 IP lamp-s-1vcpu-1gb-tor1-01.ssh > CPEf81d0fa9f3e3-CMf81d0fa9f3e0.cpe.net.cable.rogers.com.51494: Flags [P.], seq 35736:35948, ack 1, win 1452, length 212
20:09:10.956450 IP lamp-s-1vcpu-1gb-tor1-01.ssh > CPEf81d0fa9f3e3-CMf81d0fa9f3e0.cpe.net.cable.rogers.com.51494: Flags [P.], seq 35948:36160, ack 1, win 1452, length 212
20:09:10.956579 IP lamp-s-1vcpu-1gb-tor1-01.ssh > CPEf81d0fa9f3e3-CMf81d0fa9f3e0.cpe.net.cable.rogers.com.51494: Flags [P.], seq 36160:36372, ack 1, win 1452, length 212
20:09:10.956705 IP lamp-s-1vcpu-1gb-tor1-01.ssh > CPEf81d0fa9f3e3-CMf81d0fa9f3e0.cpe.net.cable.rogers.com.51494: Flags [P.], seq 36372:36584, ack 1, win 1452, length 212
20:09:10.956853 IP lamp-s-1vcpu-1gb-tor1-01.ssh > CPEf81d0fa9f3e3-CMf81d0fa9f3e0.cpe.net.cable.rogers.com.51494: Flags [P.], seq 36584:36796, ack 1, win 1452, length 212
20:09:10.957019 IP lamp-s-1vcpu-1gb-tor1-01.ssh > CPEf81d0fa9f3e3-CMf81d0fa9f3e0.cpe.net.cable.rogers.com.51494: Flags [P.], seq 36796:37008, ack 1, win 1452, length 212
20:09:10.957134 IP lamp-s-1vcpu-1gb-tor1-01.ssh > CPEf81d0fa9f3e3-CMf81d0fa9f3e0.cpe.net.cable.rogers.com.51494: Flags [P.], seq 37008:37220, ack 1, win 1452, length 212
20:09:10.957252 IP lamp-s-1vcpu-1gb-tor1-01.ssh > CPEf81d0fa9f3e3-CMf81d0fa9f3e0.cpe.net.cable.rogers.com.51494: Flags [P.], seq 37220:37432, ack 1, win 1452, length 212
20:09:10.957429 IP lamp-s-1vcpu-1gb-tor1-01.ssh > CPEf81d0fa9f3e3-CMf81d0fa9f3e0.cpe.net.cable.rogers.com.51494: Flags [P.], seq 37432:37644, ack 1, win 1452, length 212
20:09:10.957581 IP lamp-s-1vcpu-1gb-tor1-01.ssh > CPEf81d0fa9f3e3-CMf81d0fa9f3e0.cpe.net.cable.rogers.com.51494: Flags [P.], seq 37644:37856, ack 1, win 1452, length 212
20:09:10.957693 IP lamp-s-1vcpu-1gb-tor1-01.ssh > CPEf81d0fa9f3e3-CMf81d0fa9f3e0.cpe.net.cable.rogers.com.51494: Flags [P.], seq 37856:38068, ack 1, win 1452, length 212
20:09:10.957797 IP lamp-s-1vcpu-1gb-tor1-01.ssh > CPEf81d0fa9f3e3-CMf81d0fa9f3e0.cpe.net.cable.rogers.com.51494: Flags [P.], seq 38068:38280, ack 1, win 1452, length 212
20:09:10.957917 IP lamp-s-1vcpu-1gb-tor1-01.ssh > CPEf81d0fa9f3e3-CMf81d0fa9f3e0.cpe.net.cable.rogers.com.51494: Flags [P.], seq 38280:38492, ack 1, win 1452, length 212
20:09:10.958027 IP lamp-s-1vcpu-1gb-tor1-01.ssh > CPEf81d0fa9f3e3-CMf81d0fa9f3e0.cpe.net.cable.rogers.com.51494: Flags [P.], seq 38492:38704, ack 1, win 1452, length 212
20:09:10.958131 IP lamp-s-1vcpu-1gb-tor1-01.ssh > CPEf81d0fa9f3e3-CMf81d0fa9f3e0.cpe.net.cable.rogers.com.51494: Flags [P.], seq 38704:38916, ack 1, win 1452, length 212
20:09:10.958237 IP lamp-s-1vcpu-1gb-tor1-01.ssh > CPEf81d0fa9f3e3-CMf81d0fa9f3e0.cpe.net.cable.rogers.com.51494: Flags [P.], seq 38916:39128, ack 1, win 1452, length 212
20:09:10.958340 IP lamp-s-1vcpu-1gb-tor1-01.ssh > CPEf81d0fa9f3e3-CMf81d0fa9f3e0.cpe.net.cable.rogers.com.51494: Flags [P.], seq 39128:39340, ack 1, win 1452, length 212
20:09:10.958442 IP lamp-s-1vcpu-1gb-tor1-01.ssh > CPEf81d0fa9f3e3-CMf81d0fa9f3e0.cpe.net.cable.rogers.com.51494: Flags [P.], seq 39340:39552, ack 1, win 1452, length 212
20:09:10.958548 IP lamp-s-1vcpu-1gb-tor1-01.ssh > CPEf81d0fa9f3e3-CMf81d0fa9f3e0.cpe.net.cable.rogers.com.51494: Flags [P.], seq 39552:39764, ack 1, win 1452, length 212
20:09:10.958655 IP lamp-s-1vcpu-1gb-tor1-01.ssh > CPEf81d0fa9f3e3-CMf81d0fa9f3e0.cpe.net.cable.rogers.com.51494: Flags [P.], seq 39764:39976, ack 1, win 1452, length 212
20:09:10.958760 IP lamp-s-1vcpu-1gb-tor1-01.ssh > CPEf81d0fa9f3e3-CMf81d0fa9f3e0.cpe.net.cable.rogers.com.51494: Flags [P.], seq 39976:40188, ack 1, win 1452, length 212
20:09:10.958863 IP lamp-s-1vcpu-1gb-tor1-01.ssh > CPEf81d0fa9f3e3-CMf81d0fa9f3e0.cpe.net.cable.rogers.com.51494: Flags [P.], seq 40188:40400, ack 1, win 1452, length 212
20:09:10.958968 IP lamp-s-1vcpu-1gb-tor1-01.ssh > CPEf81d0fa9f3e3-CMf81d0fa9f3e0.cpe.net.cable.rogers.com.51494: Flags [P.], seq 40400:40612, ack 1, win 1452, length 212
20:09:10.959072 IP lamp-s-1vcpu-1gb-tor1-01.ssh > CPEf81d0fa9f3e3-CMf81d0fa9f3e0.cpe.net.cable.rogers.com.51494: Flags [P.], seq 40612:40824, ack 1, win 1452, length 212
20:09:10.959174 IP lamp-s-1vcpu-1gb-tor1-01.ssh > CPEf81d0fa9f3e3-CMf81d0fa9f3e0.cpe.net.cable.rogers.com.51494: Flags [P.], seq 40824:41036, ack 1, win 1452, length 212
20:09:10.959299 IP lamp-s-1vcpu-1gb-tor1-01.ssh > CPEf81d0fa9f3e3-CMf81d0fa9f3e0.cpe.net.cable.rogers.com.51494: Flags [P.], seq 41036:41248, ack 1, win 1452, length 212
20:09:10.959421 IP lamp-s-1vcpu-1gb-tor1-01.ssh > CPEf81d0fa9f3e3-CMf81d0fa9f3e0.cpe.net.cable.rogers.com.51494: Flags [P.], seq 41248:41460, ack 1, win 1452, length 212
20:09:10.959543 IP lamp-s-1vcpu-1gb-tor1-01.ssh > CPEf81d0fa9f3e3-CMf81d0fa9f3e0.cpe.net.cable.rogers.com.51494: Flags [P.], seq 41460:41672, ack 1, win 1452, length 212
20:09:10.959649 IP lamp-s-1vcpu-1gb-tor1-01.ssh > CPEf81d0fa9f3e3-CMf81d0fa9f3e0.cpe.net.cable.rogers.com.51494: Flags [P.], seq 41672:41884, ack 1, win 1452, length 212
20:09:10.959752 IP lamp-s-1vcpu-1gb-tor1-01.ssh > CPEf81d0fa9f3e3-CMf81d0fa9f3e0.cpe.net.cable.rogers.com.51494: Flags [P.], seq 41884:42096, ack 1, win 1452, length 212
20:09:10.959856 IP lamp-s-1vcpu-1gb-tor1-01.ssh > CPEf81d0fa9f3e3-CMf81d0fa9f3e0.cpe.net.cable.rogers.com.51494: Flags [P.], seq 42096:42308, ack 1, win 1452, length 212
20:09:10.959958 IP lamp-s-1vcpu-1gb-tor1-01.ssh > CPEf81d0fa9f3e3-CMf81d0fa9f3e0.cpe.net.cable.rogers.com.51494: Flags [P.], seq 42308:42520, ack 1, win 1452, length 212
20:09:10.960059 IP lamp-s-1vcpu-1gb-tor1-01.ssh > CPEf81d0fa9f3e3-CMf81d0fa9f3e0.cpe.net.cable.rogers.com.51494: Flags [P.], seq 42520:42732, ack 1, win 1452, length 212
20:09:10.960160 IP lamp-s-1vcpu-1gb-tor1-01.ssh > CPEf81d0fa9f3e3-CMf81d0fa9f3e0.cpe.net.cable.rogers.com.51494: Flags [P.], seq 42732:42944, ack 1, win 1452, length 212
20:09:10.960264 IP lamp-s-1vcpu-1gb-tor1-01.ssh > CPEf81d0fa9f3e3-CMf81d0fa9f3e0.cpe.net.cable.rogers.com.51494: Flags [P.], seq 42944:43156, ack 1, win 1452, length 212
20:09:10.960367 IP lamp-s-1vcpu-1gb-tor1-01.ssh > CPEf81d0fa9f3e3-CMf81d0fa9f3e0.cpe.net.cable.rogers.com.51494: Flags [P.], seq 43156:43368, ack 1, win 1452, length 212
20:09:10.960469 IP lamp-s-1vcpu-1gb-tor1-01.ssh > CPEf81d0fa9f3e3-CMf81d0fa9f3e0.cpe.net.cable.rogers.com.51494: Flags [P.], seq 43368:43580, ack 1, win 1452, length 212
20:09:10.960602 IP lamp-s-1vcpu-1gb-tor1-01.ssh > CPEf81d0fa9f3e3-CMf81d0fa9f3e0.cpe.net.cable.rogers.com.51494: Flags [P.], seq 43580:43792, ack 1, win 1452, length 212
20:09:10.960708 IP lamp-s-1vcpu-1gb-tor1-01.ssh > CPEf81d0fa9f3e3-CMf81d0fa9f3e0.cpe.net.cable.rogers.com.51494: Flags [P.], seq 43792:44004, ack 1, win 1452, length 212
20:09:10.960877 IP lamp-s-1vcpu-1gb-tor1-01.ssh > CPEf81d0fa9f3e3-CMf81d0fa9f3e0.cpe.net.cable.rogers.com.51494: Flags [P.], seq 44004:44216, ack 1, win 1452, length 212
20:09:10.961031 IP lamp-s-1vcpu-1gb-tor1-01.ssh > CPEf81d0fa9f3e3-CMf81d0fa9f3e0.cpe.net.cable.rogers.com.51494: Flags [P.], seq 44216:44428, ack 1, win 1452, length 212
20:09:10.961142 IP lamp-s-1vcpu-1gb-tor1-01.ssh > CPEf81d0fa9f3e3-CMf81d0fa9f3e0.cpe.net.cable.rogers.com.51494: Flags [P.], seq 44428:44640, ack 1, win 1452, length 212
20:09:10.961251 IP lamp-s-1vcpu-1gb-tor1-01.ssh > CPEf81d0fa9f3e3-CMf81d0fa9f3e0.cpe.net.cable.rogers.com.51494: Flags [P.], seq 44640:44852, ack 1, win 1452, length 212
20:09:10.961357 IP lamp-s-1vcpu-1gb-tor1-01.ssh > CPEf81d0fa9f3e3-CMf81d0fa9f3e0.cpe.net.cable.rogers.com.51494: Flags [P.], seq 44852:45064, ack 1, win 1452, length 212
20:09:10.961459 IP lamp-s-1vcpu-1gb-tor1-01.ssh > CPEf81d0fa9f3e3-CMf81d0fa9f3e0.cpe.net.cable.rogers.com.51494: Flags [P.], seq 45064:45276, ack 1, win 1452, length 212
20:09:10.961568 IP lamp-s-1vcpu-1gb-tor1-01.ssh > CPEf81d0fa9f3e3-CMf81d0fa9f3e0.cpe.net.cable.rogers.com.51494: Flags [P.], seq 45276:45488, ack 1, win 1452, length 212
20:09:10.961670 IP lamp-s-1vcpu-1gb-tor1-01.ssh > CPEf81d0fa9f3e3-CMf81d0fa9f3e0.cpe.net.cable.rogers.com.51494: Flags [P.], seq 45488:45700, ack 1, win 1452, length 212
20:09:10.961795 IP lamp-s-1vcpu-1gb-tor1-01.ssh > CPEf81d0fa9f3e3-CMf81d0fa9f3e0.cpe.net.cable.rogers.com.51494: Flags [P.], seq 45700:45912, ack 1, win 1452, length 212
20:09:10.961899 IP lamp-s-1vcpu-1gb-tor1-01.ssh > CPEf81d0fa9f3e3-CMf81d0fa9f3e0.cpe.net.cable.rogers.com.51494: Flags [P.], seq 45912:46124, ack 1, win 1452, length 212
20:09:10.962060 IP lamp-s-1vcpu-1gb-tor1-01.ssh > CPEf81d0fa9f3e3-CMf81d0fa9f3e0.cpe.net.cable.rogers.com.51494: Flags [P.], seq 46124:46336, ack 1, win 1452, length 212
20:09:10.962179 IP lamp-s-1vcpu-1gb-tor1-01.ssh > CPEf81d0fa9f3e3-CMf81d0fa9f3e0.cpe.net.cable.rogers.com.51494: Flags [P.], seq 46336:46548, ack 1, win 1452, length 212
20:09:10.962284 IP lamp-s-1vcpu-1gb-tor1-01.ssh > CPEf81d0fa9f3e3-CMf81d0fa9f3e0.cpe.net.cable.rogers.com.51494: Flags [P.], seq 46548:46760, ack 1, win 1452, length 212
20:09:10.962388 IP lamp-s-1vcpu-1gb-tor1-01.ssh > CPEf81d0fa9f3e3-CMf81d0fa9f3e0.cpe.net.cable.rogers.com.51494: Flags [P.], seq 46760:46972, ack 1, win 1452, length 212
20:09:10.962489 IP lamp-s-1vcpu-1gb-tor1-01.ssh > CPEf81d0fa9f3e3-CMf81d0fa9f3e0.cpe.net.cable.rogers.com.51494: Flags [P.], seq 46972:47184, ack 1, win 1452, length 212
20:09:10.962590 IP lamp-s-1vcpu-1gb-tor1-01.ssh > CPEf81d0fa9f3e3-CMf81d0fa9f3e0.cpe.net.cable.rogers.com.51494: Flags [P.], seq 47184:47396, ack 1, win 1452, length 212
20:09:10.962692 IP lamp-s-1vcpu-1gb-tor1-01.ssh > CPEf81d0fa9f3e3-CMf81d0fa9f3e0.cpe.net.cable.rogers.com.51494: Flags [P.], seq 47396:47608, ack 1, win 1452, length 212
20:09:10.962797 IP lamp-s-1vcpu-1gb-tor1-01.ssh > CPEf81d0fa9f3e3-CMf81d0fa9f3e0.cpe.net.cable.rogers.com.51494: Flags [P.], seq 47608:47820, ack 1, win 1452, length 212
20:09:10.962973 IP lamp-s-1vcpu-1gb-tor1-01.ssh > CPEf81d0fa9f3e3-CMf81d0fa9f3e0.cpe.net.cable.rogers.com.51494: Flags [P.], seq 47820:48032, ack 1, win 1452, length 212
20:09:10.963095 IP lamp-s-1vcpu-1gb-tor1-01.ssh > CPEf81d0fa9f3e3-CMf81d0fa9f3e0.cpe.net.cable.rogers.com.51494: Flags [P.], seq 48032:48244, ack 1, win 1452, length 212
20:09:10.963202 IP lamp-s-1vcpu-1gb-tor1-01.ssh > CPEf81d0fa9f3e3-CMf81d0fa9f3e0.cpe.net.cable.rogers.com.51494: Flags [P.], seq 48244:48456, ack 1, win 1452, length 212
20:09:10.963308 IP lamp-s-1vcpu-1gb-tor1-01.ssh > CPEf81d0fa9f3e3-CMf81d0fa9f3e0.cpe.net.cable.rogers.com.51494: Flags [P.], seq 48456:48668, ack 1, win 1452, length 212
20:09:10.963414 IP lamp-s-1vcpu-1gb-tor1-01.ssh > CPEf81d0fa9f3e3-CMf81d0fa9f3e0.cpe.net.cable.rogers.com.51494: Flags [P.], seq 48668:48880, ack 1, win 1452, length 212
20:09:10.963531 IP lamp-s-1vcpu-1gb-tor1-01.ssh > CPEf81d0fa9f3e3-CMf81d0fa9f3e0.cpe.net.cable.rogers.com.51494: Flags [P.], seq 48880:49092, ack 1, win 1452, length 212
20:09:10.963637 IP lamp-s-1vcpu-1gb-tor1-01.ssh > CPEf81d0fa9f3e3-CMf81d0fa9f3e0.cpe.net.cable.rogers.com.51494: Flags [P.], seq 49092:49304, ack 1, win 1452, length 212
20:09:10.963740 IP lamp-s-1vcpu-1gb-tor1-01.ssh > CPEf81d0fa9f3e3-CMf81d0fa9f3e0.cpe.net.cable.rogers.com.51494: Flags [P.], seq 49304:49516, ack 1, win 1452, length 212
20:09:10.963843 IP lamp-s-1vcpu-1gb-tor1-01.ssh > CPEf81d0fa9f3e3-CMf81d0fa9f3e0.cpe.net.cable.rogers.com.51494: Flags [P.], seq 49516:49728, ack 1, win 1452, length 212
