root@lamp-s-1vcpu-1gb-tor1-01:~# clear
root@lamp-s-1vcpu-1gb-tor1-01:~# tcpdump -n -i eth0
tcpdump: verbose output suppressed, use -v or -vv for full protocol decode
listening on eth0, link-type EN10MB (Ethernet), capture size 262144 bytes
20:28:16.440287 IP 165.227.37.220.22 > 99.255.184.182.51494: Flags [P.], seq 3288021604:3288021712, ack 76506791, win 1452, length 108
20:28:16.440383 IP 165.227.37.220.22 > 99.255.184.182.51494: Flags [P.], seq 108:144, ack 1, win 1452, length 36
20:28:16.440484 IP 165.227.37.220.22 > 99.255.184.182.51494: Flags [P.], seq 144:252, ack 1, win 1452, length 108
20:28:16.441093 IP 165.227.37.220.22 > 99.255.184.182.51494: Flags [P.], seq 252:288, ack 1, win 1452, length 36
20:28:16.441341 IP 165.227.37.220.22 > 99.255.184.182.51494: Flags [P.], seq 288:460, ack 1, win 1452, length 172
20:28:16.441433 IP 165.227.37.220.22 > 99.255.184.182.51494: Flags [P.], seq 460:496, ack 1, win 1452, length 36
20:28:16.441550 IP 165.227.37.220.22 > 99.255.184.182.51494: Flags [P.], seq 496:644, ack 1, win 1452, length 148
20:28:16.443011 IP 95.179.140.193.36756 > 165.227.37.220.45355: Flags [SEW], seq 3567365441, win 29200, options [mss 1460,sackOK,TS val 224695208 ecr 0,nop,wscale 7], length 0
20:28:16.445550 IP 95.179.140.193.44622 > 165.227.37.220.50444: Flags [SEW], seq 3208209084, win 29200, options [mss 1460,sackOK,TS val 224695211 ecr 0,nop,wscale 7], length 0
20:28:16.455226 IP 95.179.140.193.48024 > 165.227.37.220.39419: Flags [SEW], seq 3370860275, win 29200, options [mss 1460,sackOK,TS val 224695220 ecr 0,nop,wscale 7], length 0
20:28:16.455663 IP 95.179.140.193.40542 > 165.227.37.220.63299: Flags [SEW], seq 1892378146, win 29200, options [mss 1460,sackOK,TS val 224695215 ecr 0,nop,wscale 7], length 0
20:28:16.459910 IP 99.255.184.182.51494 > 165.227.37.220.22: Flags [.], ack 252, win 4114, length 0
20:28:16.459966 IP 165.227.37.220.22 > 99.255.184.182.51494: Flags [P.], seq 644:2592, ack 1, win 1452, length 1948
20:28:16.459996 IP 99.255.184.182.51494 > 165.227.37.220.22: Flags [.], ack 644, win 4113, length 0
20:28:16.460128 IP 165.227.37.220.22 > 99.255.184.182.51494: Flags [P.], seq 2592:2732, ack 1, win 1452, length 140
20:28:16.460229 IP 165.227.37.220.22 > 99.255.184.182.51494: Flags [P.], seq 2732:2768, ack 1, win 1452, length 36
20:28:16.460363 IP 165.227.37.220.22 > 99.255.184.182.51494: Flags [P.], seq 2768:2924, ack 1, win 1452, length 156
20:28:16.460462 IP 165.227.37.220.22 > 99.255.184.182.51494: Flags [P.], seq 2924:2960, ack 1, win 1452, length 36
20:28:16.460628 IP 165.227.37.220.22 > 99.255.184.182.51494: Flags [P.], seq 2960:3100, ack 1, win 1452, length 140
20:28:16.460722 IP 165.227.37.220.22 > 99.255.184.182.51494: Flags [P.], seq 3100:3136, ack 1, win 1452, length 36
20:28:16.460828 IP 165.227.37.220.22 > 99.255.184.182.51494: Flags [P.], seq 3136:3292, ack 1, win 1452, length 156
20:28:16.472266 IP 95.179.140.193.60312 > 165.227.37.220.23854: Flags [SEW], seq 248398697, win 29200, options [mss 1460,sackOK,TS val 224695238 ecr 0,nop,wscale 7], length 0
20:28:16.472860 IP 95.179.140.193.57980 > 165.227.37.220.32691: Flags [SEW], seq 2486588792, win 29200, options [mss 1460,sackOK,TS val 224695239 ecr 0,nop,wscale 7], length 0
20:28:16.478504 IP 99.255.184.182.51494 > 165.227.37.220.22: Flags [.], ack 2732, win 4117, length 0
20:28:16.478573 IP 165.227.37.220.22 > 99.255.184.182.51494: Flags [P.], seq 3292:4952, ack 1, win 1452, length 1660
20:28:16.478605 IP 99.255.184.182.51494 > 165.227.37.220.22: Flags [.], ack 3292, win 4115, length 0
20:28:16.478620 IP 99.255.184.182.51494 > 165.227.37.220.22: Flags [P.], seq 1:37, ack 3292, win 4115, length 36
20:28:16.478799 IP 165.227.37.220.22 > 99.255.184.182.51494: Flags [P.], seq 4952:5092, ack 37, win 1452, length 140
20:28:16.478894 IP 165.227.37.220.22 > 99.255.184.182.51494: Flags [P.], seq 5092:5128, ack 37, win 1452, length 36
20:28:16.479007 IP 165.227.37.220.22 > 99.255.184.182.51494: Flags [P.], seq 5128:5284, ack 37, win 1452, length 156
20:28:16.479087 IP 165.227.37.220.22 > 99.255.184.182.51494: Flags [P.], seq 5284:5320, ack 37, win 1452, length 36
20:28:16.479189 IP 165.227.37.220.22 > 99.255.184.182.51494: Flags [P.], seq 5320:5460, ack 37, win 1452, length 140
20:28:16.479366 IP 165.227.37.220.22 > 99.255.184.182.51494: Flags [P.], seq 5496:5644, ack 37, win 1452, length 148
20:28:16.486257 IP 95.179.140.193.60910 > 165.227.37.220.40727: Flags [SEW], seq 403743406, win 29200, options [mss 1460,sackOK,TS val 224695252 ecr 0,nop,wscale 7], length 0
20:28:16.487077 IP 95.179.140.193.54772 > 165.227.37.220.18392: Flags [SEW], seq 640091270, win 29200, options [mss 1460,sackOK,TS val 224695251 ecr 0,nop,wscale 7], length 0
20:28:16.493781 IP 99.255.184.182.51494 > 165.227.37.220.22: Flags [.], ack 5460, win 4117, length 0
20:28:16.493832 IP 165.227.37.220.22 > 99.255.184.182.51494: Flags [P.], seq 5644:7328, ack 37, win 1452, length 1684
20:28:16.493986 IP 165.227.37.220.22 > 99.255.184.182.51494: Flags [P.], seq 7328:7468, ack 37, win 1452, length 140
20:28:16.494068 IP 95.179.140.193.55036 > 165.227.37.220.43412: Flags [SEW], seq 2300555335, win 29200, options [mss 1460,sackOK,TS val 224695260 ecr 0,nop,wscale 7], length 0
20:28:16.494127 IP 165.227.37.220.22 > 99.255.184.182.51494: Flags [P.], seq 7468:7504, ack 37, win 1452, length 36
20:28:16.494243 IP 165.227.37.220.22 > 99.255.184.182.51494: Flags [P.], seq 7504:7660, ack 37, win 1452, length 156
20:28:16.494334 IP 165.227.37.220.22 > 99.255.184.182.51494: Flags [P.], seq 7660:7696, ack 37, win 1452, length 36
20:28:16.494441 IP 165.227.37.220.22 > 99.255.184.182.51494: Flags [P.], seq 7696:7852, ack 37, win 1452, length 156
20:28:16.503717 IP 99.255.184.182.51494 > 165.227.37.220.22: Flags [.], ack 5644, win 4116, length 0
20:28:16.503766 IP 165.227.37.220.22 > 99.255.184.182.51494: Flags [P.], seq 7852:8904, ack 37, win 1452, length 1052
20:28:16.503987 IP 165.227.37.220.22 > 99.255.184.182.51494: Flags [P.], seq 8904:9044, ack 37, win 1452, length 140
20:28:16.511299 IP 99.255.184.182.51494 > 165.227.37.220.22: Flags [.], ack 7104, win 4117, length 0
20:28:16.511336 IP 165.227.37.220.22 > 99.255.184.182.51494: Flags [P.], seq 9044:9464, ack 37, win 1452, length 420
20:28:16.511365 IP 99.255.184.182.51494 > 165.227.37.220.22: Flags [.], ack 7852, win 4114, length 0
20:28:16.511537 IP 165.227.37.220.22 > 99.255.184.182.51494: Flags [P.], seq 9464:9604, ack 37, win 1452, length 140
20:28:16.511626 IP 165.227.37.220.22 > 99.255.184.182.51494: Flags [P.], seq 9604:9640, ack 37, win 1452, length 36
20:28:16.511729 IP 165.227.37.220.22 > 99.255.184.182.51494: Flags [P.], seq 9640:9796, ack 37, win 1452, length 156
20:28:16.511803 IP 165.227.37.220.22 > 99.255.184.182.51494: Flags [P.], seq 9796:9832, ack 37, win 1452, length 36
20:28:16.511897 IP 165.227.37.220.22 > 99.255.184.182.51494: Flags [P.], seq 9832:9972, ack 37, win 1452, length 140
20:28:16.511968 IP 165.227.37.220.22 > 99.255.184.182.51494: Flags [P.], seq 9972:10008, ack 37, win 1452, length 36
20:28:16.512079 IP 165.227.37.220.22 > 99.255.184.182.51494: Flags [P.], seq 10008:10164, ack 37, win 1452, length 156
20:28:16.513969 IP 95.179.140.193.55528 > 165.227.37.220.54681: Flags [SEW], seq 2222126005, win 29200, options [mss 1460,sackOK,TS val 224695280 ecr 0,nop,wscale 7], length 0
20:28:16.518072 IP 99.255.184.182.51494 > 165.227.37.220.22: Flags [.], ack 9044, win 4117, length 0
20:28:16.518122 IP 165.227.37.220.22 > 99.255.184.182.51494: Flags [P.], seq 10164:11564, ack 37, win 1452, length 1400
20:28:16.518162 IP 95.179.140.193.55210 > 165.227.37.220.18923: Flags [SEW], seq 3524965693, win 29200, options [mss 1460,sackOK,TS val 224695284 ecr 0,nop,wscale 7], length 0
20:28:16.518360 IP 165.227.37.220.22 > 99.255.184.182.51494: Flags [P.], seq 11564:11704, ack 37, win 1452, length 140
20:28:16.523314 IP 95.179.140.193.57184 > 165.227.37.220.10893: Flags [SEW], seq 3261215233, win 29200, options [mss 1460,sackOK,TS val 224695288 ecr 0,nop,wscale 7], length 0
20:28:16.524698 IP 99.255.184.182.51494 > 165.227.37.220.22: Flags [.], ack 9972, win 4114, length 0
20:28:16.524734 IP 165.227.37.220.22 > 99.255.184.182.51494: Flags [P.], seq 11704:12476, ack 37, win 1452, length 772
20:28:16.524865 IP 165.227.37.220.22 > 99.255.184.182.51494: Flags [P.], seq 12476:12616, ack 37, win 1452, length 140
20:28:16.525073 IP 165.227.37.220.22 > 99.255.184.182.51494: Flags [P.], seq 12616:12772, ack 37, win 1452, length 156
20:28:16.525324 IP 165.227.37.220.22 > 99.255.184.182.51494: Flags [P.], seq 12772:13048, ack 37, win 1452, length 276
20:28:16.525515 IP 165.227.37.220.22 > 99.255.184.182.51494: Flags [P.], seq 13048:13204, ack 37, win 1452, length 156
20:28:16.525689 IP 165.227.37.220.22 > 99.255.184.182.51494: Flags [P.], seq 13204:13360, ack 37, win 1452, length 156
20:28:16.528635 IP 95.179.140.193.49140 > 165.227.37.220.376: Flags [SEW], seq 3134227232, win 29200, options [mss 1460,sackOK,TS val 224695288 ecr 0,nop,wscale 7], length 0
20:28:16.530337 IP 95.179.140.193.45038 > 165.227.37.220.49413: Flags [SEW], seq 2625500894, win 29200, options [mss 1460,sackOK,TS val 224695296 ecr 0,nop,wscale 7], length 0
20:28:16.531838 IP 99.255.184.182.51494 > 165.227.37.220.22: Flags [.], ack 10164, win 4113, length 0
20:28:16.531888 IP 165.227.37.220.22 > 99.255.184.182.51494: Flags [P.], seq 13360:13940, ack 37, win 1452, length 580
20:28:16.531919 IP 99.255.184.182.51494 > 165.227.37.220.22: Flags [.], ack 11704, win 4117, length 0
20:28:16.532192 IP 165.227.37.220.22 > 99.255.184.182.51494: Flags [P.], seq 13940:14304, ack 37, win 1452, length 364
20:28:16.532390 IP 165.227.37.220.22 > 99.255.184.182.51494: Flags [P.], seq 14304:14460, ack 37, win 1452, length 156
20:28:16.532638 IP 165.227.37.220.22 > 99.255.184.182.51494: Flags [P.], seq 14460:14616, ack 37, win 1452, length 156
20:28:16.533794 IP 95.179.140.193.57384 > 165.227.37.220.54683: Flags [SEW], seq 1440548126, win 29200, options [mss 1460,sackOK,TS val 224695299 ecr 0,nop,wscale 7], length 0
20:28:16.533852 IP 95.179.140.193.57198 > 165.227.37.220.29734: Flags [SEW], seq 361098635, win 29200, options [mss 1460,sackOK,TS val 224695299 ecr 0,nop,wscale 7], length 0
20:28:16.535695 IP 95.179.140.193.57064 > 165.227.37.220.13386: Flags [SEW], seq 1674356929, win 29200, options [mss 1460,sackOK,TS val 224695301 ecr 0,nop,wscale 7], length 0
20:28:16.538246 IP 95.179.140.193.37894 > 165.227.37.220.38950: Flags [SEW], seq 2170201713, win 29200, options [mss 1460,sackOK,TS val 224695301 ecr 0,nop,wscale 7], length 0
20:28:16.540309 IP 99.255.184.182.51494 > 165.227.37.220.22: Flags [.], ack 13360, win 4117, length 0
20:28:16.540349 IP 165.227.37.220.22 > 99.255.184.182.51494: Flags [P.], seq 14616:15584, ack 37, win 1452, length 968
20:28:16.540594 IP 165.227.37.220.22 > 99.255.184.182.51494: Flags [P.], seq 15584:15844, ack 37, win 1452, length 260
20:28:16.540734 IP 165.227.37.220.22 > 99.255.184.182.51494: Flags [P.], seq 15844:16000, ack 37, win 1452, length 156
20:28:16.540849 IP 165.227.37.220.22 > 99.255.184.182.51494: Flags [P.], seq 16000:16156, ack 37, win 1452, length 156
20:28:16.540957 IP 165.227.37.220.22 > 99.255.184.182.51494: Flags [P.], seq 16156:16312, ack 37, win 1452, length 156
20:28:16.541106 IP 165.227.37.220.22 > 99.255.184.182.51494: Flags [P.], seq 16312:16468, ack 37, win 1452, length 156
20:28:16.545708 IP 95.179.140.193.51454 > 165.227.37.220.53275: Flags [SEW], seq 369666225, win 29200, options [mss 1460,sackOK,TS val 224695305 ecr 0,nop,wscale 7], length 0
20:28:16.547932 IP 99.255.184.182.51494 > 165.227.37.220.22: Flags [.], ack 14460, win 4113, length 0
20:28:16.547970 IP 165.227.37.220.22 > 99.255.184.182.51494: Flags [P.], seq 16468:16836, ack 37, win 1452, length 368
20:28:16.547998 IP 99.255.184.182.51494 > 165.227.37.220.22: Flags [.], ack 14616, win 4112, length 0
20:28:16.548273 IP 165.227.37.220.22 > 99.255.184.182.51494: Flags [P.], seq 16836:17200, ack 37, win 1452, length 364
20:28:16.548412 IP 165.227.37.220.22 > 99.255.184.182.51494: Flags [P.], seq 17200:17356, ack 37, win 1452, length 156
20:28:16.548525 IP 165.227.37.220.22 > 99.255.184.182.51494: Flags [P.], seq 17356:17512, ack 37, win 1452, length 156
20:28:16.552200 IP 95.179.140.193.38998 > 165.227.37.220.25488: Flags [SEW], seq 3299248691, win 29200, options [mss 1460,sackOK,TS val 224695312 ecr 0,nop,wscale 7], length 0
20:28:16.555406 IP 99.255.184.182.51494 > 165.227.37.220.22: Flags [.], ack 16312, win 4117, length 0
20:28:16.555445 IP 165.227.37.220.22 > 99.255.184.182.51494: Flags [P.], seq 17512:17880, ack 37, win 1452, length 368
20:28:16.555469 IP 99.255.184.182.51494 > 165.227.37.220.22: Flags [.], ack 16468, win 4117, length 0
20:28:16.555657 IP 165.227.37.220.22 > 99.255.184.182.51494: Flags [P.], seq 17880:18244, ack 37, win 1452, length 364
20:28:16.555781 IP 165.227.37.220.22 > 99.255.184.182.51494: Flags [P.], seq 18244:18400, ack 37, win 1452, length 156
20:28:16.555889 IP 165.227.37.220.22 > 99.255.184.182.51494: Flags [P.], seq 18400:18556, ack 37, win 1452, length 156
20:28:16.555995 IP 165.227.37.220.22 > 99.255.184.182.51494: Flags [P.], seq 18556:18712, ack 37, win 1452, length 156
20:28:16.556099 IP 165.227.37.220.22 > 99.255.184.182.51494: Flags [P.], seq 18712:18868, ack 37, win 1452, length 156
20:28:16.556202 IP 165.227.37.220.22 > 99.255.184.182.51494: Flags [P.], seq 18868:19024, ack 37, win 1452, length 156
20:28:16.556319 IP 165.227.37.220.22 > 99.255.184.182.51494: Flags [P.], seq 19024:19180, ack 37, win 1452, length 156
20:28:16.561893 IP 99.255.184.182.51494 > 165.227.37.220.22: Flags [.], ack 17512, win 4112, length 0
20:28:16.561946 IP 165.227.37.220.22 > 99.255.184.182.51494: Flags [P.], seq 19180:19336, ack 37, win 1452, length 156
20:28:16.562185 IP 165.227.37.220.22 > 99.255.184.182.51494: Flags [P.], seq 19336:19596, ack 37, win 1452, length 260
20:28:16.562338 IP 165.227.37.220.22 > 99.255.184.182.51494: Flags [P.], seq 19596:19752, ack 37, win 1452, length 156
20:28:16.562452 IP 165.227.37.220.22 > 99.255.184.182.51494: Flags [P.], seq 19752:19908, ack 37, win 1452, length 156
20:28:16.567199 IP 95.179.140.193.46374 > 165.227.37.220.34481: Flags [SEW], seq 3476697017, win 29200, options [mss 1460,sackOK,TS val 224695333 ecr 0,nop,wscale 7], length 0
20:28:16.569402 IP 99.255.184.182.51494 > 165.227.37.220.22: Flags [.], ack 18400, win 4117, length 0
20:28:16.569439 IP 165.227.37.220.22 > 99.255.184.182.51494: Flags [P.], seq 19908:20276, ack 37, win 1452, length 368
20:28:16.569462 IP 99.255.184.182.51494 > 165.227.37.220.22: Flags [.], ack 18712, win 4116, length 0
20:28:16.569651 IP 165.227.37.220.22 > 99.255.184.182.51494: Flags [P.], seq 20276:20640, ack 37, win 1452, length 364
20:28:16.569779 IP 165.227.37.220.22 > 99.255.184.182.51494: Flags [P.], seq 20640:20796, ack 37, win 1452, length 156
20:28:16.569888 IP 165.227.37.220.22 > 99.255.184.182.51494: Flags [P.], seq 20796:20952, ack 37, win 1452, length 156
20:28:16.569999 IP 165.227.37.220.22 > 99.255.184.182.51494: Flags [P.], seq 20952:21108, ack 37, win 1452, length 156
20:28:16.576988 IP 95.179.140.193.34308 > 165.227.37.220.24879: Flags [SEW], seq 2927921967, win 29200, options [mss 1460,sackOK,TS val 224695343 ecr 0,nop,wscale 7], length 0
20:28:16.578365 IP 99.255.184.182.51494 > 165.227.37.220.22: Flags [.], ack 18868, win 4115, length 0
20:28:16.578401 IP 165.227.37.220.22 > 99.255.184.182.51494: Flags [P.], seq 21108:21476, ack 37, win 1452, length 368
20:28:16.578426 IP 99.255.184.182.51494 > 165.227.37.220.22: Flags [.], ack 19180, win 4114, length 0
20:28:16.578435 IP 99.255.184.182.51494 > 165.227.37.220.22: Flags [.], ack 19596, win 4112, length 0
20:28:16.578640 IP 165.227.37.220.22 > 99.255.184.182.51494: Flags [P.], seq 21476:21944, ack 37, win 1452, length 468
20:28:16.578764 IP 165.227.37.220.22 > 99.255.184.182.51494: Flags [P.], seq 21944:22100, ack 37, win 1452, length 156
20:28:16.578874 IP 165.227.37.220.22 > 99.255.184.182.51494: Flags [P.], seq 22100:22256, ack 37, win 1452, length 156
20:28:16.578997 IP 165.227.37.220.22 > 99.255.184.182.51494: Flags [P.], seq 22256:22412, ack 37, win 1452, length 156
20:28:16.584759 IP 99.255.184.182.51494 > 165.227.37.220.22: Flags [.], ack 19908, win 4117, length 0
20:28:16.584804 IP 165.227.37.220.22 > 99.255.184.182.51494: Flags [P.], seq 22412:22568, ack 37, win 1452, length 156
20:28:16.584837 IP 99.255.184.182.51494 > 165.227.37.220.22: Flags [.], ack 21108, win 4112, length 0
20:28:16.585135 IP 165.227.37.220.22 > 99.255.184.182.51494: Flags [P.], seq 22568:22932, ack 37, win 1452, length 364
20:28:16.585287 IP 165.227.37.220.22 > 99.255.184.182.51494: Flags [P.], seq 22932:23088, ack 37, win 1452, length 156
20:28:16.585402 IP 165.227.37.220.22 > 99.255.184.182.51494: Flags [P.], seq 23088:23244, ack 37, win 1452, length 156
20:28:16.585509 IP 165.227.37.220.22 > 99.255.184.182.51494: Flags [P.], seq 23244:23400, ack 37, win 1452, length 156
20:28:16.585614 IP 165.227.37.220.22 > 99.255.184.182.51494: Flags [P.], seq 23400:23556, ack 37, win 1452, length 156
20:28:16.585721 IP 165.227.37.220.22 > 99.255.184.182.51494: Flags [P.], seq 23556:23712, ack 37, win 1452, length 156
20:28:16.593151 IP 99.255.184.182.51494 > 165.227.37.220.22: Flags [.], ack 22412, win 4117, length 0
20:28:16.593201 IP 165.227.37.220.22 > 99.255.184.182.51494: Flags [P.], seq 23712:23868, ack 37, win 1452, length 156
20:28:16.593423 IP 165.227.37.220.22 > 99.255.184.182.51494: Flags [P.], seq 23868:24128, ack 37, win 1452, length 260
20:28:16.593549 IP 165.227.37.220.22 > 99.255.184.182.51494: Flags [P.], seq 24128:24284, ack 37, win 1452, length 156
20:28:16.593659 IP 165.227.37.220.22 > 99.255.184.182.51494: Flags [P.], seq 24284:24440, ack 37, win 1452, length 156
20:28:16.593766 IP 165.227.37.220.22 > 99.255.184.182.51494: Flags [P.], seq 24440:24596, ack 37, win 1452, length 156
20:28:16.593872 IP 165.227.37.220.22 > 99.255.184.182.51494: Flags [P.], seq 24596:24752, ack 37, win 1452, length 156
20:28:16.599658 IP 99.255.184.182.51494 > 165.227.37.220.22: Flags [.], ack 23088, win 4115, length 0
20:28:16.599697 IP 165.227.37.220.22 > 99.255.184.182.51494: Flags [P.], seq 24752:24908, ack 37, win 1452, length 156
20:28:16.599721 IP 99.255.184.182.51494 > 165.227.37.220.22: Flags [.], ack 23712, win 4112, length 0
20:28:16.599922 IP 165.227.37.220.22 > 99.255.184.182.51494: Flags [P.], seq 24908:25272, ack 37, win 1452, length 364
20:28:16.600049 IP 165.227.37.220.22 > 99.255.184.182.51494: Flags [P.], seq 25272:25428, ack 37, win 1452, length 156
20:28:16.600159 IP 165.227.37.220.22 > 99.255.184.182.51494: Flags [P.], seq 25428:25584, ack 37, win 1452, length 156
20:28:16.600266 IP 165.227.37.220.22 > 99.255.184.182.51494: Flags [P.], seq 25584:25740, ack 37, win 1452, length 156
20:28:16.600375 IP 165.227.37.220.22 > 99.255.184.182.51494: Flags [P.], seq 25740:25896, ack 37, win 1452, length 156
20:28:16.600482 IP 165.227.37.220.22 > 99.255.184.182.51494: Flags [P.], seq 25896:26052, ack 37, win 1452, length 156
20:28:16.608430 IP 99.255.184.182.51494 > 165.227.37.220.22: Flags [.], ack 23868, win 4111, length 0
20:28:16.608468 IP 165.227.37.220.22 > 99.255.184.182.51494: Flags [P.], seq 26052:26208, ack 37, win 1452, length 156
20:28:16.610706 IP 95.179.140.193.39976 > 165.227.37.220.2569: Flags [SEW], seq 1962198584, win 29200, options [mss 1460,sackOK,TS val 224695376 ecr 0,nop,wscale 7], length 0
20:28:16.616235 IP 99.255.184.182.51494 > 165.227.37.220.22: Flags [.], ack 24752, win 4117, length 0
20:28:16.616284 IP 165.227.37.220.22 > 99.255.184.182.51494: Flags [P.], seq 26208:26680, ack 37, win 1452, length 472
20:28:16.616316 IP 99.255.184.182.51494 > 165.227.37.220.22: Flags [.], ack 25896, win 4113, length 0
20:28:16.616509 IP 165.227.37.220.22 > 99.255.184.182.51494: Flags [P.], seq 26680:27044, ack 37, win 1452, length 364
20:28:16.616682 IP 165.227.37.220.22 > 99.255.184.182.51494: Flags [P.], seq 27044:27200, ack 37, win 1452, length 156
20:28:16.616798 IP 165.227.37.220.22 > 99.255.184.182.51494: Flags [P.], seq 27200:27356, ack 37, win 1452, length 156
20:28:16.616901 IP 165.227.37.220.22 > 99.255.184.182.51494: Flags [P.], seq 27356:27512, ack 37, win 1452, length 156
20:28:16.617032 IP 165.227.37.220.22 > 99.255.184.182.51494: Flags [P.], seq 27512:27668, ack 37, win 1452, length 156
20:28:16.617149 IP 165.227.37.220.22 > 99.255.184.182.51494: Flags [P.], seq 27668:27824, ack 37, win 1452, length 156
20:28:16.617258 IP 165.227.37.220.22 > 99.255.184.182.51494: Flags [P.], seq 27824:27980, ack 37, win 1452, length 156
20:28:16.617364 IP 165.227.37.220.22 > 99.255.184.182.51494: Flags [P.], seq 27980:28136, ack 37, win 1452, length 156
20:28:16.617465 IP 165.227.37.220.22 > 99.255.184.182.51494: Flags [P.], seq 28136:28292, ack 37, win 1452, length 156
20:28:16.617566 IP 165.227.37.220.22 > 99.255.184.182.51494: Flags [P.], seq 28292:28448, ack 37, win 1452, length 156
20:28:16.623999 IP 99.255.184.182.51494 > 165.227.37.220.22: Flags [.], ack 26052, win 4112, length 0
20:28:16.624036 IP 165.227.37.220.22 > 99.255.184.182.51494: Flags [P.], seq 28448:28604, ack 37, win 1452, length 156
20:28:16.630712 IP 99.255.184.182.51494 > 165.227.37.220.22: Flags [.], ack 26680, win 4117, length 0
20:28:16.630750 IP 165.227.37.220.22 > 99.255.184.182.51494: Flags [P.], seq 28604:28864, ack 37, win 1452, length 260
20:28:16.630944 IP 165.227.37.220.22 > 99.255.184.182.51494: Flags [P.], seq 28864:29124, ack 37, win 1452, length 260
20:28:16.638976 IP 99.255.184.182.51494 > 165.227.37.220.22: Flags [.], ack 28448, win 4117, length 0
20:28:16.639019 IP 165.227.37.220.22 > 99.255.184.182.51494: Flags [P.], seq 29124:29280, ack 37, win 1452, length 156
20:28:16.639242 IP 165.227.37.220.22 > 99.255.184.182.51494: Flags [P.], seq 29280:29540, ack 37, win 1452, length 260
20:28:16.639445 IP 165.227.37.220.22 > 99.255.184.182.51494: Flags [P.], seq 29540:29696, ack 37, win 1452, length 156
20:28:16.639596 IP 165.227.37.220.22 > 99.255.184.182.51494: Flags [P.], seq 29696:29852, ack 37, win 1452, length 156
20:28:16.639752 IP 165.227.37.220.22 > 99.255.184.182.51494: Flags [P.], seq 29852:30008, ack 37, win 1452, length 156
20:28:16.639872 IP 165.227.37.220.22 > 99.255.184.182.51494: Flags [P.], seq 30008:30164, ack 37, win 1452, length 156
20:28:16.639976 IP 165.227.37.220.22 > 99.255.184.182.51494: Flags [P.], seq 30164:30320, ack 37, win 1452, length 156
20:28:16.640077 IP 165.227.37.220.22 > 99.255.184.182.51494: Flags [P.], seq 30320:30476, ack 37, win 1452, length 156
20:28:16.640211 IP 165.227.37.220.22 > 99.255.184.182.51494: Flags [P.], seq 30476:30632, ack 37, win 1452, length 156
20:28:16.640346 IP 165.227.37.220.22 > 99.255.184.182.51494: Flags [P.], seq 30632:30788, ack 37, win 1452, length 156
20:28:16.645992 IP 99.255.184.182.51494 > 165.227.37.220.22: Flags [.], ack 29124, win 4115, length 0
20:28:16.646031 IP 165.227.37.220.22 > 99.255.184.182.51494: Flags [P.], seq 30788:30944, ack 37, win 1452, length 156
20:28:16.646055 IP 99.255.184.182.51494 > 165.227.37.220.22: Flags [.], ack 30008, win 4117, length 0
20:28:16.646259 IP 165.227.37.220.22 > 99.255.184.182.51494: Flags [P.], seq 30944:31308, ack 37, win 1452, length 364
20:28:16.646379 IP 165.227.37.220.22 > 99.255.184.182.51494: Flags [P.], seq 31308:31464, ack 37, win 1452, length 156
20:28:16.646490 IP 165.227.37.220.22 > 99.255.184.182.51494: Flags [P.], seq 31464:31620, ack 37, win 1452, length 156
20:28:16.646593 IP 165.227.37.220.22 > 99.255.184.182.51494: Flags [P.], seq 31620:31776, ack 37, win 1452, length 156
20:28:16.646696 IP 165.227.37.220.22 > 99.255.184.182.51494: Flags [P.], seq 31776:31932, ack 37, win 1452, length 156
20:28:16.646797 IP 165.227.37.220.22 > 99.255.184.182.51494: Flags [P.], seq 31932:32088, ack 37, win 1452, length 156
20:28:16.646897 IP 165.227.37.220.22 > 99.255.184.182.51494: Flags [P.], seq 32088:32244, ack 37, win 1452, length 156
20:28:16.661465 IP 99.255.184.182.51494 > 165.227.37.220.22: Flags [.], ack 30788, win 4114, length 0
20:28:16.661512 IP 165.227.37.220.22 > 99.255.184.182.51494: Flags [P.], seq 32244:32400, ack 37, win 1452, length 156
20:28:16.661537 IP 99.255.184.182.51494 > 165.227.37.220.22: Flags [.], ack 31932, win 4117, length 0
20:28:16.661549 IP 99.255.184.182.51494 > 165.227.37.220.22: Flags [.], ack 32244, win 4116, length 0
20:28:16.661784 IP 165.227.37.220.22 > 99.255.184.182.51494: Flags [P.], seq 32400:32868, ack 37, win 1452, length 468
20:28:16.661906 IP 165.227.37.220.22 > 99.255.184.182.51494: Flags [P.], seq 32868:33024, ack 37, win 1452, length 156
20:28:16.662017 IP 165.227.37.220.22 > 99.255.184.182.51494: Flags [P.], seq 33024:33180, ack 37, win 1452, length 156
20:28:16.662118 IP 165.227.37.220.22 > 99.255.184.182.51494: Flags [P.], seq 33180:33336, ack 37, win 1452, length 156
20:28:16.662221 IP 165.227.37.220.22 > 99.255.184.182.51494: Flags [P.], seq 33336:33492, ack 37, win 1452, length 156
20:28:16.662322 IP 165.227.37.220.22 > 99.255.184.182.51494: Flags [P.], seq 33492:33648, ack 37, win 1452, length 156
20:28:16.662423 IP 165.227.37.220.22 > 99.255.184.182.51494: Flags [P.], seq 33648:33804, ack 37, win 1452, length 156
20:28:16.662525 IP 165.227.37.220.22 > 99.255.184.182.51494: Flags [P.], seq 33804:33960, ack 37, win 1452, length 156
20:28:16.662626 IP 165.227.37.220.22 > 99.255.184.182.51494: Flags [P.], seq 33960:34116, ack 37, win 1452, length 156
20:28:16.662725 IP 165.227.37.220.22 > 99.255.184.182.51494: Flags [P.], seq 34116:34272, ack 37, win 1452, length 156
20:28:16.662826 IP 165.227.37.220.22 > 99.255.184.182.51494: Flags [P.], seq 34272:34428, ack 37, win 1452, length 156
20:28:16.662926 IP 165.227.37.220.22 > 99.255.184.182.51494: Flags [P.], seq 34428:34584, ack 37, win 1452, length 156
20:28:16.663026 IP 165.227.37.220.22 > 99.255.184.182.51494: Flags [P.], seq 34584:34740, ack 37, win 1452, length 156
20:28:16.679146 IP 99.255.184.182.51494 > 165.227.37.220.22: Flags [.], ack 34740, win 4117, length 0
20:28:16.679206 IP 165.227.37.220.22 > 99.255.184.182.51494: Flags [P.], seq 34740:34896, ack 37, win 1452, length 156
20:28:16.679448 IP 165.227.37.220.22 > 99.255.184.182.51494: Flags [P.], seq 34896:35156, ack 37, win 1452, length 260
20:28:16.679573 IP 165.227.37.220.22 > 99.255.184.182.51494: Flags [P.], seq 35156:35312, ack 37, win 1452, length 156
20:28:16.679681 IP 165.227.37.220.22 > 99.255.184.182.51494: Flags [P.], seq 35312:35468, ack 37, win 1452, length 156
20:28:16.679786 IP 165.227.37.220.22 > 99.255.184.182.51494: Flags [P.], seq 35468:35624, ack 37, win 1452, length 156
20:28:16.679924 IP 165.227.37.220.22 > 99.255.184.182.51494: Flags [P.], seq 35624:35780, ack 37, win 1452, length 156
20:28:16.680081 IP 165.227.37.220.22 > 99.255.184.182.51494: Flags [P.], seq 35780:35936, ack 37, win 1452, length 156
20:28:16.680191 IP 165.227.37.220.22 > 99.255.184.182.51494: Flags [P.], seq 35936:36092, ack 37, win 1452, length 156
20:28:16.680295 IP 165.227.37.220.22 > 99.255.184.182.51494: Flags [P.], seq 36092:36248, ack 37, win 1452, length 156
20:28:16.680396 IP 165.227.37.220.22 > 99.255.184.182.51494: Flags [P.], seq 36248:36404, ack 37, win 1452, length 156
20:28:16.680496 IP 165.227.37.220.22 > 99.255.184.182.51494: Flags [P.], seq 36404:36560, ack 37, win 1452, length 156
20:28:16.680646 IP 165.227.37.220.22 > 99.255.184.182.51494: Flags [P.], seq 36560:36716, ack 37, win 1452, length 156
20:28:16.680759 IP 165.227.37.220.22 > 99.255.184.182.51494: Flags [P.], seq 36716:36872, ack 37, win 1452, length 156
20:28:16.680867 IP 165.227.37.220.22 > 99.255.184.182.51494: Flags [P.], seq 36872:37028, ack 37, win 1452, length 156
20:28:16.681038 IP 165.227.37.220.22 > 99.255.184.182.51494: Flags [P.], seq 37028:37184, ack 37, win 1452, length 156
20:28:16.691676 IP 99.255.184.182.51494 > 165.227.37.220.22: Flags [.], ack 35624, win 4114, length 0
20:28:16.691717 IP 165.227.37.220.22 > 99.255.184.182.51494: Flags [P.], seq 37184:37340, ack 37, win 1452, length 156
20:28:16.691741 IP 99.255.184.182.51494 > 165.227.37.220.22: Flags [.], ack 36092, win 4112, length 0
20:28:16.691947 IP 165.227.37.220.22 > 99.255.184.182.51494: Flags [P.], seq 37340:37704, ack 37, win 1452, length 364
20:28:16.692070 IP 165.227.37.220.22 > 99.255.184.182.51494: Flags [P.], seq 37704:37860, ack 37, win 1452, length 156
20:28:16.692181 IP 165.227.37.220.22 > 99.255.184.182.51494: Flags [P.], seq 37860:38016, ack 37, win 1452, length 156
20:28:16.692286 IP 165.227.37.220.22 > 99.255.184.182.51494: Flags [P.], seq 38016:38172, ack 37, win 1452, length 156
20:28:16.692388 IP 165.227.37.220.22 > 99.255.184.182.51494: Flags [P.], seq 38172:38328, ack 37, win 1452, length 156
20:28:16.692490 IP 165.227.37.220.22 > 99.255.184.182.51494: Flags [P.], seq 38328:38484, ack 37, win 1452, length 156
20:28:16.692621 IP 165.227.37.220.22 > 99.255.184.182.51494: Flags [P.], seq 38484:38640, ack 37, win 1452, length 156
20:28:16.699030 IP 99.255.184.182.51494 > 165.227.37.220.22: Flags [.], ack 36560, win 4117, length 0
20:28:16.699068 IP 165.227.37.220.22 > 99.255.184.182.51494: Flags [P.], seq 38640:38796, ack 37, win 1452, length 156
20:28:16.699091 IP 99.255.184.182.51494 > 165.227.37.220.22: Flags [.], ack 37184, win 4115, length 0
20:28:16.699327 IP 165.227.37.220.22 > 99.255.184.182.51494: Flags [P.], seq 38796:39160, ack 37, win 1452, length 364
20:28:16.699470 IP 165.227.37.220.22 > 99.255.184.182.51494: Flags [P.], seq 39160:39316, ack 37, win 1452, length 156
20:28:16.699576 IP 165.227.37.220.22 > 99.255.184.182.51494: Flags [P.], seq 39316:39472, ack 37, win 1452, length 156
20:28:16.699685 IP 165.227.37.220.22 > 99.255.184.182.51494: Flags [P.], seq 39472:39628, ack 37, win 1452, length 156
20:28:16.699789 IP 165.227.37.220.22 > 99.255.184.182.51494: Flags [P.], seq 39628:39784, ack 37, win 1452, length 156
20:28:16.699897 IP 165.227.37.220.22 > 99.255.184.182.51494: Flags [P.], seq 39784:39940, ack 37, win 1452, length 156
20:28:16.706715 IP 99.255.184.182.51494 > 165.227.37.220.22: Flags [.], ack 38640, win 4117, length 0
20:28:16.706754 IP 165.227.37.220.22 > 99.255.184.182.51494: Flags [P.], seq 39940:40096, ack 37, win 1452, length 156
20:28:16.707005 IP 165.227.37.220.22 > 99.255.184.182.51494: Flags [P.], seq 40096:40356, ack 37, win 1452, length 260
20:28:16.707150 IP 165.227.37.220.22 > 99.255.184.182.51494: Flags [P.], seq 40356:40512, ack 37, win 1452, length 156
20:28:16.707265 IP 165.227.37.220.22 > 99.255.184.182.51494: Flags [P.], seq 40512:40668, ack 37, win 1452, length 156
20:28:16.707371 IP 165.227.37.220.22 > 99.255.184.182.51494: Flags [P.], seq 40668:40824, ack 37, win 1452, length 156
20:28:16.707472 IP 165.227.37.220.22 > 99.255.184.182.51494: Flags [P.], seq 40824:40980, ack 37, win 1452, length 156
20:28:16.707573 IP 165.227.37.220.22 > 99.255.184.182.51494: Flags [P.], seq 40980:41136, ack 37, win 1452, length 156
20:28:16.707672 IP 165.227.37.220.22 > 99.255.184.182.51494: Flags [P.], seq 41136:41292, ack 37, win 1452, length 156
20:28:16.713111 IP 99.255.184.182.51494 > 165.227.37.220.22: Flags [.], ack 39628, win 4113, length 0
20:28:16.713167 IP 165.227.37.220.22 > 99.255.184.182.51494: Flags [P.], seq 41292:41448, ack 37, win 1452, length 156
20:28:16.713204 IP 99.255.184.182.51494 > 165.227.37.220.22: Flags [.], ack 39940, win 4112, length 0
20:28:16.713432 IP 165.227.37.220.22 > 99.255.184.182.51494: Flags [P.], seq 41448:41812, ack 37, win 1452, length 364
20:28:16.713556 IP 165.227.37.220.22 > 99.255.184.182.51494: Flags [P.], seq 41812:41968, ack 37, win 1452, length 156
20:28:16.713665 IP 165.227.37.220.22 > 99.255.184.182.51494: Flags [P.], seq 41968:42124, ack 37, win 1452, length 156
20:28:16.713771 IP 165.227.37.220.22 > 99.255.184.182.51494: Flags [P.], seq 42124:42280, ack 37, win 1452, length 156
20:28:16.713873 IP 165.227.37.220.22 > 99.255.184.182.51494: Flags [P.], seq 42280:42436, ack 37, win 1452, length 156
20:28:16.713974 IP 165.227.37.220.22 > 99.255.184.182.51494: Flags [P.], seq 42436:42592, ack 37, win 1452, length 156
20:28:16.722731 IP 99.255.184.182.51494 > 165.227.37.220.22: Flags [.], ack 40668, win 4117, length 0
20:28:16.722771 IP 165.227.37.220.22 > 99.255.184.182.51494: Flags [P.], seq 42592:42748, ack 37, win 1452, length 156
20:28:16.722796 IP 99.255.184.182.51494 > 165.227.37.220.22: Flags [.], ack 40980, win 4116, length 0
20:28:16.722805 IP 99.255.184.182.51494 > 165.227.37.220.22: Flags [.], ack 41292, win 4115, length 0
20:28:16.723024 IP 165.227.37.220.22 > 99.255.184.182.51494: Flags [P.], seq 42748:43216, ack 37, win 1452, length 468
20:28:16.723145 IP 165.227.37.220.22 > 99.255.184.182.51494: Flags [P.], seq 43216:43372, ack 37, win 1452, length 156
20:28:16.723254 IP 165.227.37.220.22 > 99.255.184.182.51494: Flags [P.], seq 43372:43528, ack 37, win 1452, length 156
20:28:16.723357 IP 165.227.37.220.22 > 99.255.184.182.51494: Flags [P.], seq 43528:43684, ack 37, win 1452, length 156
20:28:16.723459 IP 165.227.37.220.22 > 99.255.184.182.51494: Flags [P.], seq 43684:43840, ack 37, win 1452, length 156
20:28:16.723560 IP 165.227.37.220.22 > 99.255.184.182.51494: Flags [P.], seq 43840:43996, ack 37, win 1452, length 156
20:28:16.723660 IP 165.227.37.220.22 > 99.255.184.182.51494: Flags [P.], seq 43996:44152, ack 37, win 1452, length 156
20:28:16.723761 IP 165.227.37.220.22 > 99.255.184.182.51494: Flags [P.], seq 44152:44308, ack 37, win 1452, length 156
20:28:16.730620 IP 99.255.184.182.51494 > 165.227.37.220.22: Flags [.], ack 42592, win 4117, length 0
20:28:16.730663 IP 165.227.37.220.22 > 99.255.184.182.51494: Flags [P.], seq 44308:44464, ack 37, win 1452, length 156
20:28:16.730860 IP 165.227.37.220.22 > 99.255.184.182.51494: Flags [P.], seq 44464:44724, ack 37, win 1452, length 260
20:28:16.730980 IP 165.227.37.220.22 > 99.255.184.182.51494: Flags [P.], seq 44724:44880, ack 37, win 1452, length 156
20:28:16.731123 IP 165.227.37.220.22 > 99.255.184.182.51494: Flags [P.], seq 44880:45036, ack 37, win 1452, length 156
20:28:16.731345 IP 165.227.37.220.22 > 99.255.184.182.51494: Flags [P.], seq 45036:45192, ack 37, win 1452, length 156
20:28:16.731529 IP 165.227.37.220.22 > 99.255.184.182.51494: Flags [P.], seq 45192:45348, ack 37, win 1452, length 156
20:28:16.731642 IP 165.227.37.220.22 > 99.255.184.182.51494: Flags [P.], seq 45348:45504, ack 37, win 1452, length 156
20:28:16.737682 IP 95.179.140.193.45390 > 165.227.37.220.32684: Flags [S], seq 260326615, win 29200, options [mss 1460,sackOK,TS val 224695503 ecr 0,nop,wscale 7], length 0
20:28:16.738510 IP 99.255.184.182.51494 > 165.227.37.220.22: Flags [.], ack 43528, win 4114, length 0
20:28:16.738548 IP 165.227.37.220.22 > 99.255.184.182.51494: Flags [P.], seq 45504:45872, ack 37, win 1452, length 368
20:28:16.738578 IP 99.255.184.182.51494 > 165.227.37.220.22: Flags [.], ack 43840, win 4112, length 0
20:28:16.738591 IP 99.255.184.182.51494 > 165.227.37.220.22: Flags [.], ack 44308, win 4117, length 0
20:28:16.738879 IP 165.227.37.220.22 > 99.255.184.182.51494: Flags [P.], seq 45872:46340, ack 37, win 1452, length 468
20:28:16.739082 IP 165.227.37.220.22 > 99.255.184.182.51494: Flags [P.], seq 46340:46496, ack 37, win 1452, length 156
20:28:16.739275 IP 165.227.37.220.22 > 99.255.184.182.51494: Flags [P.], seq 46496:46652, ack 37, win 1452, length 156
20:28:16.739456 IP 165.227.37.220.22 > 99.255.184.182.51494: Flags [P.], seq 46652:46808, ack 37, win 1452, length 156
20:28:16.739610 IP 165.227.37.220.22 > 99.255.184.182.51494: Flags [P.], seq 46808:46964, ack 37, win 1452, length 156
20:28:16.739766 IP 165.227.37.220.22 > 99.255.184.182.51494: Flags [P.], seq 46964:47120, ack 37, win 1452, length 156
20:28:16.739885 IP 165.227.37.220.22 > 99.255.184.182.51494: Flags [P.], seq 47120:47276, ack 37, win 1452, length 156
20:28:16.739990 IP 165.227.37.220.22 > 99.255.184.182.51494: Flags [P.], seq 47276:47432, ack 37, win 1452, length 156
20:28:16.747643 IP 99.255.184.182.51494 > 165.227.37.220.22: Flags [.], ack 44880, win 4115, length 0
20:28:16.747691 IP 165.227.37.220.22 > 99.255.184.182.51494: Flags [P.], seq 47432:47588, ack 37, win 1452, length 156
20:28:16.747714 IP 99.255.184.182.51494 > 165.227.37.220.22: Flags [.], ack 45348, win 4113, length 0
20:28:16.747724 IP 99.255.184.182.51494 > 165.227.37.220.22: Flags [.], ack 45504, win 4112, length 0
20:28:16.747948 IP 165.227.37.220.22 > 99.255.184.182.51494: Flags [P.], seq 47588:48056, ack 37, win 1452, length 468
20:28:16.748074 IP 165.227.37.220.22 > 99.255.184.182.51494: Flags [P.], seq 48056:48212, ack 37, win 1452, length 156
20:28:16.748183 IP 165.227.37.220.22 > 99.255.184.182.51494: Flags [P.], seq 48212:48368, ack 37, win 1452, length 156
20:28:16.748293 IP 165.227.37.220.22 > 99.255.184.182.51494: Flags [P.], seq 48368:48524, ack 37, win 1452, length 156
20:28:16.748396 IP 165.227.37.220.22 > 99.255.184.182.51494: Flags [P.], seq 48524:48680, ack 37, win 1452, length 156
20:28:16.748533 IP 165.227.37.220.22 > 99.255.184.182.51494: Flags [P.], seq 48680:48836, ack 37, win 1452, length 156
20:28:16.753970 IP 99.255.184.182.51494 > 165.227.37.220.22: Flags [.], ack 46808, win 4117, length 0
20:28:16.754049 IP 165.227.37.220.22 > 99.255.184.182.51494: Flags [P.], seq 48836:48992, ack 37, win 1452, length 156
20:28:16.754076 IP 99.255.184.182.51494 > 165.227.37.220.22: Flags [.], ack 47432, win 4115, length 0
20:28:16.754344 IP 165.227.37.220.22 > 99.255.184.182.51494: Flags [P.], seq 48992:49356, ack 37, win 1452, length 364
20:28:16.754506 IP 165.227.37.220.22 > 99.255.184.182.51494: Flags [P.], seq 49356:49512, ack 37, win 1452, length 156
20:28:16.754629 IP 165.227.37.220.22 > 99.255.184.182.51494: Flags [P.], seq 49512:49668, ack 37, win 1452, length 156
20:28:16.754733 IP 165.227.37.220.22 > 99.255.184.182.51494: Flags [P.], seq 49668:49824, ack 37, win 1452, length 156
20:28:16.754836 IP 165.227.37.220.22 > 99.255.184.182.51494: Flags [P.], seq 49824:49980, ack 37, win 1452, length 156
20:28:16.754951 IP 165.227.37.220.22 > 99.255.184.182.51494: Flags [P.], seq 49980:50136, ack 37, win 1452, length 156
20:28:16.755071 IP 165.227.37.220.22 > 99.255.184.182.51494: Flags [P.], seq 50136:50292, ack 37, win 1452, length 156
20:28:16.755178 IP 165.227.37.220.22 > 99.255.184.182.51494: Flags [P.], seq 50292:50448, ack 37, win 1452, length 156
20:28:16.758369 IP 99.255.184.182.51494 > 165.227.37.220.22: Flags [.], ack 47588, win 4114, length 0
20:28:16.758405 IP 165.227.37.220.22 > 99.255.184.182.51494: Flags [P.], seq 50448:50604, ack 37, win 1452, length 156
20:28:16.765114 IP 99.255.184.182.51494 > 165.227.37.220.22: Flags [.], ack 48836, win 4117, length 0
20:28:16.765167 IP 165.227.37.220.22 > 99.255.184.182.51494: Flags [P.], seq 50604:50864, ack 37, win 1452, length 260
20:28:16.765390 IP 165.227.37.220.22 > 99.255.184.182.51494: Flags [P.], seq 50864:51124, ack 37, win 1452, length 260
20:28:16.765514 IP 165.227.37.220.22 > 99.255.184.182.51494: Flags [P.], seq 51124:51280, ack 37, win 1452, length 156
20:28:16.765622 IP 165.227.37.220.22 > 99.255.184.182.51494: Flags [P.], seq 51280:51436, ack 37, win 1452, length 156
20:28:16.765725 IP 165.227.37.220.22 > 99.255.184.182.51494: Flags [P.], seq 51436:51592, ack 37, win 1452, length 156
20:28:16.765827 IP 165.227.37.220.22 > 99.255.184.182.51494: Flags [P.], seq 51592:51748, ack 37, win 1452, length 156
20:28:16.765928 IP 165.227.37.220.22 > 99.255.184.182.51494: Flags [P.], seq 51748:51904, ack 37, win 1452, length 156
20:28:16.780365 IP 99.255.184.182.51494 > 165.227.37.220.22: Flags [.], ack 49980, win 4113, length 0
20:28:16.780434 IP 165.227.37.220.22 > 99.255.184.182.51494: Flags [P.], seq 51904:52060, ack 37, win 1452, length 156
20:28:16.780472 IP 99.255.184.182.51494 > 165.227.37.220.22: Flags [.], ack 50448, win 4117, length 0
