root@lamp-s-1vcpu-1gb-tor1-01:~# clear
root@lamp-s-1vcpu-1gb-tor1-01:~# tcpdump -i eth0 port 22
tcpdump: verbose output suppressed, use -v or -vv for full protocol decode
listening on eth0, link-type EN10MB (Ethernet), capture size 262144 bytes
20:33:38.166854 IP lamp-s-1vcpu-1gb-tor1-01.ssh > CPEf81d0fa9f3e3-CMf81d0fa9f3e0.cpe.net.cable.rogers.com.51494: Flags [P.], seq 3290415152:3290415260, ack 76510947, win 1452, length 108
20:33:38.166967 IP lamp-s-1vcpu-1gb-tor1-01.ssh > CPEf81d0fa9f3e3-CMf81d0fa9f3e0.cpe.net.cable.rogers.com.51494: Flags [P.], seq 108:144, ack 1, win 1452, length 36
20:33:38.167062 IP lamp-s-1vcpu-1gb-tor1-01.ssh > CPEf81d0fa9f3e3-CMf81d0fa9f3e0.cpe.net.cable.rogers.com.51494: Flags [P.], seq 144:252, ack 1, win 1452, length 108
20:33:38.167136 IP lamp-s-1vcpu-1gb-tor1-01.ssh > CPEf81d0fa9f3e3-CMf81d0fa9f3e0.cpe.net.cable.rogers.com.51494: Flags [P.], seq 252:288, ack 1, win 1452, length 36
20:33:38.169102 IP lamp-s-1vcpu-1gb-tor1-01.ssh > CPEf81d0fa9f3e3-CMf81d0fa9f3e0.cpe.net.cable.rogers.com.51494: Flags [P.], seq 288:508, ack 1, win 1452, length 220
20:33:38.169223 IP lamp-s-1vcpu-1gb-tor1-01.ssh > CPEf81d0fa9f3e3-CMf81d0fa9f3e0.cpe.net.cable.rogers.com.51494: Flags [P.], seq 508:544, ack 1, win 1452, length 36
20:33:38.169381 IP lamp-s-1vcpu-1gb-tor1-01.ssh > CPEf81d0fa9f3e3-CMf81d0fa9f3e0.cpe.net.cable.rogers.com.51494: Flags [P.], seq 544:748, ack 1, win 1452, length 204
20:33:38.169464 IP lamp-s-1vcpu-1gb-tor1-01.ssh > CPEf81d0fa9f3e3-CMf81d0fa9f3e0.cpe.net.cable.rogers.com.51494: Flags [P.], seq 748:784, ack 1, win 1452, length 36
20:33:38.169564 IP lamp-s-1vcpu-1gb-tor1-01.ssh > CPEf81d0fa9f3e3-CMf81d0fa9f3e0.cpe.net.cable.rogers.com.51494: Flags [P.], seq 784:988, ack 1, win 1452, length 204
20:33:38.215261 IP CPEf81d0fa9f3e3-CMf81d0fa9f3e0.cpe.net.cable.rogers.com.51494 > lamp-s-1vcpu-1gb-tor1-01.ssh: Flags [.], ack 988, win 4117, length 0
20:33:38.215338 IP lamp-s-1vcpu-1gb-tor1-01.ssh > CPEf81d0fa9f3e3-CMf81d0fa9f3e0.cpe.net.cable.rogers.com.51494: Flags [P.], seq 988:2464, ack 1, win 1452, length 1476
20:33:38.215570 IP lamp-s-1vcpu-1gb-tor1-01.ssh > CPEf81d0fa9f3e3-CMf81d0fa9f3e0.cpe.net.cable.rogers.com.51494: Flags [P.], seq 2464:2652, ack 1, win 1452, length 188
20:33:38.215728 IP lamp-s-1vcpu-1gb-tor1-01.ssh > CPEf81d0fa9f3e3-CMf81d0fa9f3e0.cpe.net.cable.rogers.com.51494: Flags [P.], seq 2652:2688, ack 1, win 1452, length 36
20:33:38.215902 IP lamp-s-1vcpu-1gb-tor1-01.ssh > CPEf81d0fa9f3e3-CMf81d0fa9f3e0.cpe.net.cable.rogers.com.51494: Flags [P.], seq 2688:2892, ack 1, win 1452, length 204
20:33:38.216022 IP lamp-s-1vcpu-1gb-tor1-01.ssh > CPEf81d0fa9f3e3-CMf81d0fa9f3e0.cpe.net.cable.rogers.com.51494: Flags [P.], seq 2892:2928, ack 1, win 1452, length 36
20:33:38.216139 IP lamp-s-1vcpu-1gb-tor1-01.ssh > CPEf81d0fa9f3e3-CMf81d0fa9f3e0.cpe.net.cable.rogers.com.51494: Flags [P.], seq 2928:3132, ack 1, win 1452, length 204
20:33:38.216211 IP lamp-s-1vcpu-1gb-tor1-01.ssh > CPEf81d0fa9f3e3-CMf81d0fa9f3e0.cpe.net.cable.rogers.com.51494: Flags [P.], seq 3132:3168, ack 1, win 1452, length 36
20:33:38.216306 IP lamp-s-1vcpu-1gb-tor1-01.ssh > CPEf81d0fa9f3e3-CMf81d0fa9f3e0.cpe.net.cable.rogers.com.51494: Flags [P.], seq 3168:3372, ack 1, win 1452, length 204
20:33:38.216380 IP lamp-s-1vcpu-1gb-tor1-01.ssh > CPEf81d0fa9f3e3-CMf81d0fa9f3e0.cpe.net.cable.rogers.com.51494: Flags [P.], seq 3372:3408, ack 1, win 1452, length 36
20:33:38.216474 IP lamp-s-1vcpu-1gb-tor1-01.ssh > CPEf81d0fa9f3e3-CMf81d0fa9f3e0.cpe.net.cable.rogers.com.51494: Flags [P.], seq 3408:3612, ack 1, win 1452, length 204
20:33:38.216674 IP lamp-s-1vcpu-1gb-tor1-01.ssh > CPEf81d0fa9f3e3-CMf81d0fa9f3e0.cpe.net.cable.rogers.com.51494: Flags [P.], seq 3648:3852, ack 1, win 1452, length 204
20:33:38.216845 IP lamp-s-1vcpu-1gb-tor1-01.ssh > CPEf81d0fa9f3e3-CMf81d0fa9f3e0.cpe.net.cable.rogers.com.51494: Flags [P.], seq 3888:4092, ack 1, win 1452, length 204
20:33:38.217010 IP lamp-s-1vcpu-1gb-tor1-01.ssh > CPEf81d0fa9f3e3-CMf81d0fa9f3e0.cpe.net.cable.rogers.com.51494: Flags [P.], seq 4128:4332, ack 1, win 1452, length 204
20:33:38.217283 IP lamp-s-1vcpu-1gb-tor1-01.ssh > CPEf81d0fa9f3e3-CMf81d0fa9f3e0.cpe.net.cable.rogers.com.51494: Flags [P.], seq 4368:4572, ack 1, win 1452, length 204
20:33:38.237457 IP CPEf81d0fa9f3e3-CMf81d0fa9f3e0.cpe.net.cable.rogers.com.51494 > lamp-s-1vcpu-1gb-tor1-01.ssh: Flags [.], ack 2652, win 4117, length 0
20:33:38.237532 IP lamp-s-1vcpu-1gb-tor1-01.ssh > CPEf81d0fa9f3e3-CMf81d0fa9f3e0.cpe.net.cable.rogers.com.51494: Flags [P.], seq 4608:6048, ack 1, win 1452, length 1440
20:33:38.237714 IP lamp-s-1vcpu-1gb-tor1-01.ssh > CPEf81d0fa9f3e3-CMf81d0fa9f3e0.cpe.net.cable.rogers.com.51494: Flags [P.], seq 6048:6236, ack 1, win 1452, length 188
20:33:38.237804 IP lamp-s-1vcpu-1gb-tor1-01.ssh > CPEf81d0fa9f3e3-CMf81d0fa9f3e0.cpe.net.cable.rogers.com.51494: Flags [P.], seq 6236:6272, ack 1, win 1452, length 36
20:33:38.237908 IP lamp-s-1vcpu-1gb-tor1-01.ssh > CPEf81d0fa9f3e3-CMf81d0fa9f3e0.cpe.net.cable.rogers.com.51494: Flags [P.], seq 6272:6476, ack 1, win 1452, length 204
20:33:38.237981 IP lamp-s-1vcpu-1gb-tor1-01.ssh > CPEf81d0fa9f3e3-CMf81d0fa9f3e0.cpe.net.cable.rogers.com.51494: Flags [P.], seq 6476:6512, ack 1, win 1452, length 36
20:33:38.238078 IP lamp-s-1vcpu-1gb-tor1-01.ssh > CPEf81d0fa9f3e3-CMf81d0fa9f3e0.cpe.net.cable.rogers.com.51494: Flags [P.], seq 6512:6716, ack 1, win 1452, length 204
20:33:38.244861 IP CPEf81d0fa9f3e3-CMf81d0fa9f3e0.cpe.net.cable.rogers.com.51494 > lamp-s-1vcpu-1gb-tor1-01.ssh: Flags [.], ack 4092, win 4112, length 0
20:33:38.244910 IP lamp-s-1vcpu-1gb-tor1-01.ssh > CPEf81d0fa9f3e3-CMf81d0fa9f3e0.cpe.net.cable.rogers.com.51494: Flags [P.], seq 6716:7712, ack 1, win 1452, length 996
20:33:38.245110 IP lamp-s-1vcpu-1gb-tor1-01.ssh > CPEf81d0fa9f3e3-CMf81d0fa9f3e0.cpe.net.cable.rogers.com.51494: Flags [P.], seq 7712:7900, ack 1, win 1452, length 188
20:33:38.245227 IP lamp-s-1vcpu-1gb-tor1-01.ssh > CPEf81d0fa9f3e3-CMf81d0fa9f3e0.cpe.net.cable.rogers.com.51494: Flags [P.], seq 7900:7936, ack 1, win 1452, length 36
20:33:38.245340 IP lamp-s-1vcpu-1gb-tor1-01.ssh > CPEf81d0fa9f3e3-CMf81d0fa9f3e0.cpe.net.cable.rogers.com.51494: Flags [P.], seq 7936:8140, ack 1, win 1452, length 204
20:33:38.245414 IP lamp-s-1vcpu-1gb-tor1-01.ssh > CPEf81d0fa9f3e3-CMf81d0fa9f3e0.cpe.net.cable.rogers.com.51494: Flags [P.], seq 8140:8176, ack 1, win 1452, length 36
20:33:38.245527 IP lamp-s-1vcpu-1gb-tor1-01.ssh > CPEf81d0fa9f3e3-CMf81d0fa9f3e0.cpe.net.cable.rogers.com.51494: Flags [P.], seq 8176:8380, ack 1, win 1452, length 204
20:33:38.245642 IP lamp-s-1vcpu-1gb-tor1-01.ssh > CPEf81d0fa9f3e3-CMf81d0fa9f3e0.cpe.net.cable.rogers.com.51494: Flags [P.], seq 8380:8416, ack 1, win 1452, length 36
20:33:38.245768 IP lamp-s-1vcpu-1gb-tor1-01.ssh > CPEf81d0fa9f3e3-CMf81d0fa9f3e0.cpe.net.cable.rogers.com.51494: Flags [P.], seq 8416:8620, ack 1, win 1452, length 204
20:33:38.245853 IP lamp-s-1vcpu-1gb-tor1-01.ssh > CPEf81d0fa9f3e3-CMf81d0fa9f3e0.cpe.net.cable.rogers.com.51494: Flags [P.], seq 8620:8656, ack 1, win 1452, length 36
20:33:38.245952 IP lamp-s-1vcpu-1gb-tor1-01.ssh > CPEf81d0fa9f3e3-CMf81d0fa9f3e0.cpe.net.cable.rogers.com.51494: Flags [P.], seq 8656:8860, ack 1, win 1452, length 204
20:33:38.246142 IP lamp-s-1vcpu-1gb-tor1-01.ssh > CPEf81d0fa9f3e3-CMf81d0fa9f3e0.cpe.net.cable.rogers.com.51494: Flags [P.], seq 8896:9100, ack 1, win 1452, length 204
20:33:38.246441 IP lamp-s-1vcpu-1gb-tor1-01.ssh > CPEf81d0fa9f3e3-CMf81d0fa9f3e0.cpe.net.cable.rogers.com.51494: Flags [P.], seq 9136:10012, ack 1, win 1452, length 876
20:33:38.246584 IP lamp-s-1vcpu-1gb-tor1-01.ssh > CPEf81d0fa9f3e3-CMf81d0fa9f3e0.cpe.net.cable.rogers.com.51494: Flags [P.], seq 10012:10392, ack 1, win 1452, length 380
20:33:38.246708 IP lamp-s-1vcpu-1gb-tor1-01.ssh > CPEf81d0fa9f3e3-CMf81d0fa9f3e0.cpe.net.cable.rogers.com.51494: Flags [P.], seq 10392:10604, ack 1, win 1452, length 212
20:33:38.246865 IP lamp-s-1vcpu-1gb-tor1-01.ssh > CPEf81d0fa9f3e3-CMf81d0fa9f3e0.cpe.net.cable.rogers.com.51494: Flags [P.], seq 10604:10816, ack 1, win 1452, length 212
20:33:38.246983 IP lamp-s-1vcpu-1gb-tor1-01.ssh > CPEf81d0fa9f3e3-CMf81d0fa9f3e0.cpe.net.cable.rogers.com.51494: Flags [P.], seq 10816:11028, ack 1, win 1452, length 212
20:33:38.247145 IP lamp-s-1vcpu-1gb-tor1-01.ssh > CPEf81d0fa9f3e3-CMf81d0fa9f3e0.cpe.net.cable.rogers.com.51494: Flags [P.], seq 11028:11240, ack 1, win 1452, length 212
20:33:38.247315 IP lamp-s-1vcpu-1gb-tor1-01.ssh > CPEf81d0fa9f3e3-CMf81d0fa9f3e0.cpe.net.cable.rogers.com.51494: Flags [P.], seq 11240:11452, ack 1, win 1452, length 212
20:33:38.247483 IP lamp-s-1vcpu-1gb-tor1-01.ssh > CPEf81d0fa9f3e3-CMf81d0fa9f3e0.cpe.net.cable.rogers.com.51494: Flags [P.], seq 11452:11664, ack 1, win 1452, length 212
20:33:38.247638 IP lamp-s-1vcpu-1gb-tor1-01.ssh > CPEf81d0fa9f3e3-CMf81d0fa9f3e0.cpe.net.cable.rogers.com.51494: Flags [P.], seq 11664:11876, ack 1, win 1452, length 212
20:33:38.247754 IP lamp-s-1vcpu-1gb-tor1-01.ssh > CPEf81d0fa9f3e3-CMf81d0fa9f3e0.cpe.net.cable.rogers.com.51494: Flags [P.], seq 11876:12088, ack 1, win 1452, length 212
20:33:38.247914 IP lamp-s-1vcpu-1gb-tor1-01.ssh > CPEf81d0fa9f3e3-CMf81d0fa9f3e0.cpe.net.cable.rogers.com.51494: Flags [P.], seq 12088:12300, ack 1, win 1452, length 212
20:33:38.254129 IP CPEf81d0fa9f3e3-CMf81d0fa9f3e0.cpe.net.cable.rogers.com.51494 > lamp-s-1vcpu-1gb-tor1-01.ssh: Flags [.], ack 4572, win 4117, length 0
20:33:38.254192 IP lamp-s-1vcpu-1gb-tor1-01.ssh > CPEf81d0fa9f3e3-CMf81d0fa9f3e0.cpe.net.cable.rogers.com.51494: Flags [P.], seq 12300:12512, ack 1, win 1452, length 212
20:33:38.254472 IP lamp-s-1vcpu-1gb-tor1-01.ssh > CPEf81d0fa9f3e3-CMf81d0fa9f3e0.cpe.net.cable.rogers.com.51494: Flags [P.], seq 12512:12876, ack 1, win 1452, length 364
20:33:38.254649 IP lamp-s-1vcpu-1gb-tor1-01.ssh > CPEf81d0fa9f3e3-CMf81d0fa9f3e0.cpe.net.cable.rogers.com.51494: Flags [P.], seq 12876:13088, ack 1, win 1452, length 212
20:33:38.254772 IP lamp-s-1vcpu-1gb-tor1-01.ssh > CPEf81d0fa9f3e3-CMf81d0fa9f3e0.cpe.net.cable.rogers.com.51494: Flags [P.], seq 13088:13300, ack 1, win 1452, length 212
20:33:38.254926 IP lamp-s-1vcpu-1gb-tor1-01.ssh > CPEf81d0fa9f3e3-CMf81d0fa9f3e0.cpe.net.cable.rogers.com.51494: Flags [P.], seq 13300:13512, ack 1, win 1452, length 212
20:33:38.255063 IP lamp-s-1vcpu-1gb-tor1-01.ssh > CPEf81d0fa9f3e3-CMf81d0fa9f3e0.cpe.net.cable.rogers.com.51494: Flags [P.], seq 13512:13724, ack 1, win 1452, length 212
20:33:38.255257 IP lamp-s-1vcpu-1gb-tor1-01.ssh > CPEf81d0fa9f3e3-CMf81d0fa9f3e0.cpe.net.cable.rogers.com.51494: Flags [P.], seq 13724:13936, ack 1, win 1452, length 212
20:33:38.255392 IP lamp-s-1vcpu-1gb-tor1-01.ssh > CPEf81d0fa9f3e3-CMf81d0fa9f3e0.cpe.net.cable.rogers.com.51494: Flags [P.], seq 13936:14148, ack 1, win 1452, length 212
20:33:38.289219 IP CPEf81d0fa9f3e3-CMf81d0fa9f3e0.cpe.net.cable.rogers.com.51494 > lamp-s-1vcpu-1gb-tor1-01.ssh: Flags [.], ack 4608, win 4117, length 0
20:33:38.289324 IP lamp-s-1vcpu-1gb-tor1-01.ssh > CPEf81d0fa9f3e3-CMf81d0fa9f3e0.cpe.net.cable.rogers.com.51494: Flags [P.], seq 14148:14360, ack 1, win 1452, length 212
20:33:38.289374 IP CPEf81d0fa9f3e3-CMf81d0fa9f3e0.cpe.net.cable.rogers.com.51494 > lamp-s-1vcpu-1gb-tor1-01.ssh: Flags [.], ack 6716, win 4117, length 0
20:33:38.289400 IP CPEf81d0fa9f3e3-CMf81d0fa9f3e0.cpe.net.cable.rogers.com.51494 > lamp-s-1vcpu-1gb-tor1-01.ssh: Flags [P.], seq 1:37, ack 7712, win 4113, length 36
20:33:38.289749 IP lamp-s-1vcpu-1gb-tor1-01.ssh > CPEf81d0fa9f3e3-CMf81d0fa9f3e0.cpe.net.cable.rogers.com.51494: Flags [P.], seq 14360:15044, ack 37, win 1452, length 684
20:33:38.289917 IP lamp-s-1vcpu-1gb-tor1-01.ssh > CPEf81d0fa9f3e3-CMf81d0fa9f3e0.cpe.net.cable.rogers.com.51494: Flags [P.], seq 15044:15256, ack 37, win 1452, length 212
20:33:38.290073 IP lamp-s-1vcpu-1gb-tor1-01.ssh > CPEf81d0fa9f3e3-CMf81d0fa9f3e0.cpe.net.cable.rogers.com.51494: Flags [P.], seq 15256:15468, ack 37, win 1452, length 212
20:33:38.290241 IP lamp-s-1vcpu-1gb-tor1-01.ssh > CPEf81d0fa9f3e3-CMf81d0fa9f3e0.cpe.net.cable.rogers.com.51494: Flags [P.], seq 15468:15680, ack 37, win 1452, length 212
20:33:38.290359 IP lamp-s-1vcpu-1gb-tor1-01.ssh > CPEf81d0fa9f3e3-CMf81d0fa9f3e0.cpe.net.cable.rogers.com.51494: Flags [P.], seq 15680:15892, ack 37, win 1452, length 212
20:33:38.290488 IP lamp-s-1vcpu-1gb-tor1-01.ssh > CPEf81d0fa9f3e3-CMf81d0fa9f3e0.cpe.net.cable.rogers.com.51494: Flags [P.], seq 15892:16104, ack 37, win 1452, length 212
20:33:38.290598 IP lamp-s-1vcpu-1gb-tor1-01.ssh > CPEf81d0fa9f3e3-CMf81d0fa9f3e0.cpe.net.cable.rogers.com.51494: Flags [P.], seq 16104:16316, ack 37, win 1452, length 212
20:33:38.290703 IP lamp-s-1vcpu-1gb-tor1-01.ssh > CPEf81d0fa9f3e3-CMf81d0fa9f3e0.cpe.net.cable.rogers.com.51494: Flags [P.], seq 16316:16528, ack 37, win 1452, length 212
20:33:38.290808 IP lamp-s-1vcpu-1gb-tor1-01.ssh > CPEf81d0fa9f3e3-CMf81d0fa9f3e0.cpe.net.cable.rogers.com.51494: Flags [P.], seq 16528:16740, ack 37, win 1452, length 212
20:33:38.290936 IP lamp-s-1vcpu-1gb-tor1-01.ssh > CPEf81d0fa9f3e3-CMf81d0fa9f3e0.cpe.net.cable.rogers.com.51494: Flags [P.], seq 16740:16952, ack 37, win 1452, length 212
20:33:38.291120 IP lamp-s-1vcpu-1gb-tor1-01.ssh > CPEf81d0fa9f3e3-CMf81d0fa9f3e0.cpe.net.cable.rogers.com.51494: Flags [P.], seq 16952:17164, ack 37, win 1452, length 212
20:33:38.291317 IP lamp-s-1vcpu-1gb-tor1-01.ssh > CPEf81d0fa9f3e3-CMf81d0fa9f3e0.cpe.net.cable.rogers.com.51494: Flags [P.], seq 17164:17376, ack 37, win 1452, length 212
20:33:38.291500 IP lamp-s-1vcpu-1gb-tor1-01.ssh > CPEf81d0fa9f3e3-CMf81d0fa9f3e0.cpe.net.cable.rogers.com.51494: Flags [P.], seq 17376:17588, ack 37, win 1452, length 212
20:33:38.291676 IP lamp-s-1vcpu-1gb-tor1-01.ssh > CPEf81d0fa9f3e3-CMf81d0fa9f3e0.cpe.net.cable.rogers.com.51494: Flags [P.], seq 17588:17800, ack 37, win 1452, length 212
20:33:38.291834 IP lamp-s-1vcpu-1gb-tor1-01.ssh > CPEf81d0fa9f3e3-CMf81d0fa9f3e0.cpe.net.cable.rogers.com.51494: Flags [P.], seq 17800:18012, ack 37, win 1452, length 212
20:33:38.297194 IP CPEf81d0fa9f3e3-CMf81d0fa9f3e0.cpe.net.cable.rogers.com.51494 > lamp-s-1vcpu-1gb-tor1-01.ssh: Flags [.], ack 10012, win 4117, length 0
20:33:38.297246 IP lamp-s-1vcpu-1gb-tor1-01.ssh > CPEf81d0fa9f3e3-CMf81d0fa9f3e0.cpe.net.cable.rogers.com.51494: Flags [P.], seq 18012:18224, ack 37, win 1452, length 212
20:33:38.297271 IP CPEf81d0fa9f3e3-CMf81d0fa9f3e0.cpe.net.cable.rogers.com.51494 > lamp-s-1vcpu-1gb-tor1-01.ssh: Flags [.], ack 11452, win 4112, length 0
20:33:38.297284 IP CPEf81d0fa9f3e3-CMf81d0fa9f3e0.cpe.net.cable.rogers.com.51494 > lamp-s-1vcpu-1gb-tor1-01.ssh: Flags [.], ack 14148, win 4117, length 0
20:33:38.297298 IP CPEf81d0fa9f3e3-CMf81d0fa9f3e0.cpe.net.cable.rogers.com.51494 > lamp-s-1vcpu-1gb-tor1-01.ssh: Flags [.], ack 15468, win 4112, length 0
20:33:38.297306 IP CPEf81d0fa9f3e3-CMf81d0fa9f3e0.cpe.net.cable.rogers.com.51494 > lamp-s-1vcpu-1gb-tor1-01.ssh: Flags [.], ack 15680, win 4117, length 0
20:33:38.297560 IP lamp-s-1vcpu-1gb-tor1-01.ssh > CPEf81d0fa9f3e3-CMf81d0fa9f3e0.cpe.net.cable.rogers.com.51494: Flags [P.], seq 18224:19212, ack 37, win 1452, length 988
20:33:38.297684 IP lamp-s-1vcpu-1gb-tor1-01.ssh > CPEf81d0fa9f3e3-CMf81d0fa9f3e0.cpe.net.cable.rogers.com.51494: Flags [P.], seq 19212:19424, ack 37, win 1452, length 212
20:33:38.297791 IP lamp-s-1vcpu-1gb-tor1-01.ssh > CPEf81d0fa9f3e3-CMf81d0fa9f3e0.cpe.net.cable.rogers.com.51494: Flags [P.], seq 19424:19636, ack 37, win 1452, length 212
20:33:38.297895 IP lamp-s-1vcpu-1gb-tor1-01.ssh > CPEf81d0fa9f3e3-CMf81d0fa9f3e0.cpe.net.cable.rogers.com.51494: Flags [P.], seq 19636:19848, ack 37, win 1452, length 212
20:33:38.297999 IP lamp-s-1vcpu-1gb-tor1-01.ssh > CPEf81d0fa9f3e3-CMf81d0fa9f3e0.cpe.net.cable.rogers.com.51494: Flags [P.], seq 19848:20060, ack 37, win 1452, length 212
20:33:38.298101 IP lamp-s-1vcpu-1gb-tor1-01.ssh > CPEf81d0fa9f3e3-CMf81d0fa9f3e0.cpe.net.cable.rogers.com.51494: Flags [P.], seq 20060:20272, ack 37, win 1452, length 212
20:33:38.298202 IP lamp-s-1vcpu-1gb-tor1-01.ssh > CPEf81d0fa9f3e3-CMf81d0fa9f3e0.cpe.net.cable.rogers.com.51494: Flags [P.], seq 20272:20484, ack 37, win 1452, length 212
20:33:38.298315 IP lamp-s-1vcpu-1gb-tor1-01.ssh > CPEf81d0fa9f3e3-CMf81d0fa9f3e0.cpe.net.cable.rogers.com.51494: Flags [P.], seq 20484:20696, ack 37, win 1452, length 212
20:33:38.298417 IP lamp-s-1vcpu-1gb-tor1-01.ssh > CPEf81d0fa9f3e3-CMf81d0fa9f3e0.cpe.net.cable.rogers.com.51494: Flags [P.], seq 20696:20908, ack 37, win 1452, length 212
20:33:38.298522 IP lamp-s-1vcpu-1gb-tor1-01.ssh > CPEf81d0fa9f3e3-CMf81d0fa9f3e0.cpe.net.cable.rogers.com.51494: Flags [P.], seq 20908:21120, ack 37, win 1452, length 212
20:33:38.298624 IP lamp-s-1vcpu-1gb-tor1-01.ssh > CPEf81d0fa9f3e3-CMf81d0fa9f3e0.cpe.net.cable.rogers.com.51494: Flags [P.], seq 21120:21332, ack 37, win 1452, length 212
20:33:38.298814 IP lamp-s-1vcpu-1gb-tor1-01.ssh > CPEf81d0fa9f3e3-CMf81d0fa9f3e0.cpe.net.cable.rogers.com.51494: Flags [P.], seq 21332:21544, ack 37, win 1452, length 212
20:33:38.298991 IP lamp-s-1vcpu-1gb-tor1-01.ssh > CPEf81d0fa9f3e3-CMf81d0fa9f3e0.cpe.net.cable.rogers.com.51494: Flags [P.], seq 21544:21756, ack 37, win 1452, length 212
20:33:38.299117 IP lamp-s-1vcpu-1gb-tor1-01.ssh > CPEf81d0fa9f3e3-CMf81d0fa9f3e0.cpe.net.cable.rogers.com.51494: Flags [P.], seq 21756:21968, ack 37, win 1452, length 212
20:33:38.299271 IP lamp-s-1vcpu-1gb-tor1-01.ssh > CPEf81d0fa9f3e3-CMf81d0fa9f3e0.cpe.net.cable.rogers.com.51494: Flags [P.], seq 21968:22180, ack 37, win 1452, length 212
20:33:38.299399 IP lamp-s-1vcpu-1gb-tor1-01.ssh > CPEf81d0fa9f3e3-CMf81d0fa9f3e0.cpe.net.cable.rogers.com.51494: Flags [P.], seq 22180:22392, ack 37, win 1452, length 212
20:33:38.299505 IP lamp-s-1vcpu-1gb-tor1-01.ssh > CPEf81d0fa9f3e3-CMf81d0fa9f3e0.cpe.net.cable.rogers.com.51494: Flags [P.], seq 22392:22604, ack 37, win 1452, length 212
20:33:38.299609 IP lamp-s-1vcpu-1gb-tor1-01.ssh > CPEf81d0fa9f3e3-CMf81d0fa9f3e0.cpe.net.cable.rogers.com.51494: Flags [P.], seq 22604:22816, ack 37, win 1452, length 212
20:33:38.299786 IP lamp-s-1vcpu-1gb-tor1-01.ssh > CPEf81d0fa9f3e3-CMf81d0fa9f3e0.cpe.net.cable.rogers.com.51494: Flags [P.], seq 22816:23028, ack 37, win 1452, length 212
20:33:38.299905 IP lamp-s-1vcpu-1gb-tor1-01.ssh > CPEf81d0fa9f3e3-CMf81d0fa9f3e0.cpe.net.cable.rogers.com.51494: Flags [P.], seq 23028:23240, ack 37, win 1452, length 212
20:33:38.300009 IP lamp-s-1vcpu-1gb-tor1-01.ssh > CPEf81d0fa9f3e3-CMf81d0fa9f3e0.cpe.net.cable.rogers.com.51494: Flags [P.], seq 23240:23452, ack 37, win 1452, length 212
20:33:38.300112 IP lamp-s-1vcpu-1gb-tor1-01.ssh > CPEf81d0fa9f3e3-CMf81d0fa9f3e0.cpe.net.cable.rogers.com.51494: Flags [P.], seq 23452:23664, ack 37, win 1452, length 212
20:33:38.300251 IP lamp-s-1vcpu-1gb-tor1-01.ssh > CPEf81d0fa9f3e3-CMf81d0fa9f3e0.cpe.net.cable.rogers.com.51494: Flags [P.], seq 23664:23876, ack 37, win 1452, length 212
20:33:38.300384 IP lamp-s-1vcpu-1gb-tor1-01.ssh > CPEf81d0fa9f3e3-CMf81d0fa9f3e0.cpe.net.cable.rogers.com.51494: Flags [P.], seq 23876:24088, ack 37, win 1452, length 212
20:33:38.300491 IP lamp-s-1vcpu-1gb-tor1-01.ssh > CPEf81d0fa9f3e3-CMf81d0fa9f3e0.cpe.net.cable.rogers.com.51494: Flags [P.], seq 24088:24300, ack 37, win 1452, length 212
20:33:38.300641 IP lamp-s-1vcpu-1gb-tor1-01.ssh > CPEf81d0fa9f3e3-CMf81d0fa9f3e0.cpe.net.cable.rogers.com.51494: Flags [P.], seq 24300:24512, ack 37, win 1452, length 212
20:33:38.300749 IP lamp-s-1vcpu-1gb-tor1-01.ssh > CPEf81d0fa9f3e3-CMf81d0fa9f3e0.cpe.net.cable.rogers.com.51494: Flags [P.], seq 24512:24724, ack 37, win 1452, length 212
20:33:38.300853 IP lamp-s-1vcpu-1gb-tor1-01.ssh > CPEf81d0fa9f3e3-CMf81d0fa9f3e0.cpe.net.cable.rogers.com.51494: Flags [P.], seq 24724:24936, ack 37, win 1452, length 212
20:33:38.300955 IP lamp-s-1vcpu-1gb-tor1-01.ssh > CPEf81d0fa9f3e3-CMf81d0fa9f3e0.cpe.net.cable.rogers.com.51494: Flags [P.], seq 24936:25148, ack 37, win 1452, length 212
20:33:38.301091 IP lamp-s-1vcpu-1gb-tor1-01.ssh > CPEf81d0fa9f3e3-CMf81d0fa9f3e0.cpe.net.cable.rogers.com.51494: Flags [P.], seq 25148:25360, ack 37, win 1452, length 212
20:33:38.301201 IP lamp-s-1vcpu-1gb-tor1-01.ssh > CPEf81d0fa9f3e3-CMf81d0fa9f3e0.cpe.net.cable.rogers.com.51494: Flags [P.], seq 25360:25572, ack 37, win 1452, length 212
20:33:38.301329 IP lamp-s-1vcpu-1gb-tor1-01.ssh > CPEf81d0fa9f3e3-CMf81d0fa9f3e0.cpe.net.cable.rogers.com.51494: Flags [P.], seq 25572:25784, ack 37, win 1452, length 212
20:33:38.301459 IP lamp-s-1vcpu-1gb-tor1-01.ssh > CPEf81d0fa9f3e3-CMf81d0fa9f3e0.cpe.net.cable.rogers.com.51494: Flags [P.], seq 25784:25996, ack 37, win 1452, length 212
20:33:38.301566 IP lamp-s-1vcpu-1gb-tor1-01.ssh > CPEf81d0fa9f3e3-CMf81d0fa9f3e0.cpe.net.cable.rogers.com.51494: Flags [P.], seq 25996:26208, ack 37, win 1452, length 212
20:33:38.301714 IP lamp-s-1vcpu-1gb-tor1-01.ssh > CPEf81d0fa9f3e3-CMf81d0fa9f3e0.cpe.net.cable.rogers.com.51494: Flags [P.], seq 26208:26420, ack 37, win 1452, length 212
20:33:38.301888 IP lamp-s-1vcpu-1gb-tor1-01.ssh > CPEf81d0fa9f3e3-CMf81d0fa9f3e0.cpe.net.cable.rogers.com.51494: Flags [P.], seq 26420:26632, ack 37, win 1452, length 212
20:33:38.302091 IP lamp-s-1vcpu-1gb-tor1-01.ssh > CPEf81d0fa9f3e3-CMf81d0fa9f3e0.cpe.net.cable.rogers.com.51494: Flags [P.], seq 26632:26844, ack 37, win 1452, length 212
20:33:38.302289 IP lamp-s-1vcpu-1gb-tor1-01.ssh > CPEf81d0fa9f3e3-CMf81d0fa9f3e0.cpe.net.cable.rogers.com.51494: Flags [P.], seq 26844:27056, ack 37, win 1452, length 212
20:33:38.302416 IP lamp-s-1vcpu-1gb-tor1-01.ssh > CPEf81d0fa9f3e3-CMf81d0fa9f3e0.cpe.net.cable.rogers.com.51494: Flags [P.], seq 27056:27268, ack 37, win 1452, length 212
20:33:38.302553 IP lamp-s-1vcpu-1gb-tor1-01.ssh > CPEf81d0fa9f3e3-CMf81d0fa9f3e0.cpe.net.cable.rogers.com.51494: Flags [P.], seq 27268:27480, ack 37, win 1452, length 212
20:33:38.302706 IP lamp-s-1vcpu-1gb-tor1-01.ssh > CPEf81d0fa9f3e3-CMf81d0fa9f3e0.cpe.net.cable.rogers.com.51494: Flags [P.], seq 27480:27692, ack 37, win 1452, length 212
20:33:38.302819 IP lamp-s-1vcpu-1gb-tor1-01.ssh > CPEf81d0fa9f3e3-CMf81d0fa9f3e0.cpe.net.cable.rogers.com.51494: Flags [P.], seq 27692:27904, ack 37, win 1452, length 212
20:33:38.302925 IP lamp-s-1vcpu-1gb-tor1-01.ssh > CPEf81d0fa9f3e3-CMf81d0fa9f3e0.cpe.net.cable.rogers.com.51494: Flags [P.], seq 27904:28116, ack 37, win 1452, length 212
20:33:38.303042 IP lamp-s-1vcpu-1gb-tor1-01.ssh > CPEf81d0fa9f3e3-CMf81d0fa9f3e0.cpe.net.cable.rogers.com.51494: Flags [P.], seq 28116:28328, ack 37, win 1452, length 212
20:33:38.303197 IP lamp-s-1vcpu-1gb-tor1-01.ssh > CPEf81d0fa9f3e3-CMf81d0fa9f3e0.cpe.net.cable.rogers.com.51494: Flags [P.], seq 28328:28540, ack 37, win 1452, length 212
20:33:38.303315 IP lamp-s-1vcpu-1gb-tor1-01.ssh > CPEf81d0fa9f3e3-CMf81d0fa9f3e0.cpe.net.cable.rogers.com.51494: Flags [P.], seq 28540:28752, ack 37, win 1452, length 212
20:33:38.303419 IP lamp-s-1vcpu-1gb-tor1-01.ssh > CPEf81d0fa9f3e3-CMf81d0fa9f3e0.cpe.net.cable.rogers.com.51494: Flags [P.], seq 28752:28964, ack 37, win 1452, length 212
20:33:38.303572 IP lamp-s-1vcpu-1gb-tor1-01.ssh > CPEf81d0fa9f3e3-CMf81d0fa9f3e0.cpe.net.cable.rogers.com.51494: Flags [P.], seq 28964:29176, ack 37, win 1452, length 212
20:33:38.303755 IP lamp-s-1vcpu-1gb-tor1-01.ssh > CPEf81d0fa9f3e3-CMf81d0fa9f3e0.cpe.net.cable.rogers.com.51494: Flags [P.], seq 29176:29388, ack 37, win 1452, length 212
20:33:38.303896 IP lamp-s-1vcpu-1gb-tor1-01.ssh > CPEf81d0fa9f3e3-CMf81d0fa9f3e0.cpe.net.cable.rogers.com.51494: Flags [P.], seq 29388:29600, ack 37, win 1452, length 212
20:33:38.304038 IP lamp-s-1vcpu-1gb-tor1-01.ssh > CPEf81d0fa9f3e3-CMf81d0fa9f3e0.cpe.net.cable.rogers.com.51494: Flags [P.], seq 29600:29812, ack 37, win 1452, length 212
20:33:38.304208 IP lamp-s-1vcpu-1gb-tor1-01.ssh > CPEf81d0fa9f3e3-CMf81d0fa9f3e0.cpe.net.cable.rogers.com.51494: Flags [P.], seq 29812:30024, ack 37, win 1452, length 212
20:33:38.304365 IP lamp-s-1vcpu-1gb-tor1-01.ssh > CPEf81d0fa9f3e3-CMf81d0fa9f3e0.cpe.net.cable.rogers.com.51494: Flags [P.], seq 30024:30236, ack 37, win 1452, length 212
20:33:38.304503 IP lamp-s-1vcpu-1gb-tor1-01.ssh > CPEf81d0fa9f3e3-CMf81d0fa9f3e0.cpe.net.cable.rogers.com.51494: Flags [P.], seq 30236:30448, ack 37, win 1452, length 212
20:33:38.304709 IP lamp-s-1vcpu-1gb-tor1-01.ssh > CPEf81d0fa9f3e3-CMf81d0fa9f3e0.cpe.net.cable.rogers.com.51494: Flags [P.], seq 30448:30660, ack 37, win 1452, length 212
20:33:38.304856 IP lamp-s-1vcpu-1gb-tor1-01.ssh > CPEf81d0fa9f3e3-CMf81d0fa9f3e0.cpe.net.cable.rogers.com.51494: Flags [P.], seq 30660:30872, ack 37, win 1452, length 212
20:33:38.304996 IP lamp-s-1vcpu-1gb-tor1-01.ssh > CPEf81d0fa9f3e3-CMf81d0fa9f3e0.cpe.net.cable.rogers.com.51494: Flags [P.], seq 30872:31084, ack 37, win 1452, length 212
20:33:38.305190 IP lamp-s-1vcpu-1gb-tor1-01.ssh > CPEf81d0fa9f3e3-CMf81d0fa9f3e0.cpe.net.cable.rogers.com.51494: Flags [P.], seq 31084:31296, ack 37, win 1452, length 212
20:33:38.305334 IP lamp-s-1vcpu-1gb-tor1-01.ssh > CPEf81d0fa9f3e3-CMf81d0fa9f3e0.cpe.net.cable.rogers.com.51494: Flags [P.], seq 31296:31508, ack 37, win 1452, length 212
20:33:38.305471 IP lamp-s-1vcpu-1gb-tor1-01.ssh > CPEf81d0fa9f3e3-CMf81d0fa9f3e0.cpe.net.cable.rogers.com.51494: Flags [P.], seq 31508:31720, ack 37, win 1452, length 212
20:33:38.305606 IP lamp-s-1vcpu-1gb-tor1-01.ssh > CPEf81d0fa9f3e3-CMf81d0fa9f3e0.cpe.net.cable.rogers.com.51494: Flags [P.], seq 31720:31932, ack 37, win 1452, length 212
20:33:38.305742 IP lamp-s-1vcpu-1gb-tor1-01.ssh > CPEf81d0fa9f3e3-CMf81d0fa9f3e0.cpe.net.cable.rogers.com.51494: Flags [P.], seq 31932:32144, ack 37, win 1452, length 212
20:33:38.305879 IP lamp-s-1vcpu-1gb-tor1-01.ssh > CPEf81d0fa9f3e3-CMf81d0fa9f3e0.cpe.net.cable.rogers.com.51494: Flags [P.], seq 32144:32356, ack 37, win 1452, length 212
20:33:38.306016 IP lamp-s-1vcpu-1gb-tor1-01.ssh > CPEf81d0fa9f3e3-CMf81d0fa9f3e0.cpe.net.cable.rogers.com.51494: Flags [P.], seq 32356:32568, ack 37, win 1452, length 212
20:33:38.306158 IP lamp-s-1vcpu-1gb-tor1-01.ssh > CPEf81d0fa9f3e3-CMf81d0fa9f3e0.cpe.net.cable.rogers.com.51494: Flags [P.], seq 32568:32780, ack 37, win 1452, length 212
20:33:38.306296 IP lamp-s-1vcpu-1gb-tor1-01.ssh > CPEf81d0fa9f3e3-CMf81d0fa9f3e0.cpe.net.cable.rogers.com.51494: Flags [P.], seq 32780:32992, ack 37, win 1452, length 212
20:33:38.306432 IP lamp-s-1vcpu-1gb-tor1-01.ssh > CPEf81d0fa9f3e3-CMf81d0fa9f3e0.cpe.net.cable.rogers.com.51494: Flags [P.], seq 32992:33204, ack 37, win 1452, length 212
20:33:38.306568 IP lamp-s-1vcpu-1gb-tor1-01.ssh > CPEf81d0fa9f3e3-CMf81d0fa9f3e0.cpe.net.cable.rogers.com.51494: Flags [P.], seq 33204:33416, ack 37, win 1452, length 212
20:33:38.306702 IP lamp-s-1vcpu-1gb-tor1-01.ssh > CPEf81d0fa9f3e3-CMf81d0fa9f3e0.cpe.net.cable.rogers.com.51494: Flags [P.], seq 33416:33628, ack 37, win 1452, length 212
20:33:38.306844 IP lamp-s-1vcpu-1gb-tor1-01.ssh > CPEf81d0fa9f3e3-CMf81d0fa9f3e0.cpe.net.cable.rogers.com.51494: Flags [P.], seq 33628:33840, ack 37, win 1452, length 212
20:33:38.306982 IP lamp-s-1vcpu-1gb-tor1-01.ssh > CPEf81d0fa9f3e3-CMf81d0fa9f3e0.cpe.net.cable.rogers.com.51494: Flags [P.], seq 33840:34052, ack 37, win 1452, length 212
20:33:38.309818 IP CPEf81d0fa9f3e3-CMf81d0fa9f3e0.cpe.net.cable.rogers.com.51494 > lamp-s-1vcpu-1gb-tor1-01.ssh: Flags [.], ack 18012, win 4117, length 0
20:33:38.309876 IP lamp-s-1vcpu-1gb-tor1-01.ssh > CPEf81d0fa9f3e3-CMf81d0fa9f3e0.cpe.net.cable.rogers.com.51494: Flags [P.], seq 34052:34264, ack 37, win 1452, length 212
20:33:38.310128 IP lamp-s-1vcpu-1gb-tor1-01.ssh > CPEf81d0fa9f3e3-CMf81d0fa9f3e0.cpe.net.cable.rogers.com.51494: Flags [P.], seq 34264:34628, ack 37, win 1452, length 364
20:33:38.310301 IP lamp-s-1vcpu-1gb-tor1-01.ssh > CPEf81d0fa9f3e3-CMf81d0fa9f3e0.cpe.net.cable.rogers.com.51494: Flags [P.], seq 34628:34840, ack 37, win 1452, length 212
20:33:38.310463 IP lamp-s-1vcpu-1gb-tor1-01.ssh > CPEf81d0fa9f3e3-CMf81d0fa9f3e0.cpe.net.cable.rogers.com.51494: Flags [P.], seq 34840:35052, ack 37, win 1452, length 212
20:33:38.310625 IP lamp-s-1vcpu-1gb-tor1-01.ssh > CPEf81d0fa9f3e3-CMf81d0fa9f3e0.cpe.net.cable.rogers.com.51494: Flags [P.], seq 35052:35264, ack 37, win 1452, length 212
20:33:38.310789 IP lamp-s-1vcpu-1gb-tor1-01.ssh > CPEf81d0fa9f3e3-CMf81d0fa9f3e0.cpe.net.cable.rogers.com.51494: Flags [P.], seq 35264:35476, ack 37, win 1452, length 212
20:33:38.310950 IP lamp-s-1vcpu-1gb-tor1-01.ssh > CPEf81d0fa9f3e3-CMf81d0fa9f3e0.cpe.net.cable.rogers.com.51494: Flags [P.], seq 35476:35688, ack 37, win 1452, length 212
20:33:38.311118 IP lamp-s-1vcpu-1gb-tor1-01.ssh > CPEf81d0fa9f3e3-CMf81d0fa9f3e0.cpe.net.cable.rogers.com.51494: Flags [P.], seq 35688:35900, ack 37, win 1452, length 212
20:33:38.311277 IP lamp-s-1vcpu-1gb-tor1-01.ssh > CPEf81d0fa9f3e3-CMf81d0fa9f3e0.cpe.net.cable.rogers.com.51494: Flags [P.], seq 35900:36112, ack 37, win 1452, length 212
20:33:38.311439 IP lamp-s-1vcpu-1gb-tor1-01.ssh > CPEf81d0fa9f3e3-CMf81d0fa9f3e0.cpe.net.cable.rogers.com.51494: Flags [P.], seq 36112:36324, ack 37, win 1452, length 212
20:33:38.311602 IP lamp-s-1vcpu-1gb-tor1-01.ssh > CPEf81d0fa9f3e3-CMf81d0fa9f3e0.cpe.net.cable.rogers.com.51494: Flags [P.], seq 36324:36536, ack 37, win 1452, length 212
20:33:38.311765 IP lamp-s-1vcpu-1gb-tor1-01.ssh > CPEf81d0fa9f3e3-CMf81d0fa9f3e0.cpe.net.cable.rogers.com.51494: Flags [P.], seq 36536:36748, ack 37, win 1452, length 212
20:33:38.311925 IP lamp-s-1vcpu-1gb-tor1-01.ssh > CPEf81d0fa9f3e3-CMf81d0fa9f3e0.cpe.net.cable.rogers.com.51494: Flags [P.], seq 36748:36960, ack 37, win 1452, length 212
20:33:38.312086 IP lamp-s-1vcpu-1gb-tor1-01.ssh > CPEf81d0fa9f3e3-CMf81d0fa9f3e0.cpe.net.cable.rogers.com.51494: Flags [P.], seq 36960:37172, ack 37, win 1452, length 212
20:33:38.312248 IP lamp-s-1vcpu-1gb-tor1-01.ssh > CPEf81d0fa9f3e3-CMf81d0fa9f3e0.cpe.net.cable.rogers.com.51494: Flags [P.], seq 37172:37384, ack 37, win 1452, length 212
20:33:38.312410 IP lamp-s-1vcpu-1gb-tor1-01.ssh > CPEf81d0fa9f3e3-CMf81d0fa9f3e0.cpe.net.cable.rogers.com.51494: Flags [P.], seq 37384:37596, ack 37, win 1452, length 212
20:33:38.312611 IP lamp-s-1vcpu-1gb-tor1-01.ssh > CPEf81d0fa9f3e3-CMf81d0fa9f3e0.cpe.net.cable.rogers.com.51494: Flags [P.], seq 37596:37808, ack 37, win 1452, length 212
20:33:38.312774 IP lamp-s-1vcpu-1gb-tor1-01.ssh > CPEf81d0fa9f3e3-CMf81d0fa9f3e0.cpe.net.cable.rogers.com.51494: Flags [P.], seq 37808:38020, ack 37, win 1452, length 212
20:33:38.312936 IP lamp-s-1vcpu-1gb-tor1-01.ssh > CPEf81d0fa9f3e3-CMf81d0fa9f3e0.cpe.net.cable.rogers.com.51494: Flags [P.], seq 38020:38232, ack 37, win 1452, length 212
20:33:38.313138 IP lamp-s-1vcpu-1gb-tor1-01.ssh > CPEf81d0fa9f3e3-CMf81d0fa9f3e0.cpe.net.cable.rogers.com.51494: Flags [P.], seq 38232:38444, ack 37, win 1452, length 212
20:33:38.313260 IP lamp-s-1vcpu-1gb-tor1-01.ssh > CPEf81d0fa9f3e3-CMf81d0fa9f3e0.cpe.net.cable.rogers.com.51494: Flags [P.], seq 38444:38656, ack 37, win 1452, length 212
20:33:38.313366 IP lamp-s-1vcpu-1gb-tor1-01.ssh > CPEf81d0fa9f3e3-CMf81d0fa9f3e0.cpe.net.cable.rogers.com.51494: Flags [P.], seq 38656:38868, ack 37, win 1452, length 212
20:33:38.317705 IP CPEf81d0fa9f3e3-CMf81d0fa9f3e0.cpe.net.cable.rogers.com.51494 > lamp-s-1vcpu-1gb-tor1-01.ssh: Flags [.], ack 21120, win 4117, length 0
20:33:38.317750 IP lamp-s-1vcpu-1gb-tor1-01.ssh > CPEf81d0fa9f3e3-CMf81d0fa9f3e0.cpe.net.cable.rogers.com.51494: Flags [P.], seq 38868:39080, ack 37, win 1452, length 212
20:33:38.317776 IP CPEf81d0fa9f3e3-CMf81d0fa9f3e0.cpe.net.cable.rogers.com.51494 > lamp-s-1vcpu-1gb-tor1-01.ssh: Flags [.], ack 21756, win 4115, length 0
20:33:38.317788 IP CPEf81d0fa9f3e3-CMf81d0fa9f3e0.cpe.net.cable.rogers.com.51494 > lamp-s-1vcpu-1gb-tor1-01.ssh: Flags [.], ack 22816, win 4117, length 0
20:33:38.317796 IP CPEf81d0fa9f3e3-CMf81d0fa9f3e0.cpe.net.cable.rogers.com.51494 > lamp-s-1vcpu-1gb-tor1-01.ssh: Flags [.], ack 24936, win 4117, length 0
20:33:38.317808 IP CPEf81d0fa9f3e3-CMf81d0fa9f3e0.cpe.net.cable.rogers.com.51494 > lamp-s-1vcpu-1gb-tor1-01.ssh: Flags [.], ack 26844, win 4117, length 0
20:33:38.318066 IP lamp-s-1vcpu-1gb-tor1-01.ssh > CPEf81d0fa9f3e3-CMf81d0fa9f3e0.cpe.net.cable.rogers.com.51494: Flags [P.], seq 39080:40068, ack 37, win 1452, length 988
20:33:38.318219 IP lamp-s-1vcpu-1gb-tor1-01.ssh > CPEf81d0fa9f3e3-CMf81d0fa9f3e0.cpe.net.cable.rogers.com.51494: Flags [P.], seq 40068:40280, ack 37, win 1452, length 212
20:33:38.318371 IP lamp-s-1vcpu-1gb-tor1-01.ssh > CPEf81d0fa9f3e3-CMf81d0fa9f3e0.cpe.net.cable.rogers.com.51494: Flags [P.], seq 40280:40492, ack 37, win 1452, length 212
20:33:38.318483 IP lamp-s-1vcpu-1gb-tor1-01.ssh > CPEf81d0fa9f3e3-CMf81d0fa9f3e0.cpe.net.cable.rogers.com.51494: Flags [P.], seq 40492:40704, ack 37, win 1452, length 212
20:33:38.318586 IP lamp-s-1vcpu-1gb-tor1-01.ssh > CPEf81d0fa9f3e3-CMf81d0fa9f3e0.cpe.net.cable.rogers.com.51494: Flags [P.], seq 40704:40916, ack 37, win 1452, length 212
20:33:38.318689 IP lamp-s-1vcpu-1gb-tor1-01.ssh > CPEf81d0fa9f3e3-CMf81d0fa9f3e0.cpe.net.cable.rogers.com.51494: Flags [P.], seq 40916:41128, ack 37, win 1452, length 212
20:33:38.318791 IP lamp-s-1vcpu-1gb-tor1-01.ssh > CPEf81d0fa9f3e3-CMf81d0fa9f3e0.cpe.net.cable.rogers.com.51494: Flags [P.], seq 41128:41340, ack 37, win 1452, length 212
20:33:38.318892 IP lamp-s-1vcpu-1gb-tor1-01.ssh > CPEf81d0fa9f3e3-CMf81d0fa9f3e0.cpe.net.cable.rogers.com.51494: Flags [P.], seq 41340:41552, ack 37, win 1452, length 212
20:33:38.318994 IP lamp-s-1vcpu-1gb-tor1-01.ssh > CPEf81d0fa9f3e3-CMf81d0fa9f3e0.cpe.net.cable.rogers.com.51494: Flags [P.], seq 41552:41764, ack 37, win 1452, length 212
20:33:38.319096 IP lamp-s-1vcpu-1gb-tor1-01.ssh > CPEf81d0fa9f3e3-CMf81d0fa9f3e0.cpe.net.cable.rogers.com.51494: Flags [P.], seq 41764:41976, ack 37, win 1452, length 212
20:33:38.319198 IP lamp-s-1vcpu-1gb-tor1-01.ssh > CPEf81d0fa9f3e3-CMf81d0fa9f3e0.cpe.net.cable.rogers.com.51494: Flags [P.], seq 41976:42188, ack 37, win 1452, length 212
20:33:38.319298 IP lamp-s-1vcpu-1gb-tor1-01.ssh > CPEf81d0fa9f3e3-CMf81d0fa9f3e0.cpe.net.cable.rogers.com.51494: Flags [P.], seq 42188:42400, ack 37, win 1452, length 212
20:33:38.319409 IP lamp-s-1vcpu-1gb-tor1-01.ssh > CPEf81d0fa9f3e3-CMf81d0fa9f3e0.cpe.net.cable.rogers.com.51494: Flags [P.], seq 42400:42612, ack 37, win 1452, length 212
20:33:38.319512 IP lamp-s-1vcpu-1gb-tor1-01.ssh > CPEf81d0fa9f3e3-CMf81d0fa9f3e0.cpe.net.cable.rogers.com.51494: Flags [P.], seq 42612:42824, ack 37, win 1452, length 212
20:33:38.319617 IP lamp-s-1vcpu-1gb-tor1-01.ssh > CPEf81d0fa9f3e3-CMf81d0fa9f3e0.cpe.net.cable.rogers.com.51494: Flags [P.], seq 42824:43036, ack 37, win 1452, length 212
20:33:38.319720 IP lamp-s-1vcpu-1gb-tor1-01.ssh > CPEf81d0fa9f3e3-CMf81d0fa9f3e0.cpe.net.cable.rogers.com.51494: Flags [P.], seq 43036:43248, ack 37, win 1452, length 212
20:33:38.319823 IP lamp-s-1vcpu-1gb-tor1-01.ssh > CPEf81d0fa9f3e3-CMf81d0fa9f3e0.cpe.net.cable.rogers.com.51494: Flags [P.], seq 43248:43460, ack 37, win 1452, length 212
20:33:38.319936 IP lamp-s-1vcpu-1gb-tor1-01.ssh > CPEf81d0fa9f3e3-CMf81d0fa9f3e0.cpe.net.cable.rogers.com.51494: Flags [P.], seq 43460:43672, ack 37, win 1452, length 212
20:33:38.320043 IP lamp-s-1vcpu-1gb-tor1-01.ssh > CPEf81d0fa9f3e3-CMf81d0fa9f3e0.cpe.net.cable.rogers.com.51494: Flags [P.], seq 43672:43884, ack 37, win 1452, length 212
20:33:38.320148 IP lamp-s-1vcpu-1gb-tor1-01.ssh > CPEf81d0fa9f3e3-CMf81d0fa9f3e0.cpe.net.cable.rogers.com.51494: Flags [P.], seq 43884:44096, ack 37, win 1452, length 212
20:33:38.320249 IP lamp-s-1vcpu-1gb-tor1-01.ssh > CPEf81d0fa9f3e3-CMf81d0fa9f3e0.cpe.net.cable.rogers.com.51494: Flags [P.], seq 44096:44308, ack 37, win 1452, length 212
20:33:38.320349 IP lamp-s-1vcpu-1gb-tor1-01.ssh > CPEf81d0fa9f3e3-CMf81d0fa9f3e0.cpe.net.cable.rogers.com.51494: Flags [P.], seq 44308:44520, ack 37, win 1452, length 212
20:33:38.320453 IP lamp-s-1vcpu-1gb-tor1-01.ssh > CPEf81d0fa9f3e3-CMf81d0fa9f3e0.cpe.net.cable.rogers.com.51494: Flags [P.], seq 44520:44732, ack 37, win 1452, length 212
20:33:38.320694 IP lamp-s-1vcpu-1gb-tor1-01.ssh > CPEf81d0fa9f3e3-CMf81d0fa9f3e0.cpe.net.cable.rogers.com.51494: Flags [P.], seq 44732:44944, ack 37, win 1452, length 212
20:33:38.320833 IP lamp-s-1vcpu-1gb-tor1-01.ssh > CPEf81d0fa9f3e3-CMf81d0fa9f3e0.cpe.net.cable.rogers.com.51494: Flags [P.], seq 44944:45156, ack 37, win 1452, length 212
20:33:38.320943 IP lamp-s-1vcpu-1gb-tor1-01.ssh > CPEf81d0fa9f3e3-CMf81d0fa9f3e0.cpe.net.cable.rogers.com.51494: Flags [P.], seq 45156:45368, ack 37, win 1452, length 212
20:33:38.321082 IP lamp-s-1vcpu-1gb-tor1-01.ssh > CPEf81d0fa9f3e3-CMf81d0fa9f3e0.cpe.net.cable.rogers.com.51494: Flags [P.], seq 45368:45580, ack 37, win 1452, length 212
20:33:38.321196 IP lamp-s-1vcpu-1gb-tor1-01.ssh > CPEf81d0fa9f3e3-CMf81d0fa9f3e0.cpe.net.cable.rogers.com.51494: Flags [P.], seq 45580:45792, ack 37, win 1452, length 212
20:33:38.321301 IP lamp-s-1vcpu-1gb-tor1-01.ssh > CPEf81d0fa9f3e3-CMf81d0fa9f3e0.cpe.net.cable.rogers.com.51494: Flags [P.], seq 45792:46004, ack 37, win 1452, length 212
20:33:38.321405 IP lamp-s-1vcpu-1gb-tor1-01.ssh > CPEf81d0fa9f3e3-CMf81d0fa9f3e0.cpe.net.cable.rogers.com.51494: Flags [P.], seq 46004:46216, ack 37, win 1452, length 212
20:33:38.321516 IP lamp-s-1vcpu-1gb-tor1-01.ssh > CPEf81d0fa9f3e3-CMf81d0fa9f3e0.cpe.net.cable.rogers.com.51494: Flags [P.], seq 46216:46428, ack 37, win 1452, length 212
20:33:38.321662 IP lamp-s-1vcpu-1gb-tor1-01.ssh > CPEf81d0fa9f3e3-CMf81d0fa9f3e0.cpe.net.cable.rogers.com.51494: Flags [P.], seq 46428:46640, ack 37, win 1452, length 212
20:33:38.321773 IP lamp-s-1vcpu-1gb-tor1-01.ssh > CPEf81d0fa9f3e3-CMf81d0fa9f3e0.cpe.net.cable.rogers.com.51494: Flags [P.], seq 46640:46852, ack 37, win 1452, length 212
20:33:38.321877 IP lamp-s-1vcpu-1gb-tor1-01.ssh > CPEf81d0fa9f3e3-CMf81d0fa9f3e0.cpe.net.cable.rogers.com.51494: Flags [P.], seq 46852:47064, ack 37, win 1452, length 212
20:33:38.321985 IP lamp-s-1vcpu-1gb-tor1-01.ssh > CPEf81d0fa9f3e3-CMf81d0fa9f3e0.cpe.net.cable.rogers.com.51494: Flags [P.], seq 47064:47276, ack 37, win 1452, length 212
20:33:38.322091 IP lamp-s-1vcpu-1gb-tor1-01.ssh > CPEf81d0fa9f3e3-CMf81d0fa9f3e0.cpe.net.cable.rogers.com.51494: Flags [P.], seq 47276:47488, ack 37, win 1452, length 212
20:33:38.322226 IP lamp-s-1vcpu-1gb-tor1-01.ssh > CPEf81d0fa9f3e3-CMf81d0fa9f3e0.cpe.net.cable.rogers.com.51494: Flags [P.], seq 47488:47700, ack 37, win 1452, length 212
20:33:38.322377 IP lamp-s-1vcpu-1gb-tor1-01.ssh > CPEf81d0fa9f3e3-CMf81d0fa9f3e0.cpe.net.cable.rogers.com.51494: Flags [P.], seq 47700:47912, ack 37, win 1452, length 212
20:33:38.322487 IP lamp-s-1vcpu-1gb-tor1-01.ssh > CPEf81d0fa9f3e3-CMf81d0fa9f3e0.cpe.net.cable.rogers.com.51494: Flags [P.], seq 47912:48124, ack 37, win 1452, length 212
20:33:38.322593 IP lamp-s-1vcpu-1gb-tor1-01.ssh > CPEf81d0fa9f3e3-CMf81d0fa9f3e0.cpe.net.cable.rogers.com.51494: Flags [P.], seq 48124:48336, ack 37, win 1452, length 212
20:33:38.322696 IP lamp-s-1vcpu-1gb-tor1-01.ssh > CPEf81d0fa9f3e3-CMf81d0fa9f3e0.cpe.net.cable.rogers.com.51494: Flags [P.], seq 48336:48548, ack 37, win 1452, length 212
20:33:38.322799 IP lamp-s-1vcpu-1gb-tor1-01.ssh > CPEf81d0fa9f3e3-CMf81d0fa9f3e0.cpe.net.cable.rogers.com.51494: Flags [P.], seq 48548:48760, ack 37, win 1452, length 212
20:33:38.322906 IP lamp-s-1vcpu-1gb-tor1-01.ssh > CPEf81d0fa9f3e3-CMf81d0fa9f3e0.cpe.net.cable.rogers.com.51494: Flags [P.], seq 48760:48972, ack 37, win 1452, length 212
20:33:38.323040 IP lamp-s-1vcpu-1gb-tor1-01.ssh > CPEf81d0fa9f3e3-CMf81d0fa9f3e0.cpe.net.cable.rogers.com.51494: Flags [P.], seq 48972:49184, ack 37, win 1452, length 212
20:33:38.323148 IP lamp-s-1vcpu-1gb-tor1-01.ssh > CPEf81d0fa9f3e3-CMf81d0fa9f3e0.cpe.net.cable.rogers.com.51494: Flags [P.], seq 49184:49396, ack 37, win 1452, length 212
20:33:38.323257 IP lamp-s-1vcpu-1gb-tor1-01.ssh > CPEf81d0fa9f3e3-CMf81d0fa9f3e0.cpe.net.cable.rogers.com.51494: Flags [P.], seq 49396:49608, ack 37, win 1452, length 212
20:33:38.323362 IP lamp-s-1vcpu-1gb-tor1-01.ssh > CPEf81d0fa9f3e3-CMf81d0fa9f3e0.cpe.net.cable.rogers.com.51494: Flags [P.], seq 49608:49820, ack 37, win 1452, length 212
