root@lamp-s-1vcpu-1gb-tor1-01:~# tcpdump -c 5 -i eth0
tcpdump: verbose output suppressed, use -v or -vv for full protocol decode
listening on eth0, link-type EN10MB (Ethernet), capture size 262144 bytes
20:11:20.011614 IP ip68-11-32-122.no.no.cox.net.53808 > lamp-s-1vcpu-1gb-tor1-01.35765: Flags [S], seq 3321089073, win 64240, options [mss 1460,sackOK,TS val 2185379141 ecr 0,nop,wscale 7], length 0
20:11:20.014335 IP lamp-s-1vcpu-1gb-tor1-01.ssh > CPEf81d0fa9f3e3-CMf81d0fa9f3e0.cpe.net.cable.rogers.com.51494: Flags [P.], seq 3275093812:3275093920, ack 76491155, win 1452, length 108
20:11:20.014421 IP lamp-s-1vcpu-1gb-tor1-01.ssh > CPEf81d0fa9f3e3-CMf81d0fa9f3e0.cpe.net.cable.rogers.com.51494: Flags [P.], seq 108:144, ack 1, win 1452, length 36
20:11:20.014504 IP lamp-s-1vcpu-1gb-tor1-01.ssh > CPEf81d0fa9f3e3-CMf81d0fa9f3e0.cpe.net.cable.rogers.com.51494: Flags [P.], seq 144:252, ack 1, win 1452, length 108
20:11:20.014567 IP lamp-s-1vcpu-1gb-tor1-01.ssh > CPEf81d0fa9f3e3-CMf81d0fa9f3e0.cpe.net.cable.rogers.com.51494: Flags [P.], seq 252:288, ack 1, win 1452, length 36
5 packets captured
19 packets received by filter