root@lamp-s-1vcpu-1gb-tor1-01:~# clear
root@lamp-s-1vcpu-1gb-tor1-01:~# tcpdump -i eth0 dst 99.255.184.182
tcpdump: verbose output suppressed, use -v or -vv for full protocol decode
listening on eth0, link-type EN10MB (Ethernet), capture size 262144 bytes
20:41:22.613897 IP lamp-s-1vcpu-1gb-tor1-01.ssh > CPEf81d0fa9f3e3-CMf81d0fa9f3e0.cpe.net.cable.rogers.com.51494: Flags [P.], seq 3292144324:3292144432, ack 76520771, win 1452, length 108
20:41:22.613995 IP lamp-s-1vcpu-1gb-tor1-01.ssh > CPEf81d0fa9f3e3-CMf81d0fa9f3e0.cpe.net.cable.rogers.com.51494: Flags [P.], seq 108:144, ack 1, win 1452, length 36
20:41:22.614088 IP lamp-s-1vcpu-1gb-tor1-01.ssh > CPEf81d0fa9f3e3-CMf81d0fa9f3e0.cpe.net.cable.rogers.com.51494: Flags [P.], seq 144:252, ack 1, win 1452, length 108
20:41:22.614161 IP lamp-s-1vcpu-1gb-tor1-01.ssh > CPEf81d0fa9f3e3-CMf81d0fa9f3e0.cpe.net.cable.rogers.com.51494: Flags [P.], seq 252:288, ack 1, win 1452, length 36
20:41:22.616018 IP lamp-s-1vcpu-1gb-tor1-01.ssh > CPEf81d0fa9f3e3-CMf81d0fa9f3e0.cpe.net.cable.rogers.com.51494: Flags [P.], seq 288:508, ack 1, win 1452, length 220
20:41:22.616127 IP lamp-s-1vcpu-1gb-tor1-01.ssh > CPEf81d0fa9f3e3-CMf81d0fa9f3e0.cpe.net.cable.rogers.com.51494: Flags [P.], seq 508:544, ack 1, win 1452, length 36
20:41:22.616234 IP lamp-s-1vcpu-1gb-tor1-01.ssh > CPEf81d0fa9f3e3-CMf81d0fa9f3e0.cpe.net.cable.rogers.com.51494: Flags [P.], seq 544:748, ack 1, win 1452, length 204
20:41:22.616309 IP lamp-s-1vcpu-1gb-tor1-01.ssh > CPEf81d0fa9f3e3-CMf81d0fa9f3e0.cpe.net.cable.rogers.com.51494: Flags [P.], seq 748:784, ack 1, win 1452, length 36
20:41:22.616406 IP lamp-s-1vcpu-1gb-tor1-01.ssh > CPEf81d0fa9f3e3-CMf81d0fa9f3e0.cpe.net.cable.rogers.com.51494: Flags [P.], seq 784:988, ack 1, win 1452, length 204
20:41:22.629593 IP lamp-s-1vcpu-1gb-tor1-01.ssh > CPEf81d0fa9f3e3-CMf81d0fa9f3e0.cpe.net.cable.rogers.com.51494: Flags [P.], seq 988:2464, ack 1, win 1452, length 1476
20:41:22.629765 IP lamp-s-1vcpu-1gb-tor1-01.ssh > CPEf81d0fa9f3e3-CMf81d0fa9f3e0.cpe.net.cable.rogers.com.51494: Flags [P.], seq 2464:2668, ack 1, win 1452, length 204
20:41:22.629850 IP lamp-s-1vcpu-1gb-tor1-01.ssh > CPEf81d0fa9f3e3-CMf81d0fa9f3e0.cpe.net.cable.rogers.com.51494: Flags [P.], seq 2668:2704, ack 1, win 1452, length 36
20:41:22.629950 IP lamp-s-1vcpu-1gb-tor1-01.ssh > CPEf81d0fa9f3e3-CMf81d0fa9f3e0.cpe.net.cable.rogers.com.51494: Flags [P.], seq 2704:2908, ack 1, win 1452, length 204
20:41:22.630023 IP lamp-s-1vcpu-1gb-tor1-01.ssh > CPEf81d0fa9f3e3-CMf81d0fa9f3e0.cpe.net.cable.rogers.com.51494: Flags [P.], seq 2908:2944, ack 1, win 1452, length 36
20:41:22.630118 IP lamp-s-1vcpu-1gb-tor1-01.ssh > CPEf81d0fa9f3e3-CMf81d0fa9f3e0.cpe.net.cable.rogers.com.51494: Flags [P.], seq 2944:3148, ack 1, win 1452, length 204
20:41:22.630191 IP lamp-s-1vcpu-1gb-tor1-01.ssh > CPEf81d0fa9f3e3-CMf81d0fa9f3e0.cpe.net.cable.rogers.com.51494: Flags [P.], seq 3148:3184, ack 1, win 1452, length 36
20:41:22.635709 IP lamp-s-1vcpu-1gb-tor1-01.ssh > CPEf81d0fa9f3e3-CMf81d0fa9f3e0.cpe.net.cable.rogers.com.51494: Flags [P.], seq 3184:4144, ack 1, win 1452, length 960
20:41:22.635891 IP lamp-s-1vcpu-1gb-tor1-01.ssh > CPEf81d0fa9f3e3-CMf81d0fa9f3e0.cpe.net.cable.rogers.com.51494: Flags [P.], seq 4144:4348, ack 1, win 1452, length 204
20:41:22.636006 IP lamp-s-1vcpu-1gb-tor1-01.ssh > CPEf81d0fa9f3e3-CMf81d0fa9f3e0.cpe.net.cable.rogers.com.51494: Flags [P.], seq 4348:4384, ack 1, win 1452, length 36
20:41:22.636150 IP lamp-s-1vcpu-1gb-tor1-01.ssh > CPEf81d0fa9f3e3-CMf81d0fa9f3e0.cpe.net.cable.rogers.com.51494: Flags [P.], seq 4384:4588, ack 1, win 1452, length 204
20:41:22.636230 IP lamp-s-1vcpu-1gb-tor1-01.ssh > CPEf81d0fa9f3e3-CMf81d0fa9f3e0.cpe.net.cable.rogers.com.51494: Flags [P.], seq 4588:4624, ack 1, win 1452, length 36
20:41:22.636328 IP lamp-s-1vcpu-1gb-tor1-01.ssh > CPEf81d0fa9f3e3-CMf81d0fa9f3e0.cpe.net.cable.rogers.com.51494: Flags [P.], seq 4624:4828, ack 1, win 1452, length 204
20:41:22.636399 IP lamp-s-1vcpu-1gb-tor1-01.ssh > CPEf81d0fa9f3e3-CMf81d0fa9f3e0.cpe.net.cable.rogers.com.51494: Flags [P.], seq 4828:4864, ack 1, win 1452, length 36
20:41:22.636494 IP lamp-s-1vcpu-1gb-tor1-01.ssh > CPEf81d0fa9f3e3-CMf81d0fa9f3e0.cpe.net.cable.rogers.com.51494: Flags [P.], seq 4864:5068, ack 1, win 1452, length 204
20:41:22.636605 IP lamp-s-1vcpu-1gb-tor1-01.ssh > CPEf81d0fa9f3e3-CMf81d0fa9f3e0.cpe.net.cable.rogers.com.51494: Flags [P.], seq 5068:5104, ack 1, win 1452, length 36
20:41:22.636706 IP lamp-s-1vcpu-1gb-tor1-01.ssh > CPEf81d0fa9f3e3-CMf81d0fa9f3e0.cpe.net.cable.rogers.com.51494: Flags [P.], seq 5104:5308, ack 1, win 1452, length 204
20:41:22.636777 IP lamp-s-1vcpu-1gb-tor1-01.ssh > CPEf81d0fa9f3e3-CMf81d0fa9f3e0.cpe.net.cable.rogers.com.51494: Flags [P.], seq 5308:5344, ack 1, win 1452, length 36
20:41:22.636871 IP lamp-s-1vcpu-1gb-tor1-01.ssh > CPEf81d0fa9f3e3-CMf81d0fa9f3e0.cpe.net.cable.rogers.com.51494: Flags [P.], seq 5344:5548, ack 1, win 1452, length 204
20:41:22.646681 IP lamp-s-1vcpu-1gb-tor1-01.ssh > CPEf81d0fa9f3e3-CMf81d0fa9f3e0.cpe.net.cable.rogers.com.51494: Flags [P.], seq 5548:7024, ack 1, win 1452, length 1476
20:41:22.646874 IP lamp-s-1vcpu-1gb-tor1-01.ssh > CPEf81d0fa9f3e3-CMf81d0fa9f3e0.cpe.net.cable.rogers.com.51494: Flags [P.], seq 7024:7228, ack 1, win 1452, length 204
20:41:22.646961 IP lamp-s-1vcpu-1gb-tor1-01.ssh > CPEf81d0fa9f3e3-CMf81d0fa9f3e0.cpe.net.cable.rogers.com.51494: Flags [P.], seq 7228:7264, ack 1, win 1452, length 36
20:41:22.647063 IP lamp-s-1vcpu-1gb-tor1-01.ssh > CPEf81d0fa9f3e3-CMf81d0fa9f3e0.cpe.net.cable.rogers.com.51494: Flags [P.], seq 7264:7468, ack 1, win 1452, length 204
20:41:22.647170 IP lamp-s-1vcpu-1gb-tor1-01.ssh > CPEf81d0fa9f3e3-CMf81d0fa9f3e0.cpe.net.cable.rogers.com.51494: Flags [P.], seq 7468:7504, ack 1, win 1452, length 36
20:41:22.647320 IP lamp-s-1vcpu-1gb-tor1-01.ssh > CPEf81d0fa9f3e3-CMf81d0fa9f3e0.cpe.net.cable.rogers.com.51494: Flags [P.], seq 7504:7708, ack 1, win 1452, length 204
20:41:22.647399 IP lamp-s-1vcpu-1gb-tor1-01.ssh > CPEf81d0fa9f3e3-CMf81d0fa9f3e0.cpe.net.cable.rogers.com.51494: Flags [P.], seq 7708:7744, ack 1, win 1452, length 36
20:41:22.647501 IP lamp-s-1vcpu-1gb-tor1-01.ssh > CPEf81d0fa9f3e3-CMf81d0fa9f3e0.cpe.net.cable.rogers.com.51494: Flags [P.], seq 7744:7948, ack 1, win 1452, length 204
20:41:22.647575 IP lamp-s-1vcpu-1gb-tor1-01.ssh > CPEf81d0fa9f3e3-CMf81d0fa9f3e0.cpe.net.cable.rogers.com.51494: Flags [P.], seq 7948:7984, ack 1, win 1452, length 36
20:41:22.647669 IP lamp-s-1vcpu-1gb-tor1-01.ssh > CPEf81d0fa9f3e3-CMf81d0fa9f3e0.cpe.net.cable.rogers.com.51494: Flags [P.], seq 7984:8188, ack 1, win 1452, length 204
20:41:22.647739 IP lamp-s-1vcpu-1gb-tor1-01.ssh > CPEf81d0fa9f3e3-CMf81d0fa9f3e0.cpe.net.cable.rogers.com.51494: Flags [P.], seq 8188:8224, ack 1, win 1452, length 36
20:41:22.647832 IP lamp-s-1vcpu-1gb-tor1-01.ssh > CPEf81d0fa9f3e3-CMf81d0fa9f3e0.cpe.net.cable.rogers.com.51494: Flags [P.], seq 8224:8428, ack 1, win 1452, length 204
20:41:22.654070 IP lamp-s-1vcpu-1gb-tor1-01.ssh > CPEf81d0fa9f3e3-CMf81d0fa9f3e0.cpe.net.cable.rogers.com.51494: Flags [P.], seq 8464:9904, ack 1, win 1452, length 1440
20:41:22.654310 IP lamp-s-1vcpu-1gb-tor1-01.ssh > CPEf81d0fa9f3e3-CMf81d0fa9f3e0.cpe.net.cable.rogers.com.51494: Flags [P.], seq 9904:10108, ack 1, win 1452, length 204
20:41:22.654419 IP lamp-s-1vcpu-1gb-tor1-01.ssh > CPEf81d0fa9f3e3-CMf81d0fa9f3e0.cpe.net.cable.rogers.com.51494: Flags [P.], seq 10108:10144, ack 1, win 1452, length 36
20:41:22.654529 IP lamp-s-1vcpu-1gb-tor1-01.ssh > CPEf81d0fa9f3e3-CMf81d0fa9f3e0.cpe.net.cable.rogers.com.51494: Flags [P.], seq 10144:10348, ack 1, win 1452, length 204
20:41:22.654604 IP lamp-s-1vcpu-1gb-tor1-01.ssh > CPEf81d0fa9f3e3-CMf81d0fa9f3e0.cpe.net.cable.rogers.com.51494: Flags [P.], seq 10348:10384, ack 1, win 1452, length 36
20:41:22.654731 IP lamp-s-1vcpu-1gb-tor1-01.ssh > CPEf81d0fa9f3e3-CMf81d0fa9f3e0.cpe.net.cable.rogers.com.51494: Flags [P.], seq 10384:10764, ack 1, win 1452, length 380
20:41:22.654869 IP lamp-s-1vcpu-1gb-tor1-01.ssh > CPEf81d0fa9f3e3-CMf81d0fa9f3e0.cpe.net.cable.rogers.com.51494: Flags [P.], seq 10764:11144, ack 1, win 1452, length 380
20:41:22.654984 IP lamp-s-1vcpu-1gb-tor1-01.ssh > CPEf81d0fa9f3e3-CMf81d0fa9f3e0.cpe.net.cable.rogers.com.51494: Flags [P.], seq 11144:11356, ack 1, win 1452, length 212
20:41:22.655095 IP lamp-s-1vcpu-1gb-tor1-01.ssh > CPEf81d0fa9f3e3-CMf81d0fa9f3e0.cpe.net.cable.rogers.com.51494: Flags [P.], seq 11356:11568, ack 1, win 1452, length 212
20:41:22.655285 IP lamp-s-1vcpu-1gb-tor1-01.ssh > CPEf81d0fa9f3e3-CMf81d0fa9f3e0.cpe.net.cable.rogers.com.51494: Flags [P.], seq 11568:11780, ack 1, win 1452, length 212
20:41:22.655412 IP lamp-s-1vcpu-1gb-tor1-01.ssh > CPEf81d0fa9f3e3-CMf81d0fa9f3e0.cpe.net.cable.rogers.com.51494: Flags [P.], seq 11780:11992, ack 1, win 1452, length 212
20:41:22.655522 IP lamp-s-1vcpu-1gb-tor1-01.ssh > CPEf81d0fa9f3e3-CMf81d0fa9f3e0.cpe.net.cable.rogers.com.51494: Flags [P.], seq 11992:12204, ack 1, win 1452, length 212
20:41:22.655630 IP lamp-s-1vcpu-1gb-tor1-01.ssh > CPEf81d0fa9f3e3-CMf81d0fa9f3e0.cpe.net.cable.rogers.com.51494: Flags [P.], seq 12204:12416, ack 1, win 1452, length 212
20:41:22.655737 IP lamp-s-1vcpu-1gb-tor1-01.ssh > CPEf81d0fa9f3e3-CMf81d0fa9f3e0.cpe.net.cable.rogers.com.51494: Flags [P.], seq 12416:12628, ack 1, win 1452, length 212
20:41:22.655848 IP lamp-s-1vcpu-1gb-tor1-01.ssh > CPEf81d0fa9f3e3-CMf81d0fa9f3e0.cpe.net.cable.rogers.com.51494: Flags [P.], seq 12628:12840, ack 1, win 1452, length 212
20:41:22.655957 IP lamp-s-1vcpu-1gb-tor1-01.ssh > CPEf81d0fa9f3e3-CMf81d0fa9f3e0.cpe.net.cable.rogers.com.51494: Flags [P.], seq 12840:13052, ack 1, win 1452, length 212
20:41:22.656065 IP lamp-s-1vcpu-1gb-tor1-01.ssh > CPEf81d0fa9f3e3-CMf81d0fa9f3e0.cpe.net.cable.rogers.com.51494: Flags [P.], seq 13052:13264, ack 1, win 1452, length 212
20:41:22.656172 IP lamp-s-1vcpu-1gb-tor1-01.ssh > CPEf81d0fa9f3e3-CMf81d0fa9f3e0.cpe.net.cable.rogers.com.51494: Flags [P.], seq 13264:13476, ack 1, win 1452, length 212
20:41:22.656280 IP lamp-s-1vcpu-1gb-tor1-01.ssh > CPEf81d0fa9f3e3-CMf81d0fa9f3e0.cpe.net.cable.rogers.com.51494: Flags [P.], seq 13476:13688, ack 1, win 1452, length 212
20:41:22.656387 IP lamp-s-1vcpu-1gb-tor1-01.ssh > CPEf81d0fa9f3e3-CMf81d0fa9f3e0.cpe.net.cable.rogers.com.51494: Flags [P.], seq 13688:13900, ack 1, win 1452, length 212
20:41:22.656495 IP lamp-s-1vcpu-1gb-tor1-01.ssh > CPEf81d0fa9f3e3-CMf81d0fa9f3e0.cpe.net.cable.rogers.com.51494: Flags [P.], seq 13900:14112, ack 1, win 1452, length 212
20:41:22.656652 IP lamp-s-1vcpu-1gb-tor1-01.ssh > CPEf81d0fa9f3e3-CMf81d0fa9f3e0.cpe.net.cable.rogers.com.51494: Flags [P.], seq 14112:14324, ack 1, win 1452, length 212
20:41:22.656768 IP lamp-s-1vcpu-1gb-tor1-01.ssh > CPEf81d0fa9f3e3-CMf81d0fa9f3e0.cpe.net.cable.rogers.com.51494: Flags [P.], seq 14324:14536, ack 1, win 1452, length 212
20:41:22.656876 IP lamp-s-1vcpu-1gb-tor1-01.ssh > CPEf81d0fa9f3e3-CMf81d0fa9f3e0.cpe.net.cable.rogers.com.51494: Flags [P.], seq 14536:14748, ack 1, win 1452, length 212
20:41:22.656986 IP lamp-s-1vcpu-1gb-tor1-01.ssh > CPEf81d0fa9f3e3-CMf81d0fa9f3e0.cpe.net.cable.rogers.com.51494: Flags [P.], seq 14748:14960, ack 1, win 1452, length 212
20:41:22.657168 IP lamp-s-1vcpu-1gb-tor1-01.ssh > CPEf81d0fa9f3e3-CMf81d0fa9f3e0.cpe.net.cable.rogers.com.51494: Flags [P.], seq 14960:15172, ack 1, win 1452, length 212
20:41:22.659212 IP lamp-s-1vcpu-1gb-tor1-01.ssh > CPEf81d0fa9f3e3-CMf81d0fa9f3e0.cpe.net.cable.rogers.com.51494: Flags [P.], seq 15172:15384, ack 1, win 1452, length 212
20:41:22.659384 IP lamp-s-1vcpu-1gb-tor1-01.ssh > CPEf81d0fa9f3e3-CMf81d0fa9f3e0.cpe.net.cable.rogers.com.51494: Flags [P.], seq 15384:15596, ack 1, win 1452, length 212
20:41:22.659515 IP lamp-s-1vcpu-1gb-tor1-01.ssh > CPEf81d0fa9f3e3-CMf81d0fa9f3e0.cpe.net.cable.rogers.com.51494: Flags [P.], seq 15596:15808, ack 1, win 1452, length 212
20:41:22.659627 IP lamp-s-1vcpu-1gb-tor1-01.ssh > CPEf81d0fa9f3e3-CMf81d0fa9f3e0.cpe.net.cable.rogers.com.51494: Flags [P.], seq 15808:16020, ack 1, win 1452, length 212
20:41:22.659734 IP lamp-s-1vcpu-1gb-tor1-01.ssh > CPEf81d0fa9f3e3-CMf81d0fa9f3e0.cpe.net.cable.rogers.com.51494: Flags [P.], seq 16020:16232, ack 1, win 1452, length 212
20:41:22.659871 IP lamp-s-1vcpu-1gb-tor1-01.ssh > CPEf81d0fa9f3e3-CMf81d0fa9f3e0.cpe.net.cable.rogers.com.51494: Flags [P.], seq 16232:16444, ack 1, win 1452, length 212
20:41:22.660057 IP lamp-s-1vcpu-1gb-tor1-01.ssh > CPEf81d0fa9f3e3-CMf81d0fa9f3e0.cpe.net.cable.rogers.com.51494: Flags [P.], seq 16444:16656, ack 1, win 1452, length 212
20:41:22.660240 IP lamp-s-1vcpu-1gb-tor1-01.ssh > CPEf81d0fa9f3e3-CMf81d0fa9f3e0.cpe.net.cable.rogers.com.51494: Flags [P.], seq 16656:16868, ack 1, win 1452, length 212
20:41:22.660362 IP lamp-s-1vcpu-1gb-tor1-01.ssh > CPEf81d0fa9f3e3-CMf81d0fa9f3e0.cpe.net.cable.rogers.com.51494: Flags [P.], seq 16868:17080, ack 1, win 1452, length 212
20:41:22.660467 IP lamp-s-1vcpu-1gb-tor1-01.ssh > CPEf81d0fa9f3e3-CMf81d0fa9f3e0.cpe.net.cable.rogers.com.51494: Flags [P.], seq 17080:17292, ack 1, win 1452, length 212
20:41:22.660612 IP lamp-s-1vcpu-1gb-tor1-01.ssh > CPEf81d0fa9f3e3-CMf81d0fa9f3e0.cpe.net.cable.rogers.com.51494: Flags [P.], seq 17292:17504, ack 1, win 1452, length 212
20:41:22.660726 IP lamp-s-1vcpu-1gb-tor1-01.ssh > CPEf81d0fa9f3e3-CMf81d0fa9f3e0.cpe.net.cable.rogers.com.51494: Flags [P.], seq 17504:17716, ack 1, win 1452, length 212
20:41:22.660833 IP lamp-s-1vcpu-1gb-tor1-01.ssh > CPEf81d0fa9f3e3-CMf81d0fa9f3e0.cpe.net.cable.rogers.com.51494: Flags [P.], seq 17716:17928, ack 1, win 1452, length 212
20:41:22.660937 IP lamp-s-1vcpu-1gb-tor1-01.ssh > CPEf81d0fa9f3e3-CMf81d0fa9f3e0.cpe.net.cable.rogers.com.51494: Flags [P.], seq 17928:18140, ack 1, win 1452, length 212
20:41:22.661041 IP lamp-s-1vcpu-1gb-tor1-01.ssh > CPEf81d0fa9f3e3-CMf81d0fa9f3e0.cpe.net.cable.rogers.com.51494: Flags [P.], seq 18140:18352, ack 1, win 1452, length 212
20:41:22.661202 IP lamp-s-1vcpu-1gb-tor1-01.ssh > CPEf81d0fa9f3e3-CMf81d0fa9f3e0.cpe.net.cable.rogers.com.51494: Flags [P.], seq 18352:18564, ack 1, win 1452, length 212
20:41:22.661320 IP lamp-s-1vcpu-1gb-tor1-01.ssh > CPEf81d0fa9f3e3-CMf81d0fa9f3e0.cpe.net.cable.rogers.com.51494: Flags [P.], seq 18564:18776, ack 1, win 1452, length 212
20:41:22.661429 IP lamp-s-1vcpu-1gb-tor1-01.ssh > CPEf81d0fa9f3e3-CMf81d0fa9f3e0.cpe.net.cable.rogers.com.51494: Flags [P.], seq 18776:18988, ack 1, win 1452, length 212
20:41:22.661540 IP lamp-s-1vcpu-1gb-tor1-01.ssh > CPEf81d0fa9f3e3-CMf81d0fa9f3e0.cpe.net.cable.rogers.com.51494: Flags [P.], seq 18988:19200, ack 1, win 1452, length 212
20:41:22.661647 IP lamp-s-1vcpu-1gb-tor1-01.ssh > CPEf81d0fa9f3e3-CMf81d0fa9f3e0.cpe.net.cable.rogers.com.51494: Flags [P.], seq 19200:19412, ack 1, win 1452, length 212
20:41:22.661757 IP lamp-s-1vcpu-1gb-tor1-01.ssh > CPEf81d0fa9f3e3-CMf81d0fa9f3e0.cpe.net.cable.rogers.com.51494: Flags [P.], seq 19412:19624, ack 1, win 1452, length 212
20:41:22.661867 IP lamp-s-1vcpu-1gb-tor1-01.ssh > CPEf81d0fa9f3e3-CMf81d0fa9f3e0.cpe.net.cable.rogers.com.51494: Flags [P.], seq 19624:19836, ack 1, win 1452, length 212
20:41:22.661977 IP lamp-s-1vcpu-1gb-tor1-01.ssh > CPEf81d0fa9f3e3-CMf81d0fa9f3e0.cpe.net.cable.rogers.com.51494: Flags [P.], seq 19836:20048, ack 1, win 1452, length 212
20:41:22.662097 IP lamp-s-1vcpu-1gb-tor1-01.ssh > CPEf81d0fa9f3e3-CMf81d0fa9f3e0.cpe.net.cable.rogers.com.51494: Flags [P.], seq 20048:20260, ack 1, win 1452, length 212
20:41:22.664044 IP lamp-s-1vcpu-1gb-tor1-01.ssh > CPEf81d0fa9f3e3-CMf81d0fa9f3e0.cpe.net.cable.rogers.com.51494: Flags [P.], seq 20260:20472, ack 1, win 1452, length 212
20:41:22.664198 IP lamp-s-1vcpu-1gb-tor1-01.ssh > CPEf81d0fa9f3e3-CMf81d0fa9f3e0.cpe.net.cable.rogers.com.51494: Flags [P.], seq 20472:20684, ack 1, win 1452, length 212
20:41:22.664347 IP lamp-s-1vcpu-1gb-tor1-01.ssh > CPEf81d0fa9f3e3-CMf81d0fa9f3e0.cpe.net.cable.rogers.com.51494: Flags [P.], seq 20684:20896, ack 1, win 1452, length 212
20:41:22.664534 IP lamp-s-1vcpu-1gb-tor1-01.ssh > CPEf81d0fa9f3e3-CMf81d0fa9f3e0.cpe.net.cable.rogers.com.51494: Flags [P.], seq 20896:21108, ack 1, win 1452, length 212
20:41:22.666317 IP lamp-s-1vcpu-1gb-tor1-01.ssh > CPEf81d0fa9f3e3-CMf81d0fa9f3e0.cpe.net.cable.rogers.com.51494: Flags [P.], seq 21108:21320, ack 1, win 1452, length 212
20:41:22.666451 IP lamp-s-1vcpu-1gb-tor1-01.ssh > CPEf81d0fa9f3e3-CMf81d0fa9f3e0.cpe.net.cable.rogers.com.51494: Flags [P.], seq 21320:21532, ack 1, win 1452, length 212
20:41:22.666559 IP lamp-s-1vcpu-1gb-tor1-01.ssh > CPEf81d0fa9f3e3-CMf81d0fa9f3e0.cpe.net.cable.rogers.com.51494: Flags [P.], seq 21532:21744, ack 1, win 1452, length 212
20:41:22.666664 IP lamp-s-1vcpu-1gb-tor1-01.ssh > CPEf81d0fa9f3e3-CMf81d0fa9f3e0.cpe.net.cable.rogers.com.51494: Flags [P.], seq 21744:21956, ack 1, win 1452, length 212
20:41:22.666770 IP lamp-s-1vcpu-1gb-tor1-01.ssh > CPEf81d0fa9f3e3-CMf81d0fa9f3e0.cpe.net.cable.rogers.com.51494: Flags [P.], seq 21956:22168, ack 1, win 1452, length 212
20:41:22.666876 IP lamp-s-1vcpu-1gb-tor1-01.ssh > CPEf81d0fa9f3e3-CMf81d0fa9f3e0.cpe.net.cable.rogers.com.51494: Flags [P.], seq 22168:22380, ack 1, win 1452, length 212
20:41:22.666981 IP lamp-s-1vcpu-1gb-tor1-01.ssh > CPEf81d0fa9f3e3-CMf81d0fa9f3e0.cpe.net.cable.rogers.com.51494: Flags [P.], seq 22380:22592, ack 1, win 1452, length 212
20:41:22.667086 IP lamp-s-1vcpu-1gb-tor1-01.ssh > CPEf81d0fa9f3e3-CMf81d0fa9f3e0.cpe.net.cable.rogers.com.51494: Flags [P.], seq 22592:22804, ack 1, win 1452, length 212
20:41:22.667189 IP lamp-s-1vcpu-1gb-tor1-01.ssh > CPEf81d0fa9f3e3-CMf81d0fa9f3e0.cpe.net.cable.rogers.com.51494: Flags [P.], seq 22804:23016, ack 1, win 1452, length 212
20:41:22.667350 IP lamp-s-1vcpu-1gb-tor1-01.ssh > CPEf81d0fa9f3e3-CMf81d0fa9f3e0.cpe.net.cable.rogers.com.51494: Flags [P.], seq 23016:23228, ack 1, win 1452, length 212
20:41:22.667645 IP lamp-s-1vcpu-1gb-tor1-01.ssh > CPEf81d0fa9f3e3-CMf81d0fa9f3e0.cpe.net.cable.rogers.com.51494: Flags [P.], seq 23228:23440, ack 1, win 1452, length 212
20:41:22.667763 IP lamp-s-1vcpu-1gb-tor1-01.ssh > CPEf81d0fa9f3e3-CMf81d0fa9f3e0.cpe.net.cable.rogers.com.51494: Flags [P.], seq 23440:23652, ack 1, win 1452, length 212
20:41:22.673381 IP lamp-s-1vcpu-1gb-tor1-01.ssh > CPEf81d0fa9f3e3-CMf81d0fa9f3e0.cpe.net.cable.rogers.com.51494: Flags [P.], seq 23652:23864, ack 1, win 1452, length 212
20:41:22.673568 IP lamp-s-1vcpu-1gb-tor1-01.ssh > CPEf81d0fa9f3e3-CMf81d0fa9f3e0.cpe.net.cable.rogers.com.51494: Flags [P.], seq 23864:24076, ack 1, win 1452, length 212
20:41:22.673733 IP lamp-s-1vcpu-1gb-tor1-01.ssh > CPEf81d0fa9f3e3-CMf81d0fa9f3e0.cpe.net.cable.rogers.com.51494: Flags [P.], seq 24076:24288, ack 1, win 1452, length 212
20:41:22.673873 IP lamp-s-1vcpu-1gb-tor1-01.ssh > CPEf81d0fa9f3e3-CMf81d0fa9f3e0.cpe.net.cable.rogers.com.51494: Flags [P.], seq 24288:24500, ack 1, win 1452, length 212
20:41:22.673985 IP lamp-s-1vcpu-1gb-tor1-01.ssh > CPEf81d0fa9f3e3-CMf81d0fa9f3e0.cpe.net.cable.rogers.com.51494: Flags [P.], seq 24500:24712, ack 1, win 1452, length 212
20:41:22.674095 IP lamp-s-1vcpu-1gb-tor1-01.ssh > CPEf81d0fa9f3e3-CMf81d0fa9f3e0.cpe.net.cable.rogers.com.51494: Flags [P.], seq 24712:24924, ack 1, win 1452, length 212
20:41:22.674262 IP lamp-s-1vcpu-1gb-tor1-01.ssh > CPEf81d0fa9f3e3-CMf81d0fa9f3e0.cpe.net.cable.rogers.com.51494: Flags [P.], seq 24924:25136, ack 1, win 1452, length 212
20:41:22.674391 IP lamp-s-1vcpu-1gb-tor1-01.ssh > CPEf81d0fa9f3e3-CMf81d0fa9f3e0.cpe.net.cable.rogers.com.51494: Flags [P.], seq 25136:25348, ack 1, win 1452, length 212
20:41:22.674560 IP lamp-s-1vcpu-1gb-tor1-01.ssh > CPEf81d0fa9f3e3-CMf81d0fa9f3e0.cpe.net.cable.rogers.com.51494: Flags [P.], seq 25348:25560, ack 1, win 1452, length 212
20:41:22.674745 IP lamp-s-1vcpu-1gb-tor1-01.ssh > CPEf81d0fa9f3e3-CMf81d0fa9f3e0.cpe.net.cable.rogers.com.51494: Flags [P.], seq 25560:25772, ack 1, win 1452, length 212
20:41:22.674919 IP lamp-s-1vcpu-1gb-tor1-01.ssh > CPEf81d0fa9f3e3-CMf81d0fa9f3e0.cpe.net.cable.rogers.com.51494: Flags [P.], seq 25772:25984, ack 1, win 1452, length 212
20:41:22.675037 IP lamp-s-1vcpu-1gb-tor1-01.ssh > CPEf81d0fa9f3e3-CMf81d0fa9f3e0.cpe.net.cable.rogers.com.51494: Flags [P.], seq 25984:26196, ack 1, win 1452, length 212
20:41:22.675143 IP lamp-s-1vcpu-1gb-tor1-01.ssh > CPEf81d0fa9f3e3-CMf81d0fa9f3e0.cpe.net.cable.rogers.com.51494: Flags [P.], seq 26196:26408, ack 1, win 1452, length 212
20:41:22.675249 IP lamp-s-1vcpu-1gb-tor1-01.ssh > CPEf81d0fa9f3e3-CMf81d0fa9f3e0.cpe.net.cable.rogers.com.51494: Flags [P.], seq 26408:26620, ack 1, win 1452, length 212
20:41:22.675353 IP lamp-s-1vcpu-1gb-tor1-01.ssh > CPEf81d0fa9f3e3-CMf81d0fa9f3e0.cpe.net.cable.rogers.com.51494: Flags [P.], seq 26620:26832, ack 1, win 1452, length 212
20:41:22.675456 IP lamp-s-1vcpu-1gb-tor1-01.ssh > CPEf81d0fa9f3e3-CMf81d0fa9f3e0.cpe.net.cable.rogers.com.51494: Flags [P.], seq 26832:27044, ack 1, win 1452, length 212
20:41:22.675559 IP lamp-s-1vcpu-1gb-tor1-01.ssh > CPEf81d0fa9f3e3-CMf81d0fa9f3e0.cpe.net.cable.rogers.com.51494: Flags [P.], seq 27044:27256, ack 1, win 1452, length 212
20:41:22.675662 IP lamp-s-1vcpu-1gb-tor1-01.ssh > CPEf81d0fa9f3e3-CMf81d0fa9f3e0.cpe.net.cable.rogers.com.51494: Flags [P.], seq 27256:27468, ack 1, win 1452, length 212
20:41:22.675765 IP lamp-s-1vcpu-1gb-tor1-01.ssh > CPEf81d0fa9f3e3-CMf81d0fa9f3e0.cpe.net.cable.rogers.com.51494: Flags [P.], seq 27468:27680, ack 1, win 1452, length 212
20:41:22.675869 IP lamp-s-1vcpu-1gb-tor1-01.ssh > CPEf81d0fa9f3e3-CMf81d0fa9f3e0.cpe.net.cable.rogers.com.51494: Flags [P.], seq 27680:27892, ack 1, win 1452, length 212
20:41:22.675973 IP lamp-s-1vcpu-1gb-tor1-01.ssh > CPEf81d0fa9f3e3-CMf81d0fa9f3e0.cpe.net.cable.rogers.com.51494: Flags [P.], seq 27892:28104, ack 1, win 1452, length 212
20:41:22.676076 IP lamp-s-1vcpu-1gb-tor1-01.ssh > CPEf81d0fa9f3e3-CMf81d0fa9f3e0.cpe.net.cable.rogers.com.51494: Flags [P.], seq 28104:28316, ack 1, win 1452, length 212
20:41:22.676180 IP lamp-s-1vcpu-1gb-tor1-01.ssh > CPEf81d0fa9f3e3-CMf81d0fa9f3e0.cpe.net.cable.rogers.com.51494: Flags [P.], seq 28316:28528, ack 1, win 1452, length 212
20:41:22.676283 IP lamp-s-1vcpu-1gb-tor1-01.ssh > CPEf81d0fa9f3e3-CMf81d0fa9f3e0.cpe.net.cable.rogers.com.51494: Flags [P.], seq 28528:28740, ack 1, win 1452, length 212
20:41:22.676387 IP lamp-s-1vcpu-1gb-tor1-01.ssh > CPEf81d0fa9f3e3-CMf81d0fa9f3e0.cpe.net.cable.rogers.com.51494: Flags [P.], seq 28740:28952, ack 1, win 1452, length 212
20:41:22.676490 IP lamp-s-1vcpu-1gb-tor1-01.ssh > CPEf81d0fa9f3e3-CMf81d0fa9f3e0.cpe.net.cable.rogers.com.51494: Flags [P.], seq 28952:29164, ack 1, win 1452, length 212
20:41:22.676656 IP lamp-s-1vcpu-1gb-tor1-01.ssh > CPEf81d0fa9f3e3-CMf81d0fa9f3e0.cpe.net.cable.rogers.com.51494: Flags [P.], seq 29164:29376, ack 1, win 1452, length 212
20:41:22.676772 IP lamp-s-1vcpu-1gb-tor1-01.ssh > CPEf81d0fa9f3e3-CMf81d0fa9f3e0.cpe.net.cable.rogers.com.51494: Flags [P.], seq 29376:29588, ack 1, win 1452, length 212
20:41:22.676879 IP lamp-s-1vcpu-1gb-tor1-01.ssh > CPEf81d0fa9f3e3-CMf81d0fa9f3e0.cpe.net.cable.rogers.com.51494: Flags [P.], seq 29588:29800, ack 1, win 1452, length 212
20:41:22.676984 IP lamp-s-1vcpu-1gb-tor1-01.ssh > CPEf81d0fa9f3e3-CMf81d0fa9f3e0.cpe.net.cable.rogers.com.51494: Flags [P.], seq 29800:30012, ack 1, win 1452, length 212
20:41:22.677132 IP lamp-s-1vcpu-1gb-tor1-01.ssh > CPEf81d0fa9f3e3-CMf81d0fa9f3e0.cpe.net.cable.rogers.com.51494: Flags [P.], seq 30012:30224, ack 1, win 1452, length 212
20:41:22.677281 IP lamp-s-1vcpu-1gb-tor1-01.ssh > CPEf81d0fa9f3e3-CMf81d0fa9f3e0.cpe.net.cable.rogers.com.51494: Flags [P.], seq 30224:30436, ack 1, win 1452, length 212
20:41:22.677432 IP lamp-s-1vcpu-1gb-tor1-01.ssh > CPEf81d0fa9f3e3-CMf81d0fa9f3e0.cpe.net.cable.rogers.com.51494: Flags [P.], seq 30436:30648, ack 1, win 1452, length 212
20:41:22.677544 IP lamp-s-1vcpu-1gb-tor1-01.ssh > CPEf81d0fa9f3e3-CMf81d0fa9f3e0.cpe.net.cable.rogers.com.51494: Flags [P.], seq 30648:30860, ack 1, win 1452, length 212
20:41:22.677649 IP lamp-s-1vcpu-1gb-tor1-01.ssh > CPEf81d0fa9f3e3-CMf81d0fa9f3e0.cpe.net.cable.rogers.com.51494: Flags [P.], seq 30860:31072, ack 1, win 1452, length 212
20:41:22.677751 IP lamp-s-1vcpu-1gb-tor1-01.ssh > CPEf81d0fa9f3e3-CMf81d0fa9f3e0.cpe.net.cable.rogers.com.51494: Flags [P.], seq 31072:31284, ack 1, win 1452, length 212
20:41:22.677855 IP lamp-s-1vcpu-1gb-tor1-01.ssh > CPEf81d0fa9f3e3-CMf81d0fa9f3e0.cpe.net.cable.rogers.com.51494: Flags [P.], seq 31284:31496, ack 1, win 1452, length 212
20:41:22.677959 IP lamp-s-1vcpu-1gb-tor1-01.ssh > CPEf81d0fa9f3e3-CMf81d0fa9f3e0.cpe.net.cable.rogers.com.51494: Flags [P.], seq 31496:31708, ack 1, win 1452, length 212
20:41:22.680606 IP lamp-s-1vcpu-1gb-tor1-01.ssh > CPEf81d0fa9f3e3-CMf81d0fa9f3e0.cpe.net.cable.rogers.com.51494: Flags [P.], seq 31708:31920, ack 1, win 1452, length 212
20:41:22.680847 IP lamp-s-1vcpu-1gb-tor1-01.ssh > CPEf81d0fa9f3e3-CMf81d0fa9f3e0.cpe.net.cable.rogers.com.51494: Flags [P.], seq 31920:32132, ack 1, win 1452, length 212
20:41:22.680971 IP lamp-s-1vcpu-1gb-tor1-01.ssh > CPEf81d0fa9f3e3-CMf81d0fa9f3e0.cpe.net.cable.rogers.com.51494: Flags [P.], seq 32132:32344, ack 1, win 1452, length 212
20:41:22.681132 IP lamp-s-1vcpu-1gb-tor1-01.ssh > CPEf81d0fa9f3e3-CMf81d0fa9f3e0.cpe.net.cable.rogers.com.51494: Flags [P.], seq 32344:32556, ack 1, win 1452, length 212
20:41:22.681248 IP lamp-s-1vcpu-1gb-tor1-01.ssh > CPEf81d0fa9f3e3-CMf81d0fa9f3e0.cpe.net.cable.rogers.com.51494: Flags [P.], seq 32556:32768, ack 1, win 1452, length 212
20:41:22.681357 IP lamp-s-1vcpu-1gb-tor1-01.ssh > CPEf81d0fa9f3e3-CMf81d0fa9f3e0.cpe.net.cable.rogers.com.51494: Flags [P.], seq 32768:32980, ack 1, win 1452, length 212
20:41:22.681463 IP lamp-s-1vcpu-1gb-tor1-01.ssh > CPEf81d0fa9f3e3-CMf81d0fa9f3e0.cpe.net.cable.rogers.com.51494: Flags [P.], seq 32980:33192, ack 1, win 1452, length 212
20:41:22.681567 IP lamp-s-1vcpu-1gb-tor1-01.ssh > CPEf81d0fa9f3e3-CMf81d0fa9f3e0.cpe.net.cable.rogers.com.51494: Flags [P.], seq 33192:33404, ack 1, win 1452, length 212
20:41:22.681670 IP lamp-s-1vcpu-1gb-tor1-01.ssh > CPEf81d0fa9f3e3-CMf81d0fa9f3e0.cpe.net.cable.rogers.com.51494: Flags [P.], seq 33404:33616, ack 1, win 1452, length 212
20:41:22.681773 IP lamp-s-1vcpu-1gb-tor1-01.ssh > CPEf81d0fa9f3e3-CMf81d0fa9f3e0.cpe.net.cable.rogers.com.51494: Flags [P.], seq 33616:33828, ack 1, win 1452, length 212
20:41:22.681876 IP lamp-s-1vcpu-1gb-tor1-01.ssh > CPEf81d0fa9f3e3-CMf81d0fa9f3e0.cpe.net.cable.rogers.com.51494: Flags [P.], seq 33828:34040, ack 1, win 1452, length 212
20:41:22.681979 IP lamp-s-1vcpu-1gb-tor1-01.ssh > CPEf81d0fa9f3e3-CMf81d0fa9f3e0.cpe.net.cable.rogers.com.51494: Flags [P.], seq 34040:34252, ack 1, win 1452, length 212
20:41:22.682084 IP lamp-s-1vcpu-1gb-tor1-01.ssh > CPEf81d0fa9f3e3-CMf81d0fa9f3e0.cpe.net.cable.rogers.com.51494: Flags [P.], seq 34252:34464, ack 1, win 1452, length 212
20:41:22.682206 IP lamp-s-1vcpu-1gb-tor1-01.ssh > CPEf81d0fa9f3e3-CMf81d0fa9f3e0.cpe.net.cable.rogers.com.51494: Flags [P.], seq 34464:34676, ack 1, win 1452, length 212
20:41:22.682311 IP lamp-s-1vcpu-1gb-tor1-01.ssh > CPEf81d0fa9f3e3-CMf81d0fa9f3e0.cpe.net.cable.rogers.com.51494: Flags [P.], seq 34676:34888, ack 1, win 1452, length 212
20:41:22.682423 IP lamp-s-1vcpu-1gb-tor1-01.ssh > CPEf81d0fa9f3e3-CMf81d0fa9f3e0.cpe.net.cable.rogers.com.51494: Flags [P.], seq 34888:35100, ack 1, win 1452, length 212
20:41:22.682526 IP lamp-s-1vcpu-1gb-tor1-01.ssh > CPEf81d0fa9f3e3-CMf81d0fa9f3e0.cpe.net.cable.rogers.com.51494: Flags [P.], seq 35100:35312, ack 1, win 1452, length 212
20:41:22.682630 IP lamp-s-1vcpu-1gb-tor1-01.ssh > CPEf81d0fa9f3e3-CMf81d0fa9f3e0.cpe.net.cable.rogers.com.51494: Flags [P.], seq 35312:35524, ack 1, win 1452, length 212
20:41:22.682732 IP lamp-s-1vcpu-1gb-tor1-01.ssh > CPEf81d0fa9f3e3-CMf81d0fa9f3e0.cpe.net.cable.rogers.com.51494: Flags [P.], seq 35524:35736, ack 1, win 1452, length 212
20:41:22.682835 IP lamp-s-1vcpu-1gb-tor1-01.ssh > CPEf81d0fa9f3e3-CMf81d0fa9f3e0.cpe.net.cable.rogers.com.51494: Flags [P.], seq 35736:35948, ack 1, win 1452, length 212
20:41:22.682937 IP lamp-s-1vcpu-1gb-tor1-01.ssh > CPEf81d0fa9f3e3-CMf81d0fa9f3e0.cpe.net.cable.rogers.com.51494: Flags [P.], seq 35948:36160, ack 1, win 1452, length 212
20:41:22.683040 IP lamp-s-1vcpu-1gb-tor1-01.ssh > CPEf81d0fa9f3e3-CMf81d0fa9f3e0.cpe.net.cable.rogers.com.51494: Flags [P.], seq 36160:36372, ack 1, win 1452, length 212
20:41:22.683189 IP lamp-s-1vcpu-1gb-tor1-01.ssh > CPEf81d0fa9f3e3-CMf81d0fa9f3e0.cpe.net.cable.rogers.com.51494: Flags [P.], seq 36372:36584, ack 1, win 1452, length 212
20:41:22.683344 IP lamp-s-1vcpu-1gb-tor1-01.ssh > CPEf81d0fa9f3e3-CMf81d0fa9f3e0.cpe.net.cable.rogers.com.51494: Flags [P.], seq 36584:36796, ack 1, win 1452, length 212
20:41:22.683460 IP lamp-s-1vcpu-1gb-tor1-01.ssh > CPEf81d0fa9f3e3-CMf81d0fa9f3e0.cpe.net.cable.rogers.com.51494: Flags [P.], seq 36796:37008, ack 1, win 1452, length 212
20:41:22.683564 IP lamp-s-1vcpu-1gb-tor1-01.ssh > CPEf81d0fa9f3e3-CMf81d0fa9f3e0.cpe.net.cable.rogers.com.51494: Flags [P.], seq 37008:37220, ack 1, win 1452, length 212
20:41:22.683669 IP lamp-s-1vcpu-1gb-tor1-01.ssh > CPEf81d0fa9f3e3-CMf81d0fa9f3e0.cpe.net.cable.rogers.com.51494: Flags [P.], seq 37220:37432, ack 1, win 1452, length 212
20:41:22.683773 IP lamp-s-1vcpu-1gb-tor1-01.ssh > CPEf81d0fa9f3e3-CMf81d0fa9f3e0.cpe.net.cable.rogers.com.51494: Flags [P.], seq 37432:37644, ack 1, win 1452, length 212
20:41:22.683877 IP lamp-s-1vcpu-1gb-tor1-01.ssh > CPEf81d0fa9f3e3-CMf81d0fa9f3e0.cpe.net.cable.rogers.com.51494: Flags [P.], seq 37644:37856, ack 1, win 1452, length 212
20:41:22.683979 IP lamp-s-1vcpu-1gb-tor1-01.ssh > CPEf81d0fa9f3e3-CMf81d0fa9f3e0.cpe.net.cable.rogers.com.51494: Flags [P.], seq 37856:38068, ack 1, win 1452, length 212
20:41:22.684082 IP lamp-s-1vcpu-1gb-tor1-01.ssh > CPEf81d0fa9f3e3-CMf81d0fa9f3e0.cpe.net.cable.rogers.com.51494: Flags [P.], seq 38068:38280, ack 1, win 1452, length 212
20:41:22.684192 IP lamp-s-1vcpu-1gb-tor1-01.ssh > CPEf81d0fa9f3e3-CMf81d0fa9f3e0.cpe.net.cable.rogers.com.51494: Flags [P.], seq 38280:38492, ack 1, win 1452, length 212
20:41:22.684300 IP lamp-s-1vcpu-1gb-tor1-01.ssh > CPEf81d0fa9f3e3-CMf81d0fa9f3e0.cpe.net.cable.rogers.com.51494: Flags [P.], seq 38492:38704, ack 1, win 1452, length 212
20:41:22.684439 IP lamp-s-1vcpu-1gb-tor1-01.ssh > CPEf81d0fa9f3e3-CMf81d0fa9f3e0.cpe.net.cable.rogers.com.51494: Flags [P.], seq 38704:38916, ack 1, win 1452, length 212
20:41:22.684549 IP lamp-s-1vcpu-1gb-tor1-01.ssh > CPEf81d0fa9f3e3-CMf81d0fa9f3e0.cpe.net.cable.rogers.com.51494: Flags [P.], seq 38916:39128, ack 1, win 1452, length 212
20:41:22.684691 IP lamp-s-1vcpu-1gb-tor1-01.ssh > CPEf81d0fa9f3e3-CMf81d0fa9f3e0.cpe.net.cable.rogers.com.51494: Flags [P.], seq 39128:39340, ack 1, win 1452, length 212
20:41:22.684798 IP lamp-s-1vcpu-1gb-tor1-01.ssh > CPEf81d0fa9f3e3-CMf81d0fa9f3e0.cpe.net.cable.rogers.com.51494: Flags [P.], seq 39340:39552, ack 1, win 1452, length 212
20:41:22.684902 IP lamp-s-1vcpu-1gb-tor1-01.ssh > CPEf81d0fa9f3e3-CMf81d0fa9f3e0.cpe.net.cable.rogers.com.51494: Flags [P.], seq 39552:39764, ack 1, win 1452, length 212
20:41:22.685005 IP lamp-s-1vcpu-1gb-tor1-01.ssh > CPEf81d0fa9f3e3-CMf81d0fa9f3e0.cpe.net.cable.rogers.com.51494: Flags [P.], seq 39764:39976, ack 1, win 1452, length 212
20:41:22.685175 IP lamp-s-1vcpu-1gb-tor1-01.ssh > CPEf81d0fa9f3e3-CMf81d0fa9f3e0.cpe.net.cable.rogers.com.51494: Flags [P.], seq 39976:40188, ack 1, win 1452, length 212
20:41:22.685332 IP lamp-s-1vcpu-1gb-tor1-01.ssh > CPEf81d0fa9f3e3-CMf81d0fa9f3e0.cpe.net.cable.rogers.com.51494: Flags [P.], seq 40188:40400, ack 1, win 1452, length 212
20:41:22.685450 IP lamp-s-1vcpu-1gb-tor1-01.ssh > CPEf81d0fa9f3e3-CMf81d0fa9f3e0.cpe.net.cable.rogers.com.51494: Flags [P.], seq 40400:40612, ack 1, win 1452, length 212
20:41:22.685558 IP lamp-s-1vcpu-1gb-tor1-01.ssh > CPEf81d0fa9f3e3-CMf81d0fa9f3e0.cpe.net.cable.rogers.com.51494: Flags [P.], seq 40612:40824, ack 1, win 1452, length 212
20:41:22.685694 IP lamp-s-1vcpu-1gb-tor1-01.ssh > CPEf81d0fa9f3e3-CMf81d0fa9f3e0.cpe.net.cable.rogers.com.51494: Flags [P.], seq 40824:41036, ack 1, win 1452, length 212
20:41:22.685804 IP lamp-s-1vcpu-1gb-tor1-01.ssh > CPEf81d0fa9f3e3-CMf81d0fa9f3e0.cpe.net.cable.rogers.com.51494: Flags [P.], seq 41036:41248, ack 1, win 1452, length 212
20:41:22.685969 IP lamp-s-1vcpu-1gb-tor1-01.ssh > CPEf81d0fa9f3e3-CMf81d0fa9f3e0.cpe.net.cable.rogers.com.51494: Flags [P.], seq 41248:41460, ack 1, win 1452, length 212
20:41:22.686085 IP lamp-s-1vcpu-1gb-tor1-01.ssh > CPEf81d0fa9f3e3-CMf81d0fa9f3e0.cpe.net.cable.rogers.com.51494: Flags [P.], seq 41460:41672, ack 1, win 1452, length 212
20:41:22.686190 IP lamp-s-1vcpu-1gb-tor1-01.ssh > CPEf81d0fa9f3e3-CMf81d0fa9f3e0.cpe.net.cable.rogers.com.51494: Flags [P.], seq 41672:41884, ack 1, win 1452, length 212
20:41:22.686294 IP lamp-s-1vcpu-1gb-tor1-01.ssh > CPEf81d0fa9f3e3-CMf81d0fa9f3e0.cpe.net.cable.rogers.com.51494: Flags [P.], seq 41884:42096, ack 1, win 1452, length 212
20:41:22.686397 IP lamp-s-1vcpu-1gb-tor1-01.ssh > CPEf81d0fa9f3e3-CMf81d0fa9f3e0.cpe.net.cable.rogers.com.51494: Flags [P.], seq 42096:42308, ack 1, win 1452, length 212
20:41:22.686500 IP lamp-s-1vcpu-1gb-tor1-01.ssh > CPEf81d0fa9f3e3-CMf81d0fa9f3e0.cpe.net.cable.rogers.com.51494: Flags [P.], seq 42308:42520, ack 1, win 1452, length 212
20:41:22.686604 IP lamp-s-1vcpu-1gb-tor1-01.ssh > CPEf81d0fa9f3e3-CMf81d0fa9f3e0.cpe.net.cable.rogers.com.51494: Flags [P.], seq 42520:42732, ack 1, win 1452, length 212
20:41:22.686706 IP lamp-s-1vcpu-1gb-tor1-01.ssh > CPEf81d0fa9f3e3-CMf81d0fa9f3e0.cpe.net.cable.rogers.com.51494: Flags [P.], seq 42732:42944, ack 1, win 1452, length 212
20:41:22.686810 IP lamp-s-1vcpu-1gb-tor1-01.ssh > CPEf81d0fa9f3e3-CMf81d0fa9f3e0.cpe.net.cable.rogers.com.51494: Flags [P.], seq 42944:43156, ack 1, win 1452, length 212
20:41:22.686920 IP lamp-s-1vcpu-1gb-tor1-01.ssh > CPEf81d0fa9f3e3-CMf81d0fa9f3e0.cpe.net.cable.rogers.com.51494: Flags [P.], seq 43156:43368, ack 1, win 1452, length 212
20:41:22.687024 IP lamp-s-1vcpu-1gb-tor1-01.ssh > CPEf81d0fa9f3e3-CMf81d0fa9f3e0.cpe.net.cable.rogers.com.51494: Flags [P.], seq 43368:43580, ack 1, win 1452, length 212
20:41:22.687158 IP lamp-s-1vcpu-1gb-tor1-01.ssh > CPEf81d0fa9f3e3-CMf81d0fa9f3e0.cpe.net.cable.rogers.com.51494: Flags [P.], seq 43580:43792, ack 1, win 1452, length 212
20:41:22.687325 IP lamp-s-1vcpu-1gb-tor1-01.ssh > CPEf81d0fa9f3e3-CMf81d0fa9f3e0.cpe.net.cable.rogers.com.51494: Flags [P.], seq 43792:44004, ack 1, win 1452, length 212
20:41:22.687445 IP lamp-s-1vcpu-1gb-tor1-01.ssh > CPEf81d0fa9f3e3-CMf81d0fa9f3e0.cpe.net.cable.rogers.com.51494: Flags [P.], seq 44004:44216, ack 1, win 1452, length 212
20:41:22.687632 IP lamp-s-1vcpu-1gb-tor1-01.ssh > CPEf81d0fa9f3e3-CMf81d0fa9f3e0.cpe.net.cable.rogers.com.51494: Flags [P.], seq 44216:44428, ack 1, win 1452, length 212
20:41:22.687774 IP lamp-s-1vcpu-1gb-tor1-01.ssh > CPEf81d0fa9f3e3-CMf81d0fa9f3e0.cpe.net.cable.rogers.com.51494: Flags [P.], seq 44428:44640, ack 1, win 1452, length 212
20:41:22.687885 IP lamp-s-1vcpu-1gb-tor1-01.ssh > CPEf81d0fa9f3e3-CMf81d0fa9f3e0.cpe.net.cable.rogers.com.51494: Flags [P.], seq 44640:44852, ack 1, win 1452, length 212
20:41:22.687989 IP lamp-s-1vcpu-1gb-tor1-01.ssh > CPEf81d0fa9f3e3-CMf81d0fa9f3e0.cpe.net.cable.rogers.com.51494: Flags [P.], seq 44852:45064, ack 1, win 1452, length 212
20:41:22.688091 IP lamp-s-1vcpu-1gb-tor1-01.ssh > CPEf81d0fa9f3e3-CMf81d0fa9f3e0.cpe.net.cable.rogers.com.51494: Flags [P.], seq 45064:45276, ack 1, win 1452, length 212
20:41:22.688194 IP lamp-s-1vcpu-1gb-tor1-01.ssh > CPEf81d0fa9f3e3-CMf81d0fa9f3e0.cpe.net.cable.rogers.com.51494: Flags [P.], seq 45276:45488, ack 1, win 1452, length 212
20:41:22.688300 IP lamp-s-1vcpu-1gb-tor1-01.ssh > CPEf81d0fa9f3e3-CMf81d0fa9f3e0.cpe.net.cable.rogers.com.51494: Flags [P.], seq 45488:45700, ack 1, win 1452, length 212
20:41:22.688408 IP lamp-s-1vcpu-1gb-tor1-01.ssh > CPEf81d0fa9f3e3-CMf81d0fa9f3e0.cpe.net.cable.rogers.com.51494: Flags [P.], seq 45700:45912, ack 1, win 1452, length 212
20:41:22.688511 IP lamp-s-1vcpu-1gb-tor1-01.ssh > CPEf81d0fa9f3e3-CMf81d0fa9f3e0.cpe.net.cable.rogers.com.51494: Flags [P.], seq 45912:46124, ack 1, win 1452, length 212
20:41:22.688654 IP lamp-s-1vcpu-1gb-tor1-01.ssh > CPEf81d0fa9f3e3-CMf81d0fa9f3e0.cpe.net.cable.rogers.com.51494: Flags [P.], seq 46124:46336, ack 1, win 1452, length 212
20:41:22.688765 IP lamp-s-1vcpu-1gb-tor1-01.ssh > CPEf81d0fa9f3e3-CMf81d0fa9f3e0.cpe.net.cable.rogers.com.51494: Flags [P.], seq 46336:46548, ack 1, win 1452, length 212
20:41:22.688868 IP lamp-s-1vcpu-1gb-tor1-01.ssh > CPEf81d0fa9f3e3-CMf81d0fa9f3e0.cpe.net.cable.rogers.com.51494: Flags [P.], seq 46548:46760, ack 1, win 1452, length 212
20:41:22.688971 IP lamp-s-1vcpu-1gb-tor1-01.ssh > CPEf81d0fa9f3e3-CMf81d0fa9f3e0.cpe.net.cable.rogers.com.51494: Flags [P.], seq 46760:46972, ack 1, win 1452, length 212
20:41:22.689140 IP lamp-s-1vcpu-1gb-tor1-01.ssh > CPEf81d0fa9f3e3-CMf81d0fa9f3e0.cpe.net.cable.rogers.com.51494: Flags [P.], seq 46972:47184, ack 1, win 1452, length 212
20:41:22.689265 IP lamp-s-1vcpu-1gb-tor1-01.ssh > CPEf81d0fa9f3e3-CMf81d0fa9f3e0.cpe.net.cable.rogers.com.51494: Flags [P.], seq 47184:47396, ack 1, win 1452, length 212
20:41:22.689374 IP lamp-s-1vcpu-1gb-tor1-01.ssh > CPEf81d0fa9f3e3-CMf81d0fa9f3e0.cpe.net.cable.rogers.com.51494: Flags [P.], seq 47396:47608, ack 1, win 1452, length 212
20:41:22.689479 IP lamp-s-1vcpu-1gb-tor1-01.ssh > CPEf81d0fa9f3e3-CMf81d0fa9f3e0.cpe.net.cable.rogers.com.51494: Flags [P.], seq 47608:47820, ack 1, win 1452, length 212
20:41:22.689581 IP lamp-s-1vcpu-1gb-tor1-01.ssh > CPEf81d0fa9f3e3-CMf81d0fa9f3e0.cpe.net.cable.rogers.com.51494: Flags [P.], seq 47820:48032, ack 1, win 1452, length 212
20:41:22.689684 IP lamp-s-1vcpu-1gb-tor1-01.ssh > CPEf81d0fa9f3e3-CMf81d0fa9f3e0.cpe.net.cable.rogers.com.51494: Flags [P.], seq 48032:48244, ack 1, win 1452, length 212
20:41:22.689785 IP lamp-s-1vcpu-1gb-tor1-01.ssh > CPEf81d0fa9f3e3-CMf81d0fa9f3e0.cpe.net.cable.rogers.com.51494: Flags [P.], seq 48244:48456, ack 1, win 1452, length 212
20:41:22.689887 IP lamp-s-1vcpu-1gb-tor1-01.ssh > CPEf81d0fa9f3e3-CMf81d0fa9f3e0.cpe.net.cable.rogers.com.51494: Flags [P.], seq 48456:48668, ack 1, win 1452, length 212
20:41:22.689992 IP lamp-s-1vcpu-1gb-tor1-01.ssh > CPEf81d0fa9f3e3-CMf81d0fa9f3e0.cpe.net.cable.rogers.com.51494: Flags [P.], seq 48668:48880, ack 1, win 1452, length 212
20:41:22.690100 IP lamp-s-1vcpu-1gb-tor1-01.ssh > CPEf81d0fa9f3e3-CMf81d0fa9f3e0.cpe.net.cable.rogers.com.51494: Flags [P.], seq 48880:49092, ack 1, win 1452, length 212
20:41:22.692133 IP lamp-s-1vcpu-1gb-tor1-01.ssh > CPEf81d0fa9f3e3-CMf81d0fa9f3e0.cpe.net.cable.rogers.com.51494: Flags [P.], seq 49092:49304, ack 1, win 1452, length 212
20:41:22.692406 IP lamp-s-1vcpu-1gb-tor1-01.ssh > CPEf81d0fa9f3e3-CMf81d0fa9f3e0.cpe.net.cable.rogers.com.51494: Flags [P.], seq 49304:49516, ack 1, win 1452, length 212
20:41:22.692594 IP lamp-s-1vcpu-1gb-tor1-01.ssh > CPEf81d0fa9f3e3-CMf81d0fa9f3e0.cpe.net.cable.rogers.com.51494: Flags [P.], seq 49516:49728, ack 1, win 1452, length 212
20:41:22.692734 IP lamp-s-1vcpu-1gb-tor1-01.ssh > CPEf81d0fa9f3e3-CMf81d0fa9f3e0.cpe.net.cable.rogers.com.51494: Flags [P.], seq 49728:49940, ack 1, win 1452, length 212
20:41:22.692868 IP lamp-s-1vcpu-1gb-tor1-01.ssh > CPEf81d0fa9f3e3-CMf81d0fa9f3e0.cpe.net.cable.rogers.com.51494: Flags [P.], seq 49940:50152, ack 1, win 1452, length 212
20:41:22.692998 IP lamp-s-1vcpu-1gb-tor1-01.ssh > CPEf81d0fa9f3e3-CMf81d0fa9f3e0.cpe.net.cable.rogers.com.51494: Flags [P.], seq 50152:50364, ack 1, win 1452, length 212
20:41:22.693177 IP lamp-s-1vcpu-1gb-tor1-01.ssh > CPEf81d0fa9f3e3-CMf81d0fa9f3e0.cpe.net.cable.rogers.com.51494: Flags [P.], seq 50364:50576, ack 1, win 1452, length 212
20:41:22.693318 IP lamp-s-1vcpu-1gb-tor1-01.ssh > CPEf81d0fa9f3e3-CMf81d0fa9f3e0.cpe.net.cable.rogers.com.51494: Flags [P.], seq 50576:50788, ack 1, win 1452, length 212
